Words,Meaning,Sentence,Translation
気がある,to have an interest in something,危険を冒す気があるのか。,Are you willing to risk it?
気がすまない,"not able to settle down, not being satisfied",,
気が済む,"to be satisfied, feel better",小屋を調べれば気が済むだろう。,I would feel better if you checked the shed.
気がすすまない,disinclined to do,本当は気がすすまないんだ。,I don't really want to.
気がする,to have a certain mood or feeling,風呂に入りたい気がする。,I feel like I need to take a bath.
気がせく,"to feel under pressure, feel impatient",,
気が立つ,to be excited about,,
気が散る,to get distracted,痛みのせいで課題から気が散るためです。,Because the pain distracts them from the task.
気がつく,to notice,森の中で彼らは気がつくと危険が迫っていた。,In the forest they found themselves in danger.
気がとがめる,to feel guilty,,
気がない,to be uninterested,,
気がふさぐ,to feel depressed,,
気がふれる,to go mad,,
気が滅入る,to feel depressed,,
気が利く,"to be sensible, smart, tactful, thoughtful",あいつは気が利く。,He is smart.
気が勝つ,to be determined or strong,,
気が合う,to get along with someone,彼女とは気が合う。,She and I get along well.
気が向く,to feel like,,
気が回る,to be attentive to small details,,
気が変わる,to change one's mind,,
気が多い,fickle,,
気が大きい,generous,,
気が小さい,timid,,
気が差す,to feel uneasy,,
気が引ける,to feel awkward,,
気が弱い,timid,,
気が張る,to strain every nerve,,
気が強い,strong-willed,,
気が抜ける,to feel exhausted,,
気が揉める,to feel anxious,,
気が早い,short-tempered,,
気が晴れる,to feel refreshed,,
気が楽,feeling good,,
気が漫ろ,preoccupied,,
気が狂う,to go mad,,
気が短い,quick-tempered,,
気が取られる,be preoccupied with,,
気が紛れる,to be diverted or distracted from,,
気が緩む,to relax one's mind,,
気が腐る,to feel dispirited,,
気が若い,young at heart,,
気が荒い,bad-tempered,,
気が詰まる,to feel constrained,,
気が違う,to be mad,,
気が重い,depressed,,
気が長い,patient,,
気を配る,to pay attention,,
気をそらす,to distract,,
気を使う,to pay attention to another's needs,,
気を付ける,to be careful,,
気を呑まれる,to be overwhelmed,,
気を張る,to steel oneself to,,
気を揉む,to worry,,
気をよくする,to be pleased,,
気を付け,to stand to attention!,,
気を休める,to ease up,,
気を入れる,to do in earnest,,
気を利かせる,to take in the situation and make the smart move,,
気を取り直す,to completely rethink,,
気を吐く,to make a good showing,,
気を回す,to read too much into things,,
気を失う,to lose consciousness,,
気を引き立てる,to cheer,,
気を引き締める,to brace oneself,,
気を引く,to attract someone's affection,,
気を抜く,to lose focus,,
気を持たせる,to encourage someone to expect something,,
気を散じる,to distract a person's attention,,
気を散らす,to distract a person's attention,,
気を晴らす,to cheer someone up,,
気を病む,"to fret, worry",,
気を紛らす,to distract oneself,,
気を緩める,to relax one's attention,,
気を腐らす,to have the blues,,
気を落とす,to be discouraged,,
気を許す,to let one's guard down,,
気を静める,to becalm one's feelings,,
気を取られる,"to be pre-occupied with, distracted",,
気に入る,to be pleased with,,
気に掛かる,to weigh on one's mind,,
気にかける,to weigh on one's mind,,
気に障る,to hurt one's feelings,,
気にしない,not caring,,
気にする,to mind,,
気に留める,to keep in mind,,
気になる,to be on one's mind,,
気に召す,to like,,
気に病む,to worry,,
気のせい,in one's imagination,,
気の利く,attentive,,
気の多い,fickle,,
気の大きい,generous,,
気の小さい,timid,,
気の弱い,timid,,
気の早い,short-tempered,,
気の詰まる,constrained,,
気の迷い,delusion,それは一時期の気の迷いってやつだ。,That's just a passing fancy.
気が進まない,"reluctant to, unwilling to",あの人に頼むのはちょっと気が進まない。,I'm a little reluctant to ask that person.
取るに足りない,of little importance,,
音頭を取る ,to lead a group of people,,
角を取る,to round off the corners,,
間を取る ,to take the middle between the two,,
機会を取る,to take the opportunity to do something,,
機嫌を取る,"to carry favour, get in a good mood",,
賞を取る ,to win the prize,,
休憩を取る,to take a break,,
形を取る,to take the form of,,
元を取る,"to recover a cost, get the original",,
控えを取る,to take a copy of,,
行動を取る,to act,,
歳を取る,to grow old,,
主を取る,to find a new master,,
手を取る,to take someone's hand,,
手に取る,to take in one's hand,,
手間を取る,to be detained,,
重心を取る ,to balance oneself,,
出欠を取る,to take a roll call,,
出席を取る,to call the roll,,
城を取る,to take a castle,,
床を取る,to lay out one's bedding,,
笑いを取る,to get a laugh,,
場を取る,to occupy much space,,
場所を取る,to take up space,,
食事を取る,to take a meal,,
食費を取る,to charge for one's meal,,
睡眠を取る,to get sleep,,
責任を取る,to take responsibility for,,
先手を取る,to take the initiative,,
舵を取る,to steer a ship,,
態度を取る,to take an attitude,,
後れを取る,to fall behind,,
中を取る,to work out a compromise,,
朝食を取る,to take breakfast,,
調子を取る,to beat time,,
当たりを取る,to make a hit,,
同期を取る,to synchronize,,
箸を取る -,"to take up one's chopsticks, begin a meal",,
帽子を取る,to take off one's hat,,
脈を取る,to take a pulse,,
名を取る,to become famous,,
予約を取る,to make an appointment,,
裏を取る,to collect evidence,,
立場を取る,to take a position,,
連絡を取る,to get in touch with,,
魚を取る,to catch fish,,
面を取る,to plane off the corners,,
満点を取る,to get full marks,,
段を取る,to get a black belt,,
逆手に取る,to use somebody's argument against them,,
決を取る,to take a vote,,
バランスを取る,to keep balance,,
意味を取る,"to follow the sense, understand the meaning of",全く新しい意味を取る。,Take on a whole new meaning.
大事を取る,to take care doing something,彼に関しては大事を取るため出場を見送った。,"As for him, he did not take part in the event to take care of a serious matter."
相撲を取る,to wrestle with,,
焼き付ける,"put marks by press-heating, attach something by heating",どら焼きは表面に菊の模様を焼き付けている。,The dorayaki has a chrysanthemum pattern baked on the surface.
盛り付ける,"dish up, arrange food on a platter",マグロの刺身を皿に盛り付けた。,Tuna sashimi was placed on the plate.
書き付ける,write down,私は店の名前を手帳に書きつけた。,I wrote the name of the restaurant in my notebook.
取り付ける,"install, obtain an agreement, secure a contract",互換性のあるケーブルを取り付ける必要があります。,You need to install a compatible cable.
受け付ける,"accept, receive, able to take",セッションはクライアント接続を受け付ける準備が整っています。,Session is ready to accept client connections.
乗り付ける,"to ride up to, to get used to riding",タクシーで会場に乗り付ける。,Take a cab to the venue.
見付ける,"to discover, find, detect, locate",この困難を克服する道を見付けることでありましょう。,We will find a way to overcome this difficulty.
裏付ける,"to support, back up, substantiate, prove",裏付ける証拠は何もなかった。,There was no supporting evidence.
気配もない,show no sign or indication of,何かが聴こえてくる気配もない。,There is no indication that anything is audible.
心を打った,struck a chord,,
心を込めて,wholeheartedly,,
心に残って,remains in my heart,,
目がない,extremely fond of,海の幸に目がない。,I'm extremely fond of seafood.
目に入らない,out of one's sight,相手以外は誰も目に入らない。,No one is in sight except the other party.
耳が遠い,poor hearing,彼女の犬は耳が遠い。,Her dog has poor hearing.
目に入った,"got insight, came insight , came into view",,
口にする,"to taste, eat, drink, speak of, put into words, refer to",聞かれた事以外は口にするな。,Don't speak unless asked.
顔を出す,"to turn up, make an appearance, drop by",彼らはしょっちゅう家に顔を出す。,They often show up at home.
手につかない,"unable to focus on, unable to concentrate on",全然勉強が手につかない。,I can't get any study done at all.
手に入れない,"unable to get, unable to obtain",大量の物を手に入れない。,We don't get a lot of stuff.
愛想がいい,"amiable, cheerful",彼女はだれにでも愛想がいい。,She is amiable to everyone.
センスがいい,having good taste,この広告はセンスがいいね。,This ad is in good taste.
気立てがいい,good-natured,彼女は気立てがいい。,She is good-natured.
思いやりがある,"compassionate, considerate",彼は弱者に深い思いやりがある。,He has deep compassion for the weak.
近寄りがたい,unapproachable,冷静沈着な人物で近寄りがたい人柄。,He is a calm and collected person with an unapproachable personality.
冷静に対応します,calmly respond,どんなトラブルにも冷静に対応します。,We will handle any problems calmly.
冷静に落ち着いて,stay cool and calm,冷静に落ち着いてください。,Please remain calm and composed.
冷静に行動します,act calmly,節度を守って冷静に行動しましょう。,Keep moderation and act calmly.
冷静に対処します,handle it calmly,冷静に対処しなきゃ。,We have to deal with it calmly.
穏やかにかき混ぜる,stir gently,終わるまで穏やかにかき混ぜる。,Stir gently until done.
穏やかに流れる,flow gently,川を穏やかに流れる。,The river flows gently.
穏やかに降る,fall gently,雪が穏やかに降っていました。,Snow was falling gently.
穏やかに説明します,explain it gently,状況を穏やかに説明してあげて。,Explain the situation calmly.
無表情な顔,blunt look,このような無表情な顔の結果として。,As a result of such a blank look.
声明を述べる,make a statement,声明を述べるのが好きね。,I like the way you make statements.
代わりを述べる,"speak in place of, mention an alternative",多数は私が既に与えてしまった代わりを述べる。,Many would mention the alternatives I've already given.
自分の考えを述べる,express your own thoughts,英語で自分の考えを述べるのは難しい。,It is difficult to express my thoughts in English.
