Sentence,Translation,Verb,Reading,Meaning
結果を出して,Produce good result,出す,だす,"out out, take out, submit, produce"
優秀な人材を揃えた,Have excellent people in place,揃える,そろえる,"collect, gather, arrange, put in place"
新たに設けられた,Newly established,設ける,もうける,"prepare, provide, set up, establish"
キャリアアップに繋がる,Leads to career advancement,繋がる,つながる,"connected to, link to, lead to"
運命を変える,Change one's fate,変える,かえる,"change, alter, reform, revise"
見つかって良かった,Glad you found it,見つかる,みつかる,"be found, be discovered"
これでランチに行けるよ,Now we can go to lunch,行ける,いける,"can go, can do"
しっかり補佐を頼む,Make sure he's well assisted,頼む,たのむ,"request, call, ask, order, rely on"
未来の可能性を開拓しましょう,Explore future possibilities,開拓する,かいたくする,"reclaim, cultivate, develop"
状況はちゃんと把握しろよ,Get the situation right,把握する,はあくする,"understand, grasp, hold, grip"
バスが停まっている間ね,While the bus is stopped,停まる,とまる,"stop, cease, come to a halt"
思わず笑みを浮かべるような一皿,A dish that makes you smile,浮かべる,うかべる,"set afloat, launch, recall, show on one’s face"
それが本作を推した理由である,That is the reason I endorse this work,推す,おす,"recommend, endorse, infer, deduce, think through"
それはもともと推定された,It was originally estimated,推定する,すいていする,"presume, assume, estimate"
学校を推薦します,I recommend the school,推薦する,すいせんする,"recommend, refer, endorse"
特定の操作の意味を推測します,Guess the meaning of a particular operation,推測する,すいそくする,"guess, speculate, suppose"
事件を推理してみろ,Try to deduce the case,推理する,すいりする,"reason, infer, deduce"
当社はこの企画を推進している,Our company is promoting this project,推進する,すいしんする,"drive, propel, promote, push forward, advance"
違ったように推論するはずです,They would reason differently,推論する,すいろんする,"infer, deduce, reason"
一進一退で推移した,It went back and forth,推移する,すいいする,"change, shift, transit, progress"
講義から類推すると,By analogy from the lecture,類推する,るいすいする,"analyze, infer, analogical inference"
兵庫県に引っ越す,Move to Hyogo Prefecture,引っ越す,ひっこす,"move, change residence"
ロープを引っ張った,I pulled the rope,引っ張る,ひっぱる,"pull, draw, drag, lead"
途中で引っかかって,Caught in the middle,引っかかる,ひっかかる,"be caught in, be stuck in, stop by, get entangled in"
家に引っ込んでいる,Staying indoors,引っ込む,ひっこむ,"draw back, cave in, sink, retire"
クレーンに引っ掛けることもできます,Can be hooked to a crane,引っ掛ける,ひっかける,"hang, hook, catch, trap, cheat"
シールがぴったり引っ付く,Stickers stick perfectly,引っ付く,ひっつく,"stick to, cling to, adhere to, get close"
サービス業の会社として創業致しました,Established as a service company,創業する,そうぎょうする,"found, establish"
周りからも言われるんですよね,People tell me that,言われる,いわれる,"got to say, got to tell, got told"
将来の後取り息子として生まれました,Born as the son of a future successor,生まれる,うまれる,to be born
この日に任務を引き継ぐ,I take over the mission on this day,引き継ぐ,ひきつぐ,"take over, hand over"
また再び同じことが繰り返されるのです,And it will happen all over again,繰り返す,くりかえす,"to repeat, do over again"
人々が美味しいと言ってくれるようなお菓子,Treats that people will say are delicious,言ってくれる,いってくれる,"they say, people say"
お菓子をいっぱい作りたいです,I want to make lots of sweets,作りたい,つくりたい,want to make
ずっとそういう風に思っておりました,That's what I've always thought,思っておりました,おもっておりました,"have thought, have been thinking"
これらの規則は誰にも同じように当てはまる,These rules apply equally to everyone,当てはまる,あてはまる,"to apply, be applicable, hold true, fit, suit"
人前で口汚く罵られた,Cursed me verbally in public,罵る,ののしる,"to abuse, curse at, speak ill of"
どんな服装にも馴染むシンプルなデザイン,Simple design that blends in with any outfit,馴染む,なじむ,"become familiar with, get used to, adapt to, fit in"
スープにもう少し塩を足してください,Add a little more salt to the soup,足す,たす,"to add, top up, take care of"
彼を仲間に加えたらどうだろうか,Maybe we should add him to our ranks,加える,くわえる,"to add, sum up, increase, include, count in, give"
今出掛けるところだと答えた,He replied that he was going out right away,答える,こたえる,"answer, reply"
暗くならないうちに目的地に着いた,We reached our destination before dark,着く,つく,"to arrive at, reach at, sit at"
彼女は女優になることを志した,She aspired to be an actress,志す,こころざす,"to plan, intend, aspire to, set aims"
地震がその地域を襲った,An earthquake struck the area,襲う,おそう,"attack, assail, strike, assault, succeed"
その変化は目立つほどではなかった,The change was less than noticeable,目立つ,めだつ,"be conspicuous, stand out, attract attention"
私たちは危険を避けようとした,We tried to avoid danger,避ける,さける,"avoid, dodge, evade, shun"
または表面が黄金になるまで焼く,Or bake until surface is golden brown,焼く,やく,"to burn, roast, grill, toast, bake, heat up, tan"
ここでは酒の販売は禁じられている,The sale of alcohol is forbidden here,禁じる,きんじる,to prohibit
彼は音楽にふけっている,He indulges in music,耽る,ふける,"indulge in, be obsessed by, be absorbed in"
我々は生きるために食べる,We eat so we may live,生きる,いきる,"to live, exist, make a living, be in use"
現実が起こってしまいます,Reality happens,起こる,おこる,"to occur, happen"
出ようと思うとは考えてもいなかったです,I never thought about leaving,考えてもいなかった,かんがえてもいなかった,hadn't thought of it
埼玉の夏がもう耐えられなくて,I couldn't stand the summer in Saitama anymore,耐えられなくて,たえられなくて,couldn't stand it
頭打ちになっていったので,As it became a headache,なっていった,なっていった,"was in the process of becoming, was developing into"
大学に行って帰ってきたら ,When I went to college and came back.,帰ってきたら,かえってきたら,when i came back
寮に戻ってきて,Back at the dorms,戻ってきて,もどってきて,come back here
練習にも行かないで,Don't even go to practice,行かないで,いかないで,without going
何も残っていないことに気がつきました,I realized there was nothing left,気がつく,きがつく,"to notice, realize, become aware of"
自分が出来ないかもしれないな,I might not be able to do it myself,出来ない,できない,not be able to
製造の現場の方に入りました,I went into the production floor,入る,はいる,"enter, come in, get in, join, be brought in"
体温を外の気温を同じくらいまで下げる,Lower body temperature to same level as the outside,下げる,さげる,"to hang, suspend, wear, lower, reduce"
冬眠から目覚めると,When you wake up from hibernation,目覚めると,めざめると,when wake up
心臓の心拍をきちんと保っています,Keeps the heart beating properly,保っています,たもっています,"keep, preserve, hold, maintain, sustain"
この仕組みが解明されれば,Once this mechanism is understood,解明されれば,かいめいされれば,"once figured out, once understood"
病気の予防への応用が期待されています,Potential applications in disease prevention,期待されています,きたいされています,expected to
冬眠に適応できるようにはなっていないのです,They are not adapted for hibernation,適応できる,てきおうできる,"adaptable, able to adapt, able to conform"
魚が真っ黒に焦げてしまった,The fish was burnt black,焦げる,こげる,"to burn, be burned"
彼の腕を捻った,I twisted his arm,捻る,ひねる,"to twist, turn, bend, work out"
到着が遅れても構わない,I don't care if I arrive late,構う,かまう,"to mind, care about, look after"
食事をしながらゆっくり喋た,We talked slowly over dinner,喋る,しゃべる,"to talk, chat"
彼は１時間で追いつくだろう,He'll catch up in an hour,追いつく,おいつく,"catch up, draw level, pull even"
想定外を追いかけるのが楽しい,Enjoy chasing the unexpected,追いかける,おいかける,"to chase, run after, pursue"
車は一気にスピードを上げてトラックを追い越した,The car sped up at once and passed the truck,追い越す,おいこす,"to pass, overtake, surpass, outstrip"
多くのランナーズを追い抜く,Overtaking many runners,追い抜く,おいぬく,"to pass, overtake, surpass, outstrip"
台所からその猫を追い出してくれ,Chase the cat out of the kitchen,追い出す,おいだす,"to expel, drive out"
牛を囲いに追い込んだ,They drove the cattle into an enclosure,追い込む,おいこむ,"to herd, drive, corner, chase, corral"
生産性の向上を積極的に追求する,Aggressively pursue productivity gains,追求する,ついきゅうする,"pursuit, seek, search"
世界中でそうした追試をしています,Conducting such follow-up tests all over the world,追試する,ついしする,"replicate, reproduce, verify, make up"
