Phrase,Translate,Details
今ザワザワして持ってきてくれてるみたいですよ。,"・It's like they're bringing it to us in a buzz now. <br>・It seems that they're bringing me something exciting now.","・持ってきてくれてる - Bringing something for me.
<br>・みたいですよ - Looks like."
和気あいあいとしているんですよ。,"・It's a friendly atmosphere. <br>・This means that people are friendly and harmonious with each other.","・和気あいあい - Harmonious or friendly.
<br>・和気あいあいとしているんですよ- It’s currently in state where regarded as harmonious or friendly."
今届けていただきました。,"・It has just been delivered. <br>・I just received it.","・届けていただきました - Received a delivery. <br>・ていただきました - A humble way to express gratitude for the other person which you had received something."
可愛いくないですか。,"・Isn't it cute? <br>・Isn't it pretty?","・可愛いくないですか - This is a rhetorical question that implies that something is cute and you expect the listener to agree with you. <br>・ないですか - Ask a question in negative form. Isn’t it? or Won’t you?"
言ってくれてるのでみなさんの願いことは叶いますね。,"・I'm sure everyone's wishes will come true since you said it. <br>・Since you are telling me, everyone’s wishes will come true.","・言ってくれてるので - Because you said it to me. <br>・願いこと - A thing you wish for. <br>・叶います - To come true, fulfilled or to be realized."
明日は楽しんでいただきたいと思います。,"・I hope you will enjoy yourselves tomorrow. <br>・I hope to enjoy tomorrow.","・と思います - I think that. <br>・楽しんでいただきたい - Hope you enjoy it. <br>・でいただきたい - Would like to have or would like to receive something."
似顔絵を描いてもらいに行きたいと思います。,"・I would like to go there to have my portrait painted. <br>・I would like to go have a portrait drawn.","・に行きたい - Would like to go there to. <br>・似顔絵を描いてもらいに - Have someone to draw a portrait."
いやもう超でこういうご縁を頂いた事にも感謝です。,"・I am also grateful for the opportunity to have this kind of relationship with you. <br>・No, I'm also grateful for this kind of connection.","・いやもう - Interjection. いや - means no. もう - already or enough. <br>・超でこういうご縁 - This kind of super chance. 超で - Put it in the range of super. こういう - such this way. ご縁 - chance or fate. <br>・頂いた事にも感謝です - It is a gratitude to receive this kind of a thing."
少しでも近づけされる嬉しいなと思います。,"・I'm glad to be able to get as close as possible. <br>・I would be happy if we could get as close as possible.","・少しでも - Even though its little. <br>・近づけされる - get to close or come near. <br>・嬉しいなと思います - I was glad thinking about it."
