Function,Pattern,Details,Sample,Translate
Order-Command-Instruct,"・見ろ・見よ・見ろよ・座って・食べる・ <br>・行きな・投げます・暗記しなさい・ <br>・来るように・提出のこと・ <br>・確認してください・お座りください・ <br>・お立ち願います・","・Vroot + ro ⇢ Vro (Grp.2 Verbs) <br>・Vroot+ yo ⇢ Vyo (Grp.2 Verbs) <br>・Vroot + ro yo ⇢ Vyoro (Grp.2 Verbs) <br>・Vte <br>・Vru <br>・Vnoun-stem + na <br>・Vmasu <br>・Vru + koto ・Vnoun+ no koto <br>・Vte + kudasai <br>・O + Vnoun-stem + kudasai <br>・O + Vnoun-stem + negaimasu","・目の前にある証拠をよく見ろ。 <br>・防衛体制を見よ。 <br>・もう少し長い目で見ろよ。 <br>・ソファに座って。 <br>・新鮮な果物や野菜をたくさん食べる。 <br>・よその店へ行きな。 <br>・コップを投げます。 <br>・まずは公式を暗記しなさい。 <br>・５時までには必ずここに来るように。 <br>・利用前日までに必ず申込書を提出のこと。 <br>・メモリー要件を確認してください。 <br>・指定された座席にお座りください。 <br>・そこにお立ち願います。","・Look at the evidence in front of you. <br>・Look at the defense system. <br>・Take a longer look. <br>・Sit on the couch. <br>・Eat lots of fresh fruits and vegetables. <br>・Go to the store. <br>・Throw the cup. <br>・Memorize the formula first. <br>・Be sure to be here by 5:00. <br>・Be sure to submit the application form at least one day prior to use. <br>・Please check the memory requirement. <br>・Please sit in your assigned seat. <br>・Please stand there."
Request 1,"・採ってください・お申し込みください・ <br>・削除しないでください・ご確認願います・ <br>・伝えてくれ・預かってくれないか・ <br>・コピーしてくれますか・ <br>・説明してくれませんか・ <br>・言ってくださいますか・","・Vte + kudasai <br>・O + Vnoun-stem + kudasai <br>・Vnaide + kudasai <br>・Go + Vnoun + negaimasu <br>・Vte + kure <br>・Vte + kurenai ka <br>・Vte + kuremasu ka <br>・Vte + kuremasen ka <br>・Vte + kudasaimasu ka","・水分をたくさん採ってください。 <br>・下記フォームからお申し込みください。 <br>・修正または削除しないでください。 <br>・詳細については技術情報をご確認願います。 <br>・公式説明を彼らに伝えてくれ。 <br>・この本預かってくれないか。 <br>・これをコピーしてくれますか。 <br>・そのルールを私に説明してくれませんか。 <br>・もう一度言ってくださいますか。","・Drink plenty of water. <br>・Please apply using the form below. <br>・Do not modify or delete. <br>・Please refer to the technical information for details. <br>・Give them the official explanation. <br>・Can you take care of this book? <br>・Can you copy this for me? <br>・Can you explain those rules to me? <br>・Could you say that again?"
Request 2,"・見せてもらえる・取ってもらえない・ <br>・渡してもらえます・開けてもらえませんか・ <br>・出ていただけるか・送っていただけませんか・ <br>・ないでくれないか・しないでもらえませんか・ <br>・たいんですが・もらいたいんですが・ <br>・いただきたいんですが・ <br>・確認して欲しいんですが・ <br>・お願いします・ ","・Vte + moraeru? <br>・Vte + moraenai? <br>・Vte + moraemasu? <br>・Vte + moraemasen ka <br>・Vte + itadakeru ka <br>・Vte + itadakemasen ka <br>・Vnaide + kurenai ka <br>・Vnaide + moraemasen ka <br>・Vtai + n desu ga <br>・Vte + moraitai n desu ga <br>・Vte + itadakitai n desu ga <br>・Vte + hoshii n desu ga <br>・Onegaishimasu ","・招待状を見せてもらえる？ <br>・連絡を取ってもらえない？ <br>・彼にメッセージを渡してもらえます？ <br>・トランクを開けてもらえませんか。 <br>・外に出ていただけるか。 <br>・どのような資料でも送っていただけませんか。 <br>・この質問を二度としないでくれないか。 <br>・邪魔しないでもらえませんか。 <br>・一番安い車を１週間借りたいんですが。 <br>・ここでちょっと考えてもらいたいんですが。 <br>・理解していただきたいんですが。 <br>・明日のパーティの前菜を確認して欲しいんですが。 <br>・東京駅までお願いします。","・Can I see your invitation?
<br>・Could you get in touch with them? <br>・Can you give him a message for me? <br>・Could you please open the trunk? <br>・Can you please step outside? <br>・Could you please send us any materials? <br>・Please don't ask me this question again. <br>・Could you please not interrupt me? <br>・I'd like to rent the cheapest car for a week. <br>・I'd like you to think for a moment here. <br>・I just want to make sure you understand. <br>・I need you to confirm the appetizers for tomorrow's party. <br>・To Tokyo Station, please.
"
