Function,Pattern,Details,Sample,Translate
Order-Command-Instruct,"・見ろ。Look. <br>・見よ。Behold. <br>・見ろよ。Look here. <br>・座って。Sit down. <br>・食べる。Eat. <br>・行きな。Go away. <br>・投げます。Throw away. <br>・暗記しなさい。Memorize. <br>・来るように。Come. <br>・提出のこと。Submission. <br>・確認してください。Please confirm. <br>・お座りください。Please sit down. <br>・お立ち願います。Please sit down.","・Vroot + ro ⇢ Vro (Grp.2 Verbs) <br>・Vroot+ yo ⇢ Vyo (Grp.2 Verbs) <br>・Vroot + ro yo ⇢ Vyoro (Grp.2 Verbs) <br>・Vte <br>・Vru <br>・Vnoun-stem + na <br>・Vmasu <br>・Vru + koto ・Vnoun+ no koto <br>・Vte + kudasai <br>・O + Vnoun-stem + kudasai <br>・O + Vnoun-stem + negaimasu","・目の前にある証拠をよく見ろ。 <br>・防衛体制を見よ。 <br>・もう少し長い目で見ろよ。 <br>・ソファに座って。 <br>・新鮮な果物や野菜をたくさん食べる。 <br>・よその店へ行きな。 <br>・コップを投げます。 <br>・まずは公式を暗記しなさい。 <br>・５時までには必ずここに来るように。 <br>・利用前日までに必ず申込書を提出のこと。 <br>・メモリー要件を確認してください。 <br>・指定された座席にお座りください。 <br>・そこにお立ち願います。","・Look at the evidence in front of you. <br>・Look at the defense system. <br>・Take a longer look. <br>・Sit on the couch. <br>・Eat lots of fresh fruits and vegetables. <br>・Go to the store. <br>・Throw the cup. <br>・Memorize the formula first. <br>・Be sure to be here by 5:00. <br>・Be sure to submit the application form at least one day prior to use. <br>・Please check the memory requirement. <br>・Please sit in your assigned seat. <br>・Please stand there."
Command-Obligate,"・食べるな。Do not eat. <br>・忘れないで。Don’t forget. <br>・変更しないでください。Please do not change. <br>・心配しなくてもいい。You don’t have to worry. <br>・混ぜてはいけません。You must not mix. <br>・判断してはいけない。You must not judge. <br>・使わないこと。Do not use. <br>・迷うことはない。You don’t get lost. <br>・忘れないように。Don’t forget. <br>・捨てるべからず。Do not throw away. <br>・立ち入るべからざる。Do not enter. <br>・知るまじき。Must not know. <br>・取るまでもない。There is no need to take.","・Vru + na <br>・Vnai + de <br>・Vnai + de kudasai <br>・Vnai ⇢ Vnakute + mo ii <br>・Vnai ⇢ Vnakute + wa ikemasen <br>・Vnai ⇢ Vnakute + wa ikenai <br>・Vnai + koto <br>・Vru + koto + wa nai <br>・Vnai + you ni <br>・Vru + bekarazu <br>・Vru + bekarazaru <br>・Vru + majiki <br>・Vru + made mo nai","・夕食の前に全部食べるなよ。 <br>・歯みがきとブラシを忘れないで。 <br>・このスケジュールを変更しないでください。 <br>・資金のことについて心配しなくてもいいですよ。 <br>・異なるバージョンの内容を混ぜてはいけません。 <br>・人を外見で判断してはいけない。 <br>・新しいプログラムでは使わないこと。 <br>・特に指示画面で迷うことはない。 <br>・持ち物を置き忘れないように。 <br>・ここにゴミ捨てるべからず。 <br>・立ち入るべからざる。 <br>・知るまじき真実。 <br>・その件については部長に許可を取るまでもない。","・Don't eat it all before dinner. <br>・Don't forget the toothpaste and brush. <br>・Do not change this schedule. <br>・Do not worry about the funds. <br>・Do not mix the contents of different versions. <br>・Do not judge a person by his or her appearance. <br>・Do not use in new programs. <br>・Do not get lost on the instruction screen. <br>・Do not leave your belongings behind. <br>・Do not throw garbage here. <br>・Do not enter. <br>・The truth you must not know. <br>・Do not need to ask permission from the director on that matter."
Forbid-Prohibit,"・買ってはだめ。Do not buy. <br>・停止しては困ります。Please do not stop. <br>・立ち入りを禁ず。No entry. <br>・撮影禁止です。No photography. <br>・喫煙厳禁です。No smoking. <br>・無断利用はお断りします。Unauthorized use is prohibited. <br>・作成は禁止されています。Creation is forbidden. <br>・超えないことになっています。You are not supposed to exceed.","・Vte + wa dame desu <br>・Vte + wa komarimasu <br>・N + wo kinzu <br>・N + kinshi + desu <br>・N + genkin + desu <br>・N + wa + okotowari shimasu <br>・N + kinshi sareteimasu <br>・Vnai + koto ni natteimasu","・大金で宝くじを買ってはだめですよ。 <br>・通信品質の問題で業務が停止しては困ります。 <br>・部外者の立ち入りを禁ず。 <br>・残念ながら館内は撮影禁止です。 <br>・会場内は喫煙厳禁です。 <br>・商用目的での無断利用はお断りします。 <br>・新規アカウントの作成は禁止されています。 <br>・原則として1日8時間を超えないことになっています。","・Don't buy lottery tickets with large sums of money. <br>・Outsiders are not allowed to enter. <br>・Unfortunately, photography is not allowed inside the museum. <br>・Smoking is strictly prohibited in the venue. <br>・Unauthorized use for commercial purposes is prohibited. <br>・Creation of new accounts is prohibited. <br>・As a general rule, the workday is not to exceed 8 hours per day."
Request,"・採ってください。Please pick. <br>・お申し込みください。Please apply. <br>・削除しないでください。Please do not delete. <br>・ご確認願います。Please confirm. <br>・伝えてくれ。Tell me. <br>・預かってくれないか。Won’t you keep it for me? <br>・コピーしてくれますか。Can you copy it for me? <br>・説明してくれませんか。Could you explain it to me? <br>・言ってくださいますか。Will you say it?","・Vte + kudasai <br>・O + Vnoun-stem + kudasai <br>・Vnaide + kudasai <br>・Go + Vnoun + negaimasu <br>・Vte + kure <br>・Vte + kurenai ka <br>・Vte + kuremasu ka <br>・Vte + kuremasen ka <br>・Vte + kudasaimasu ka","・水分をたくさん採ってください。 <br>・下記フォームからお申し込みください。 <br>・修正または削除しないでください。 <br>・詳細については技術情報をご確認願います。 <br>・公式説明を彼らに伝えてくれ。 <br>・この本預かってくれないか。 <br>・これをコピーしてくれますか。 <br>・そのルールを私に説明してくれませんか。 <br>・もう一度言ってくださいますか。","・Drink plenty of water. <br>・Please apply using the form below. <br>・Do not modify or delete. <br>・Please refer to the technical information for details. <br>・Give them the official explanation. <br>・Can you take care of this book? <br>・Can you copy this for me? <br>・Can you explain those rules to me? <br>・Could you say that again?"
Request,"・見せてもらえる。Can I see it. <br>・取ってもらえない。Can’t I get it. <br>・渡してもらえます。Can you give it to me. <br>・開けてもらえませんか。Could you open it for me? <br>・出ていただけるか。Can you go out? <br>・送っていただけませんか。Could you send it to me? <br>・ないでくれないか。Won’t you stop doing it? <br>・しないでもらえませんか。Could you not do it? <br>・たいんですが。Want to but. <br>・もらいたいんですが。Want to receive but. <br>・いただきたいんですが。Want to accept but. <br>・確認して欲しいんですが。Want to confirm but. <br>・お願いします。Please. <br>・なしでお願いします。Please without it.","・Vte + moraeru? <br>・Vte + moraenai? <br>・Vte + moraemasu? <br>・Vte + moraemasen ka <br>・Vte + itadakeru ka <br>・Vte + itadakemasen ka <br>・Vnaide + kurenai ka <br>・Vnaide + moraemasen ka <br>・Vtai + n desu ga <br>・Vte + moraitai n desu ga <br>・Vte + itadakitai n desu ga <br>・Vte + hoshii n desu ga <br>・Onegaishimasu <br>・Nashi + de + onegaishimasu ","・招待状を見せてもらえる？ <br>・連絡を取ってもらえない？ <br>・彼にメッセージを渡してもらえます？ <br>・トランクを開けてもらえませんか。 <br>・外に出ていただけるか。 <br>・どのような資料でも送っていただけませんか。 <br>・この質問を二度としないでくれないか。 <br>・邪魔しないでもらえませんか。 <br>・一番安い車を１週間借りたいんですが。 <br>・ここでちょっと考えてもらいたいんですが。 <br>・理解していただきたいんですが。 <br>・明日のパーティの前菜を確認して欲しいんですが。 <br>・東京駅までお願いします。 <br>・8日以内に差し引きなしでお願い致します。 ","・Can I see your invitation?
<br>・Could you get in touch with them? <br>・Can you give him a message for me? <br>・Could you please open the trunk? <br>・Can you please step outside? <br>・Could you please send us any materials? <br>・Please don't ask me this question again. <br>・Could you please not interrupt me? <br>・I'd like to rent the cheapest car for a week. <br>・I'd like you to think for a moment here. <br>・I just want to make sure you understand. <br>・I need you to confirm the appetizers for tomorrow's party. <br>・To Tokyo Station, please.
<br>・Please allow 8 days without any deductions."
Compulsion,"・出席しないわけにはいかない。I can’t afford not to attend. <br>・変えざるをえない。I have no choice but to change. <br>・感心しないではいられない。I can’t help but admire. <br>・飲まずにはいられない。I can’t resist drinking. <br>・手術せずにはすまない。I can’t get away without surgery. <br>・与えずにはおかない。I won’t let go without giving. <br>・巻き込まないではおかない。I won’t let go without involving. <br>・怒りを禁じ得ない。I can’t suppress my anger. <br>・支配を余儀なくさせる。I force domination. <br>・負担を余儀なくされている。I am forced to bear the burden.
","・Vnai + wakeni wa ikanai <br>・Vnai ⇢ Vzaru +  o  enai <br>・Vnaide + wa irarenai <br>・Vnai ⇢ Vzuni  + wa irarenai <br>・Vnai ⇢ Vzuni +  wa sumanai <br>・Vnai ⇢ Vzuni +  wa okanai <br>・Vnaide + wa okanai <br>・N + o kinji enai <br>・N + o yoginaku saseru <br>・N + o yoginaku sareru","・弟の結婚式なので出席しないわけにはいかない。 <br>・我々は計画を変えざるをえない。 <br>・あなたの新車に感心しないではいられない。 <br>・頭が痛いときは鎮痛剤を飲まずにはいられない。 <br>・手術せずにはすまないだろう。 <br>・強い印象を与えずにはおかない。 <br>・会社全体を巻き込まないではおかない。 <br>・税金を納めている県民として怒りを禁じ得ない。 <br>・彼は我々の支配を余儀なくさせた。 <br>・国民は高い税金の負担を余儀なくされている。 
","・It is my brother's wedding and I cannot afford not to attend. <br>・We have no choice but to change our plans. <br>・I can't help but admire your new car. <br>・When I have a headache, I can't help but take painkillers. <br>・He would have to be operated on. <br>・It does not fail to make a strong impression. <br>・It cannot be left without involving the entire company. <br>・As a taxpaying citizen of the prefecture, I cannot help but be outraged. <br>・He forced us to take control. <br>・The public is forced to bear the burden of high taxes. "
Object Concerned,"・勉強する人のため。For those who study. <br>・町の歴史について。About the history of the town. <br>・問題に関して。Regarding the problem.
<br>・認証に対して。Towards authentication. <br>・要望に応えて。Responding to the request. <br>・減税法案をめぐって。Over the tax cut bill. <br>・商用事業者向けに。For commercial operators. <br>・初心者向きに。For beginners.","・N + no tame + no・ni <br>・N + ni tsuite <br>・N + ni kanshite <br>・N + ni taishite <br>・N + ni kotaete <br>・N + o megutte <br>・N + muke ni <br>・N + muki ni","・これは日本語を勉強する人のための本です。  <br>・この町の歴史について調べています。 <br>・この問題に関してもう少し考える必要がある。 <br>・認証に対して新しい構成ファイルを生成します。 <br>・お客様からの要望に応えてサポートを再開する。 <br>・候補者たちは減税法案をめぐって応酬しました。 <br>・商用事業者向けに開催されます。 <br>・テキストは初心者向きにできている。","・This is a book for those studying Japanese. <br>・I am researching about the history of this town. <br>・I need to think a little more in relation this issue. <br>・Generate a new configuration file for authentication. <br>・Resume support in response to customer requests. <br>・The candidates exchanged arguments over the tax cut bill. <br>・It will be held for commercial businesses. <br>・The text is designed for beginners."
Conjecture,"・分かるだろう。You will understand. <br>・増えるでしょう。It will increase. <br>・多すぎるかもしれない。It might be too much. <br>・かかるらしい。It seems to take. <br>・出せるだろうと思う。I think I can put out. <br>・明確なようだ。It seems clear. <br>・やって来たみたいだ。It looks like it came. <br>・勉強するはずだ。I should study. <br>・本当のはずがない。It can’t be true. <br>・回復は望めまい。Recovery is unlikely. <br>・出るのではあるまいか。Isn’t it going to come out?","・Plain form + darou <br>・Plain form + deshou <br>・Plain form + kamoshirenai <br>・Plain form + rashii <br>・Plain form + darou to omou <br>・Plain form・Na-Adj+na・N+no + you da <br>・Plain form + mitai da <br>・Plain form・Na-Adj+na・N+no + hazu da <br>・Plain form・Na-Adj+na・N+no + hazu ga nai <br>・Vru・Vneg-stem + mai・Na-Adj・N + dewa aru mai <br>・Plain form・Na-Adj+na・N + no dewa aru mai ka","・結果はまもなく分かるだろう。 <br>・この快挙によってもっと会員が増えるでしょう。 <br>・しかしこの見積もりは多すぎるかもしれない。 <br>・車で移動すると約6時間かかるらしい。 <br>・近いうちに結果は出せるだろうと思う。 <br>・彼の意図はかなり明確なようだ。 <br>・とうとう夏がやって来たみたいだ。 <br>・学生は当然必死に勉強するはずだ。 <br>・この報道は本当のはずがない。 <br>・安易な対策では景気の早期回復は望めまい。  <br>・今年も米の生産に影響が出るのではあるまいかと心配だ。","・We will know the results shortly. <br>・This accomplishment will bring more members. <br>・But this estimate may be too much. <br>・It seems it takes about 6 hours to drive by car. <br>・I think we will be able to get results in the near future. <br>・His intentions seem pretty clear. <br>・It seems summer has finally arrived. <br>・Students should naturally study hard. <br>・This report cannot be true. <br>・Easy measures will not bring about a quick economic recovery. <br>・I am concerned that rice production will be affected again this year."
