Script,Translation
中国で生まれ、日本で育ち、世界に進出した「ラーメン」世界に数多ある料理の中で、「ラーメン」という料理ほど独特な存在はなく、同時に「ラーメン店」という業態も他の飲食店には見られない独特な業態である。 ラーメンの源流が中国の麺料理にあることは、客観的に見ても間違いのないところである。日本で最初にラーメンを出したと言われる『来々軒』（浅草・1910年創業）は、焼売（シューマイ）や中華丼なども提供する大衆向けの中華料理店であった。ラーメン店のルーツは大衆中華料理店だったのだ。 戦後になると日本蕎麦（そば）の流れをくむラーメン店も登場するようになった。つけ麺発祥の『大勝軒』のルーツでもある『丸長中華そば店』（荻窪・1948年創業）や、東京ラーメンの代表格として知られる『春木屋』（荻窪・1948年創業）などは、いずれも蕎麦の名産地である信州出身者が創業した店であり、中華料理の文脈は入って来ない。ラーメンのアイコンとしても知られる「なると」は、元来日本蕎麦に用いられていた具材の転用だ。 さらに日本全国の土地土地の文化と密接につながった「ご当地ラーメン」の存在も見逃せない。地域ごとに異なる歴史を経て生み出されたラーメンの数々は、インターネットの普及とともに全国に知れ渡り、一躍「ご当地ラーメンブーム」が興った。 中国で生まれた麺料理が日本の食文化と融合し、今ではフレンチやイタリアン、あるいは東南アジアの料理などの技術も包含しながら加速度的に進化し続けている。ヴィーガン（完全菜食主義者）やSDGs（持続可能な開発目標）などライフスタイルや時代のトレンドもキャッチしつつ、世界各国で人気となり、代表的日本食としての地位を獲得した。それでいて、麺もスープも具材も一つとして同じラーメンはない多様性を持つ。このようにものすごいスピードで進化、変化し続けて、バリエーションも無限にある料理はラーメンしかないと言っても良いだろう。,"“Born in China, Raised in Japan, Ramen” Makes Its Way Around the World Among the many cuisines in the world, none is more unique than “ramen,” and at the same time, the “ramen restaurant” is a unique type of business not found in any other restaurant. There is no doubt that ramen originated in Chinese noodle cuisine, even if one looks at it objectively. Rairaiken” (Asakusa, established in 1910), which is said to be the first restaurant in Japan to serve ramen, was a Chinese restaurant for the masses that also served shao mai (fried pork dumplings) and Chinese rice bowls. Ramen restaurants had their roots in popular Chinese restaurants. In the postwar period, ramen restaurants that were derived from Japanese soba (buckwheat noodles) also began to appear. Marunaga Chinese Ramen Shop” (Ogikubo, established in 1948), which is also the root of “Daisho-ken,” the birthplace of tsukemen, and “Harukiya” (Ogikubo, established in 1948), known as a representative of Tokyo ramen, were both founded by people from Shinshu, a famous soba noodle production area, and do not include Chinese cuisine in their context. Naruto, also known as the iconic ramen, is a diversion of an ingredient originally used in Japanese soba noodles. Furthermore, one cannot overlook the existence of “local ramen,” which is closely connected to the local culture of each region throughout Japan. The ramen that has been created in different regions through different histories became well known throughout Japan with the spread of the Internet, and a “local ramen boom” was born. Noodle cuisine, which originated in China, has fused with Japanese food culture and is now evolving at an accelerated pace, incorporating techniques from French, Italian, and Southeast Asian cuisines. It has also caught on to lifestyle and current trends such as veganism and the Sustainable Development Goals (SDGs), becoming popular in countries around the world and gaining a position as a representative Japanese food. Yet, no two ramen dishes are alike in terms of noodles, soup, and ingredients. It is safe to say that ramen is the only cuisine that continues to evolve and change at such a rapid pace and offers unlimited variations.



"
豚骨ラーメンが世界を制した理由とは そのような背景がありつつも、やはりラーメンやラーメン店自体に魅力がなければ、飲食店が多いニューヨークの街で受け入れられることはなかっただろう。その魅力の一つとして考えられるのは「豚骨スープ」が持つ圧倒的な旨味だ。 豚の骨を炊いたスープはイノシン酸を豊富に含んでいる。そこに昆布などのグルタミン酸やシイタケなどのグアニル酸を含んだタレを加えることで、旨味の相乗効果が生まれる。旨味こそ日本食最大のアドバンテージであり、他の料理ではなかなかまねのできないことだ。 実際、前述した『IPPUDO』をはじめ、海外に進出している日本のラーメンチェーンの多くは豚骨ラーメン店である。また、宗教上などの理由で豚骨スープを出せないエリアでは鶏を白濁するまで煮込んだ「鶏白湯（とりぱいたん）」と呼ばれるスープで提供している店が多い。今でこそ白濁していないスープを出すラーメン店も増えているが、ブレイクスルーするタイミングで豚骨スープや鶏白湯などの「白濁スープ」が与えた影響は少なくないと考えられる。 豚骨スープとは、その名の通り豚の骨を煮込んで白濁乳化させたものだ。これは他の料理には見られないスープであり、しかも一杯あたり300cc以上もの量が提供されるような料理はなかなかない。そのため当初米国や欧州では、ラーメンは麺料理というよりもスープ料理として認知されていた。日本では麺は全て食べてスープを残すことがあるが、欧米ではスープは全て飲み干されて麺が残されることもある。 これまで海外では日本のラーメンを模倣したり、日本のラーメン店が進出したりするケースがほとんどであったが、最近では、その国オリジナルのラーメン店も生まれている。日本各地のご当地ラーメンのように、その国の文化や食生活に根付いた、その国ならではの個性豊かなラーメンが、今後急速に増えていくことだろう。,"What is the reason why Tonkotsu Ramen has conquered the world? Even with this background, if ramen and ramen restaurants themselves were not appealing, they would not have been accepted in New York City, where there are many restaurants and eateries. One of the possible reasons is the overwhelming flavor of the “pork bone soup. Soup made from cooked pork bones is rich in inosinic acid. The addition of a sauce containing glutamic acid from kelp and guanylic acid from shiitake mushrooms creates a synergistic effect of umami. Umami is the greatest advantage of Japanese cuisine, and it is something that is difficult to imitate in other cuisines. In fact, many of the Japanese ramen chains that have expanded overseas, including the aforementioned”IPPUDO,” are pork-based ramen restaurants. In areas where pork bone broth cannot be served for religious or other reasons, many restaurants use a soup called “toripaitan,” in which chicken is boiled until it becomes cloudy. Although there are now an increasing number of ramen stores that serve soup that is not cloudy, the influence of “cloudy soups” such as pork bone soup and chicken white soup on the timing of breakthroughs is not small. Pork bone soup, as the name implies, is made by boiling pork bones and emulsifying them into a cloudy white emulsion. This is a soup that cannot be found in any other dish, and it is not easy to find a dish in which more than 300 cc of soup is served per serving. For this reason, ramen was initially recognized in the United States and Europe as a soup dish rather than a noodle dish. In Japan, the noodles are sometimes eaten in their entirety and the soup is left behind, whereas in the West, the soup is sometimes drunk in its entirety and the noodles are left behind. In the past, most ramen restaurants in other countries have imitated Japanese ramen or Japanese ramen restaurants have expanded into other countries, but recently, original ramen restaurants in those countries have been created. Like the local ramen of other parts of Japan, we can expect to see a rapid increase in the number of unique ramen restaurants that are rooted in the culture and dietary habits of the country in which they are located.



"
"突然スマホに「登録完了」が表示された！裁判所から書類が届き民事訴訟に……無視できない悪質詐欺の現実
スマホでアダルトサイトを閲覧していると、突然画面に「登録完了」という文字が出て10万円を請求されてしまった……という知人がいます。
明らかなワンクリック詐欺ですが、見ていたサイトがサイトだけに、恥ずかしくて誰にも相談できないと知人は頭を抱えていました。このようなトラブルに遭遇した場合、いったいどうすればよいのでしょうか？
ワンクリック詐欺とは？よくある事例も紹介
ワンクリック詐欺とは、メールやインターネットサイトに表示されているURLを一度クリックしただけで一方的に入会などの契約成立が宣言されてしまい、高額な料金の支払いを求められる詐欺のことです。
例えば、以下のような事例があります。
・サイト上のコンテンツをダウンロードして「年齢確認」のボタンをクリックしたら料金請求画面が表示された。
・アプリをダウンロードして会員登録などの手続きを行った後、アプリを起動したら高額料金を請求された。
画面上には料金の請求とプロバイダや端末情報など、自分自身の情報も表示されるので、恐怖を感じて支払ってしまう……というケースも少なくありません。
ワンクリック詐欺に遭ったらどう対処したらいい？
ワンクリック詐欺に遭遇してしまったとしても、慌てずに無視しましょう。
民法第95条（改正民法）には「意思表示は、（中略）錯誤が法律行為の目的及び取引上の社会通念に照らして重要なものであるときは、取り消すことができる」とあります。
これは、相手からの一方的な請求、また勘違いによる契約は取り消し対象になることがある、という意味です。また、そもそも契約というものは申し込みの意思表示がなければ成立しません。したがって、ワンクリック詐欺の多くではそもそも契約自体が成立しておらず、高額料金を請求されたとしても、支払い義務は発生しないということになります。しつこい請求や脅し文句も無視しておきましょう。メールが来た場合にも返信してはいけません。
請求画面にIPアドレスやプロバイダ情報が表示されたとしても、個人情報が漏洩したわけではないので安心してください。端末情報やIPアドレスだけで住所や氏名、電話番号といった個人情報を特定することはできません。不安だからとメールに返信したり、相手に問い合わせたりしてしまうと、そこから個人情報が知られてしまいます。最善の対処方法は「無視」だということを覚えておいてください。
何度戻るボタンをタップしても請求画面が消えない場合は、アプリやブラウザを閉じて閲覧履歴（キャッシュ）を削除するとよいでしょう。
ワンクリック詐欺の注意点！無視してはいけないケースとは
ワンクリック詐欺の基本的な対処法は「無視」ですが、なかには例外もあります。それは、個人情報が抜き取られてしまっている場合です。
例えば、アダルトサイトなどの「無料登録で見放題」といったリンクをクリックして、住所や電話番号などの個人情報を入力してしまった場合に、後日封書や電話で高額請求の案内が来ることがあります。
また、「ワンクリックウェア」に引っかかってしまった場合も注意が必要です。ワンクリックウェアとは動画のダウンロードなどを介してデバイスに侵入するウイルスのようなものです。いくら画面を閉じても何度も何度もブラウザが立ち上がって、そのたびに請求画面が表示されます。こうなると、まともにスマホやパソコンが使用できなくなってしまうので、根負けしてお金を払ってしまう人も少なくありません。
また、メールアドレスや電話番号などの個人情報を抜き取られてしまうケースもあるので注意が必要です。
裁判所から書類が届いた場合の対処法
裁判所から「特別送達」という書類が届くことがありますが、この場合は無視してはいけません。
民事訴訟は、住所と名前さえ分かれば誰でも起こすことができます。そのため、個人情報が抜き取られていたら正規の手続きで料金を請求されてしまいます。この状態で無視してしまうと、裁判に負けてしまい、財産などが差し押さえられてしまう可能性があります。
ただし、裁判所の書類を装ったニセの書類…ということもあるので、書類が届いた場合は、裁判所に連絡をして本物かどうかを確かめるようにしましょう。
ワンクリック詐欺に遭った場合は無視か専門家に相談を
ワンクリック詐欺に引っかかった場合は、焦らずに「無視」することが基本です。しかし、個人情報が抜き取られてしまった場合、もしくは抜き取られているのか不安な場合は、消費生活センターや国民生活センターに相談しましょう。
裁判になってしまった場合は「法テラス」に、金銭を支払ってしまった場合は各都道府県警サイバー犯罪相談窓口に相談ができます。いずれにせよ、自己流で解決しようとせず、必ず専門家に相談することが大切です。","Suddenly my phone shows ""registration complete!"" Court documents arrived and civil lawsuit ...... is a malicious scam reality that cannot be ignored!
I have an acquaintance, ......, who was browsing an adult site on his smartphone when suddenly the words ""Registration Complete"" appeared on the screen and he was charged 100,000 yen.

It was clearly a one-click fraud, but the acquaintance was too embarrassed to talk to anyone about it because of the site he was browsing. What should you do if you encounter this kind of trouble?

What is one-click fraud? Common cases are also introduced.

One-click fraud is a scam in which a contract such as membership is unilaterally declared to have been concluded just by clicking once on a URL displayed in an e-mail or on an Internet site, and you are asked to pay a hefty fee.

For example, the following cases are examples.

After downloading content on the site and clicking the ""age verification"" button, a fee request screen is displayed.

After downloading an application and completing membership registration and other procedures, a high fee was charged when the application was launched.

In many cases, the billing screen displays the billing information and your own information, such as provider and device information, so you may feel fear and pay the bill. ......

What should I do if I encounter one-click fraud?

If you encounter a one-click fraud, do not panic and ignore it.

Article 95 of the Civil Code (Revised Civil Code) states, ""A declaration of intent may be rescinded (omitted) if the miscomprehension is material in light of the purpose of the legal act and socially accepted ideas in the transaction.

This means that a unilateral request from the other party or a contract made due to a misunderstanding may be subject to revocation. In the first place, a contract cannot be formed without a declaration of intent to apply. Therefore, in many cases of one-click fraud, the contract itself is not concluded, and the obligation to pay does not arise even if a high fee is charged. Ignore persistent claims and threats. Do not reply to any email you receive.

Even if your IP address or provider information appears on the billing screen, rest assured that your personal information has not been compromised. Device information and IP addresses alone cannot be used to identify personal information such as address, name, or phone number. If you reply to the e-mail or contact the person because you are worried, your personal information will be known from there. Please remember that the best course of action is to ""ignore"" the message.

If the billing screen does not disappear no matter how many times you tap the back button, you may want to close the application or browser and delete your browsing history (cache).

A warning about one-click scams! What are the cases you should not ignore?

The basic response to one-click fraud is to ignore it, but there are some exceptions. However, there are some exceptions, such as when personal information has been extracted.

For example, if you click on a ""free registration for unlimited viewing"" link on an adult site and enter personal information such as your address and phone number, you may receive a letter or phone call later informing you of an expensive bill.

You should also be careful if you fall for ""one-clickware. One-clickware is a kind of virus that invades your device via video downloads and other means. No matter how many times you close the screen, the browser will start up again and again, each time displaying a billing screen. When this happens, many people lose patience and pay the money because they can no longer use their phones or computers properly.

Also, be aware that in some cases, personal information such as e-mail addresses and phone numbers are extracted.

What to do if you receive a document from the court

You may receive a document called a ""special delivery"" from the court, but in this case you should not ignore it.

Anyone can file a civil suit as long as they know your name and address. Therefore, if your personal information has been extracted, you will be charged a fee through regular procedure. If you ignore the situation, you may lose the court case and your property and other assets may be seized.

If you receive a document, contact the court to confirm whether it is genuine or not.

If you fall for one-click fraud, ignore it or consult a specialist.

If you are caught in a one-click fraud, the basic rule is to ""ignore"" it without hesitation. However, if your personal information has been extracted, or if you are worried about whether your personal information has been extracted, consult a consumer affairs center or the National Consumer Affairs Center.

If you have gone to court, you can consult with ""Houterasu"" (Law Terrace), and if you have paid money, you can consult with the Cyber Crime Consultation Desk of each prefectural police department. In any case, it is important not to try to solve the problem on your own, but always consult with a specialist. Translated with www.DeepL.com/Translator (free version)"