Script.EP1,Meaning.EP1,Script.EP2,Meaning.EP2,Script.EP3,Meaning.EP3,Script.EP4,Meaning.EP4,Script.EP5,Meaning.EP5,Script.EP6,Meaning.EP6,Script.EP7,Meaning.EP7,Script.EP8,Meaning.EP8,Script.EP9,Meaning.EP9,Script.EP10,Meaning.EP10,Script.EP11,Meaning.EP11,Script.EP12,Meaning.EP12
前も言ったよね 営業 いきなり来られても困るんだって,I've already told you before that I don’t want you coming here unannounced with a sales pitch.,うまいこと言うね,That sounds right.,へぇ 何があったんすか？,I see. What happened?,できました これで大丈夫？,I'm done. Is this all right?,俺が女の子に着てほしい衣装は 一つだけだよ,There's only one dress I want to see a girl wear.,,,,,,,,,,,,,,
エ？ ここにウチの者 来たことあるんですか？,Someone came here already?,けど 彼はまだゲキカラドウの 入口に立ったばかりだ,But he's only at the entrance to the way of the hot and spicy.,いや それは まぁ,This and that.,はい ありがとうございます,Yes. Thank you very much.,（サクラ） え なになに？ 気になる,What is it? I want to know.,,,,,,,,,,,,,,
あるよ チャラいにいちゃんが,Yeah! A young frivolous kid., ピーマン 今お安いですよ 130円,Is one enough? -Thank you. These are on sale right now for 130 yen.,教えてくださいよ パイセンと俺の仲じゃないすか,Why can't you tell me? Aren't we friends?,あ いやいや…,No. I should be thanking you,ウエディングドレス ヤダ ウケる,-A wedding dress. -That's so funny.,,,,,,,,,,,,,,
あっ すみません 以前も伺ってるとは知らず,I apologize. I didn’t know we came here already.,めっちゃ安いっすね,It's so cheap.,今日の授業 全然わからんかってんけど,I didn't understand today's lesson at all.,本当ありがとね 僕たちのために こんな遅い時間まで,No. I should be thanking you for working overtime for us.,（健太）アカン ここだけ 全然盛り上がってへん,Oh no. We're the only ones not having fun.,,,,,,,,,,,,,,
そんなことだから ヨントリーや ハッスルコーラに勝てないんだよ,This is why you can’t win against Yontori or Hustle Cola.,でも これだけ安いって ワケありなんじゃないすか？,I bet there's a reason why it's so cheap.,いや ほんまに難しかった,It was hard.,あ いえ 皆さん お困りかと思ったので,Not at all. I figured everyone could use some help.,すごいっしょ？ うちの部署 激辛好きが多いんだ,Isn't our team amazing? Everyone loves spicy food.,,,,,,,,,,,,,,
でも 改めてお話をさせて いただけないでしょうか,Can you let me explain our products once more?,おい,Hey!,教えてや いいよ いいよ,Can you help me? -Sure.,うちの部長 ちょっと 厳しすぎるところがあるんですよ,Our manager tends to be a little too strict.,猿川さんも？,"-You too, Mr. Sarukawa? -I recently got into it.",,,,,,,,,,,,,,
おたくさ 何年営業やってるか わかんないけど,"I don’t know how long you’ve been in sales,",すみません お待たせして,Sorry to keep you waiting.,マジで？ テスト近いし,Really? -The test is coming up.,優しいんだね 高宮さん,You're very kind.,あ うん 最近ハマり始めて アカリさんは？,"-You too, Mr. Sarukawa? -I recently got into it. What about you? Do you have a favorite food?",,,,,,,,,,,,,,
状況はちゃんと把握しろよ,but why don’t you try to grasp the situation here? Where was I?,あ いや こちらこそ お忙しい中…,Not at all. Thanks for seeing us.,タケちゃん,Take…,お願いします,Please process this.,なんか好きな食べ物とか ありますか？,What about you? Do you have a favorite food?,,,,,,,,,,,,,,
俺 どこにいたの？ え？ 奥でしょ？,but why don’t you try to grasp the situation here? Where was I? -I was in the back. -Yes.,あの 昨日は我が社の者が 失礼しました あ いやいや,I apologize for the inconvenience caused by our co-worker.,俺の彼女と何やってんだ？,What are you doing with my girlfriend?,遅い 何時だと思ってるんだ,It's late. Do you know what time it is right now?,あ あ あ ちなみに僕 あの⸺,"By the way,",,,,,,,,,,,,,,
奥でパソコンやってたの 仕事してんだ 忙しいんだこっちは,I was working on the computer back there. I’m busy working.,お詫びも兼ねて もう一度だけ いやいやいや お詫びだなんて,To compensate-- -Please don't worry about that.,あ いや 由美ちゃんは俺の彼女ですけど,What? Yumi is my girlfriend.,すみません,I'm sorry.,めっちゃ お好み焼き得意なんです,I'm very good at making okonomiyaki.,,,,,,,,,,,,,,
なのに突然やって来て え？ 都合良すぎんじゃないですか,You think you can come here unannounced? Isn’t that a bit selfish?,僕がお聞きしたいのは 一つだけなんです,I just want an answer to one question.,なんだと？,What did you say?,ったく お前は毎度毎度 余計なことを,You're always doing unnecessary things like this.,コツは余計なアレンジを せえへんこと,The key is to keep it simple.,,,,,,,,,,,,,,
申し訳ありません 謝りゃいいんですか？,I’m very sorry. -Words are cheap.,え？,What?,ちょ ちょっと ちょっとやめて ふたりとも,Stop it.,もういい あとはやっておく,You can go. I'll do the rest.,お好み焼きはシンプルに 作るんが一番なんです,"When it comes to okonomiyaki, simple is best.",,,,,,,,,,,,,,
あ いや そんなつもりは あの お時間ができるまで 待たせていただきますので,I'm being sincere. I will wait until you have some free time.,ほかのスーパーとの違い？,The difference compared to other supermarkets?,やんのか？ え？,-You want to take this outside? -What?,はい 失礼します,Okay. I'll be leaving.,アカリさんみたいに東京の人に 一度食べさせてあげたいです,I wish I can serve it to a native of Tokyo like yourself.,,,,,,,,,,,,,,
そんなことされたらね 余計に迷惑なんだよ,That’s even more troublesome for me.,はい 営業でおみえになる方には 必ずお聞きしてるんです,Yes. I ask this question to every sales rep that comes here.,やんのかって聞いてんだよ,I'm asking if you're ready to take this outside.,なに あの人 冷たすぎない？,What's wrong with him? He's so cold.,私って東京生まれに見える？,Do I look like I'm from Tokyo?,,,,,,,,,,,,,,
あ 10分 あ いえ ５分だけでも しつこいんだよ,"Give me ten, no, just five minutes. -You’re so stubborn.",超簡単です ズバリ値段の安さですよね？,That's super easy. It's the low prices. Right?,押忍！ 押忍 押忍…,Osu! -Osu.,高宮さんが どんだけ頑張ったと思ってんだよ,He doesn't know how hard you worked.,ザ･東京美人って 感じじゃないですか,You're the quintessential Tokyo beauty.,,,,,,,,,,,,,,
お 何だよそれ 俺が悪いみたいじゃん,What’s with that face? Was that my fault?,いいえ 昨日のロンロンの方も 同じ答えでした,No. The lady from Lonron said the same thing yesterday.,なんなんちょっと… はあ？,What's going on…,ああ いや ああいう人なので,That's just his personality.,少なくとも大阪に こんな雰囲気の人いませんよ,All I know is that people like you don't exist in Osaka.,,,,,,,,,,,,,,
あ いやそんな… もういい もう帰ってくれ,No… -Get out.,どうですか？,What do you think?,それで由美ちゃんは そいつのところに,Then Yumi ended up going out with him.,じゃあ お疲れさまでした,Thank you for your hard work.,ふーん そうなんだ,I see.,,,,,,,,,,,,,,
あ いや 帰れ帰れ 二度と来るな,Go away and never come back.,はい お店の中は煩雑に見えて,"Well, the products inside the store",それ以来 空手も空手をやるような やつもどうしても苦手なんだよ,"Ever since then, I hate karate or people who practice karate.",あ あの…,Wait.,なんか 猿川さんっていい人だね,"I think you're a good guy, Mr. Sarukawa.",,,,,,,,,,,,,,
営業初日に爆死って あるあるっすよね,Experiencing a bomb on your first day of sales is a common thing.,お客様が手に取りやすいように 商品が並んでいました,are displayed in a way that makes it easier for customers to take.,顔はいかついし 拳は平らだし 道着 くせえしよ,"They look scary, their fists are leveled, and the dojo stinks.",今度 お礼させてくれない？,Can I make it up to you next time?,そ そうですか？,You think so?,,,,,,,,,,,,,,
こうみえて僕も経験あるんすよ,I’ve experienced that too.,そして 従業員の人たちの笑顔,The employees all had big smiles on their faces.,いや そもそもよ 押忍ってなんやねん,"And what does ""osu"" mean anyway?",無事 申請できました,The application is complete.,アカリちゃん そろそろ…,"Akari, your next table awaits.",,,,,,,,,,,,,,
懐かしー,How nostalgic.,加えて 完璧に近い 行き届いた掃除…,"In addition to that, everything was clean and sanitary.",あ ここだ あ？,"Oh, here it is. -What?",助かった,You saved our lives.,でも無理しないで,But don't push yourself too hard.,,,,,,,,,,,,,,
なあ どうして 一度営業かけた店だって,Hey. Why didn’t you tell me that you went there once before?,それらを合わせて ほかのスーパーとの違いは,"In addition to that, everything was clean and sanitary. But above all, your consideration",室長に言われてたんすよ,Manager told us,もう 大変だったんですよ,It was a lot of hard work.,こういうところって 合う人と合わない人がいるから,A place like this doesn't suit everyone.,,,,,,,,,,,,,,
教えてくれなかったんだよ,Why didn’t you tell me that you went there once before?,お客様への気持ち だと思います,towards you customers makes you different from the others.,気になる店があるから 帰りにチェックしてこいって,to check out a restaurant that he's been curious about.,かなり遅い時間まで 頑張ったんですから,We worked until very late in the evening.,え？ じゃ,-What? -Goodbye.,,,,,,,,,,,,,,
え だって 聞かれなかったんで,Because you never asked., 優等生っぽいけど 正解かも,"Sounds like a role model answer, but I think it's correct.",ここがそうっす,This is it.,あれれ パイセン 何ニヤニヤしてんすか,Wait. Why are you grinning like that?,（ナツミ）失礼しまーす,Excuse me.,,,,,,,,,,,,,,
え？,What?,それは どのスーパーさんも 同じだと思います,The same can be said for all the other supermarkets.,いらっしゃいませ,Welcome. -Oh?,いいことでもあったんですか？ 全然,-Did something good happen? -Not at all.,ハルナちゃーん バイバイ,-Bye! -See you!,,,,,,,,,,,,,,
そんなことより 今夜は パイセンの歓迎会っす,"More importantly, we have your welcoming party tonight.",父が苦労してここまでにした 店の名を 僕は汚すわけにはいきません,I can't tarnish the reputation of a store that my dad worked hard to build.,あれ？ やっぱりいた,Welcome. -Oh? I thought you'd be here.,（友麻）そういうことか,-Well… -So that's what happened.,（山崎） また来るね ごちそうさま ごちそうさま ほら 行くぞ,-Thank you! -Let's go.,,,,,,,,,,,,,,
美味しいもん食べて テンション上げちゃいましょ イエイ！,Let’s eat good food and have fun.,お客様への感謝の気持ちは 片時も忘れたことはありません,I'm constantly aware of the gratitude I owe to my customers.,お疲れーっす 抜け駆けはさせないわよ,I thought you'd be here. I won't let you beat me to it.,あはっ バレちゃいました？,-Well… -So that's what happened. I guess the secret's out.,（牛島）お客様,-See you again. -Sir.,,,,,,,,,,,,,,
ここっす,Here it is.,今日のところはお帰りください,Please take your leave.,大河内さんも 気になってたんだって この店,Ms. Okochi was curious about this place too.,あ いや 実は今週末 高宮さんと食事行くことになって,I'm going out to dinner with Ms. Takamiya this weekend.,私の名刺と 次回の割引券でございます,That's my business card and a coupon for the next visit.,,,,,,,,,,,,,,
韓国料理？,Korean food?,パイセンも爆死っすね,It seems like you bombed it too.,さすがっすね,Just as I expected.,あ いやいや 誤解しないでくださいよ,Don't misunderstand me.,また来てくださいね,Please come again.,,,,,,,,,,,,,,
お待たせしました 室長,Thanks for waiting.,ああ 亮介君か どうだった？,"Hey, Ryosuke. How was it?",亮介君 さっきの話は…,"Ryosuke, what I just told you is a secret.",これあの お礼をかねた ただの食事ですから,This is simply a meal to thank her for helping us out.,（健太）はい… （山崎）お猿 行くぞ,"Okay. Come on, Saru. Let's go.",,,,,,,,,,,,,,
あー 来たか お先にやっといたよ,You're here. I put in the order already.,そうか 猿川君もダメだったか,I see. Sarukawa didn't succeed either.,わかってますよ ま 座ってくださいって,I know that. Please take a seat.,でもまぁ デートって言えば デートなのかなぁ,But I guess it can also be called a date.,（山崎）締めの牛丼食うぞ！ （亮介）パイセン 早く～,"Come on, Saru. Let's go.",,,,,,,,,,,,,,
あ あの 歓迎会なんて… 僕 営業に失敗して…,I don’t deserve a welcoming party. I couldn’t make a sale today.,おっと 連続爆死か,It's a consecutive hit.,じゃあ 乾杯 イエイ！,Cheers. -Cheers. -Yay!,話したくてたまらないらしいぞ どうでもいいわ,-He wants to talk about it so badly. -This is nonsense.,（山崎）あぁ 楽しかったな よし ミユキちゃんにライン送ろ,That was so much fun. I'm going to message Miyuki.,,,,,,,,,,,,,,
だからこそだよ 飲んで食べて 明日の活力を生もう,"Then even more so, you need to eat and drink to gain strength for tomorrow.",同期同士 仲が良いね 一緒にしないでよ,You both bombed it together. -Shut up.,パイセン パイセン どうしたんですか？,"Mr. Sarukawa, what's the matter?",さすがパイセン どうやって誘ったんすか？,"That's awesome, Mr. Sarukawa! How did you ask her out?",エキサイティングでしたね パイセン,Wasn't that exciting?,,,,,,,,,,,,,,
やったー みんなの活力も爆上がりっすね,This is awesome. It will fill everyone else with energy too.,まあ 仕方ない,That's too bad.,今日は 激辛な気分じゃ ないんだけど…,I don't feel like eating spicy food today.,聞きたい？ 聞きたいならしょうがないねぇ,-You want to know? -Yes. I guess I'll have to tell you.,って なに落ち込んでんですか イエイ イエイ イエイ イエイ！,Why do you look so glum?,,,,,,,,,,,,,,
みんな？,Everyone?,帰りに紅(あか)ちゃんにでも寄って 気合いを入れてあげなさい,Stop by Akachan on the way back and help him recharge.,そんな言い訳 うちでは許されませんよ,A poor excuse like that is not allowed on our team.,ここに行くといい,You should go here.,ねえ 秋山さん （秋山）いい加減 落ち着け,"-Hey, Mr. Akiyama! -Calm down.",,,,,,,,,,,,,,
おー お待たせしました,Thanks for waiting.,あ それから悪いが,I have one more request.,待たせしました ザーサイ失礼しまーす,Here's the Sichuan vegetable. -Thank you. Here you go.,（健太）タイ料理？,"""Thai food""?",アハハ 楽しくなっちゃって,I'm in such a good mood.,,,,,,,,,,,,,,
我が営業促進室の精鋭たちだ,This is the elite unit of the Sales Promotion Team.,スーパーなかやで 買い物してくれないか,Can you get me something at Supermarket Nakaya?,で どうだったの？ 高野会館は,How was Takano Hall?,私の行きつけで 妻と初めて食事をした店なんだ,"I'm a regular there, and it's where I had my first date with my wife.",あ やっぱ秋山さんも フラれちゃいました？ アハハハ,"Wait. Did she turn you down, Mr. Akiyama?",,,,,,,,,,,,,,
さっきはみんな出払ってたからね 誰です？,They weren't in the office earlier today. -Who is this?,かみさんに頼まれたものがあって,My wife requested some things.,あ いや それが…,"Well, about that…",へぇ…,I see.,（秋山）そうじゃない,That's not it.,,,,,,,,,,,,,,
今日 大阪本社から来た 猿川パイセンです イエイ！,It’s Mr. Sarukawa. He was transferred here from the Osaka headquarters.,一円でも二円でも安く買い物すると ホメてくれるんだよ,She praises me when I buy something at a bargain even when it's only one or two yen cheaper.,あ そういえばパイセン さっきの話なんですけど,"Oh, and please finish the story you were just telling me about. What happened with Yumi?",もし行くなら 私の オリジナルコースを予約しておく,"If you'd like, I can call to reserve my original course menu.",営業だ,It's about the sales.,,,,,,,,,,,,,,
じゃ パイセン 座っちゃってください うん,Please have a seat. -Okay.,了解です じゃ,Roger.,例の由美ちゃんとは どうなったんすか？,you were just telling me about. What happened with Yumi?,えー 激辛じゃないですよね？,It better not be spicy.,猿川 明日(あした)からあの店に行け,"Sarukawa, go back there tomorrow.",,,,,,,,,,,,,,
猿川？ ウケる 名前珍しくない？,Sarukawa? How funny. What a unique name.,安く買い物すると 奥さんにホメられるって…,He gets praised by his wife when he shops a bargain.,亮介君 亮介君 さっき言ったよね,Ryosuke! Did I not warn you about this?,私を信じなさい きっとうまくいくはずだ,Trust me. It'll all go well.,えっ ぼ 僕がですか,Me?,,,,,,,,,,,,,,
あっ はい よく言われます,I get that a lot.,健気すぎる室長に イエイ！,Our manager is so admirable. Yeah!,内緒でしたっけ？,"Oh, was it a secret?",そのかわり 君に頼みがある,"In exchange, I have a favor to ask.",あの店 ロンロンの商品が 一個もなかった,That club didn't have a single Lonron product.,,,,,,,,,,,,,,
うちら同期らしいじゃない,I hear we’re the same age.,客への感謝は当たり前か,Gratitude for the customer is a given.,なになに なんの話？ 面白そうじゃない？,What's this about? It sounds interesting.,経費の上限を増やしてもらえるよう 彼女を説得してほしい,Please persuade her to increase the terms of our expenses.,（秋山） 俺が行ったキャバクラで初めてだ,I've never experienced that.,,,,,,,,,,,,,,
あっ そうなんですか,"Oh, really?",なのに俺… まだまだだなあ,I still have a long way to go…,なんでもありません,It's nothing.,うちはゲキカラドウを 促進してるからね,We promote the way of the hot and spicy.,店長から名刺もらっただろ,"You got a business card, right?",,,,,,,,,,,,,,
お待たせしました,Thanks for waiting.,パイセン 元気出してくださいよ,Mr. Sarukawa! Cheer up!,なんだよ お猿 隠すなよ,"Hey, Saru, stop hiding things from us.",（谷岡）ほかの部署より なにかと経費がかかるんだ,So we require more expenses than usual.,室長には俺から話しておく （健太）あ いや あの…,-I'll talk to the manager about this. -But…,,,,,,,,,,,,,,
では 我が促進室の 大きな力になってくれる,"All right. Let's raise our glass to Mr. Sarukawa, who will be helping out our team.",パイセンとあの人の差って すんごいあると思うんですけど,There's a huge gap in the ability between you and that owner.,お待たせしました 地獄谷の麻婆豆腐でございます,Thank you for waiting. Here's the Valley of Hell Mapo Tofu.,なるほど 彼女さえ口説き落とせば,I see. We need you to get her on our side.,（山崎）秋山さん ２軒目 （亮介）ちょっと！,"-Mr. Akiyama, let's go for a second round. -Wait! Wait up.",,,,,,,,,,,,,,
猿川くんにカンパイ！,"Let's raise our glass to Mr. Sarukawa, who will be helping out our team.",僕はパイセンの そんな正直に 落ち込むところ 好きっすよ,But I like how you openly blame yourself when things go wrong.,はい 失礼します,Please excuse me.,いやいや 無理ですよ デートなんですから,That's impossible. This is a date.,キャバクラといったら 酒だよな,Alcohol will be ideal for a hostess bar.,,,,,,,,,,,,,,
カンパイ！ イエイ！,Cheers!,もう帰るのかね？ 取引先と食事なんで,You're leaving already? -I have plans with some clients.,わー,Please excuse me. Looks delicious.,それに うちはただでさえ 経理部に目つけられてる…,We're already in trouble with the accounting--,こんにちは,Hello.,,,,,,,,,,,,,,
こちらナムルとキムチです,Here's the namul and kimchi.,紅ちゃん 確かに気合いが入ります いいチョイスですよ 室長,"Akachan. That place really recharges you. It's an excellent choice, Manager.",これよこれ これが食べたかったのよ,This is it! I've been wanting to eat this.,大丈夫 あの感じはきっと 押しに弱いタイプよ,Don't worry. She looks like the type that can be persuaded.,あ どうも 昨日(きのう)のお客さんじゃないですか,Hello. You're the customer from last night.,,,,,,,,,,,,,,
亮介君 はいっ さっそくみんなの紹介を おっ 任せてください,"Ryosuke, please introduce everyone. -All right!",珍しいね ホメるなんて,I'm not used to getting compliments from you.,これが有名なやつっすね,This is the specialty here. -Here you go.,すべては君にかかっている 頼んだぞ 猿川君,"Everything depends on you. I'm counting on you, Sarukawa.",すいません うち朝キャバやってないんですよ,I'm sorry. We're not open in the mornings.,,,,,,,,,,,,,,
まずはロンロンイチ イケてる女性社員,First up is Lonron’s most beautiful female employee.,ゲキカラドウを極めるには,I guess it's proof that you consider,僕たちはもちろん 一番辛い 60辛,"Of course, we ordered the spiciest one. It's level 60.",あ いや ちょ ちょっと…,Wait.,あ いえいえ 私(わたくし) 実はこういう者でして,"Oh, please let me introduce myself.",,,,,,,,,,,,,,
使えない男同様 世の中の炭水化物は全てが敵,"Just like worthless men, all carbohydrates in this world are her enemy.",紅ちゃんが もってこいの店だと 認めてる証しだろう,Akachan as the ideal place to master the way of the hot and spicy.,びっしりと表面を覆う唐辛子,The surface is covered with chili peppers.,パイセン 何着てくんすか？,"Mr. Sarukawa, what are you going to wear?",ロンロンという 飲料メーカーでして,We're a drink manufacturer.,,,,,,,,,,,,,,
なめたら痛いよ 大河内友麻パイセン,Don’t you dare underestimate her. Ms. Yuma Okochi!,さて 我々も帰るとするか,Shall we head out?,マグマのように沸き立つ灼熱の餡(あん) まさに,The scorching red sauce is boiling like magma.,（まり子）どうかしました？,Is something the matter?,ぜひうちのお酒も 試していただけないかと,I was hoping you would sample some of our alcoholic beverages.,,,,,,,,,,,,,,
どうも,Hello.,もう パイセン 元気出してくださいよ,Cheer up.,地獄や,This really is hell.,あ ううん なんでもない,Not at all.,聞いたことない会社ですね,I've never heard of Lonron.,,,,,,,,,,,,,,
お次は 恋愛歴と営業力は ナンバーワン,Next is the man with the most experience in love and sales.,スマイル スマイル,Don't forget to smile.,無理やろ こんなん,This is impossible.,素敵なお店ですね,This is a lovely restaurant.,うち お酒はもう決まってるとこ あるんで お引き取りください,We already have fixed suppliers for our alcohol. Please leave.,,,,,,,,,,,,,,
未だ独身 秋山雅人パイセン,But he's still a bachelor. It's Mr. Masato Akiyama.,おっ この店っすよ,This is the restaurant.,いただきます 実食,Thank you for the food. -Let's eat.,（健太）乾杯 （まり子）乾杯,-Cheers. -Cheers.,他社にも負けないぐらい お酒を取り揃えております ぜひ試飲だけでもお願いします,"We have assorted varieties of drinks, so please sample some of them.",,,,,,,,,,,,,,
しくよろ,What's up?,乾杯 イエイ！,Cheers!,お待たせしました,Excuse me.,タイ料理にワインって 珍しいですね,It's rare to pair Thai food with wine.,お宅と契約するつもりは ありませんから 帰ってください,I have no plans to sign a contract with you. Please leave.,,,,,,,,,,,,,,
