Script.EP1,Meaning.EP1,Script.EP2,Meaning.EP2,Script.EP3,Meaning.EP3,Script.EP4,Meaning.EP4,Script.EP5,Meaning.EP5,Script.EP6,Meaning.EP6,Script.EP7,Meaning.EP7,Script.EP8,Meaning.EP8,Script.EP9,Meaning.EP9,Script.EP10,Meaning.EP10,Script.EP11,Meaning.EP11,Script.EP12,Meaning.EP12
でもって ロンロンイチ暑苦しい男,Next is Lonron's number one blazing man.,失礼いたします,Excuse me.,麻婆豆腐失礼します ありがとうございます,Here's your mapo tofu. -Thank you.,あ タイ料理には もちろんビールも合うんだけど,"Of course, Thai food goes well with beer,",（牛島） どうもありがとうございました,Thank you very much.,,,,,,,,,,,,,,
水分補給しても 全部 汗になる山崎裕也パイセン,"No matter how much he drinks, it all turns into sweat. It's Yuya Yamazaki!",よし 今日は食うぞ,I can't wait to eat!,それって 普通の麻婆豆腐？,Is that regular mapo tofu?,最近ではワインとのマリアージュを 楽しむ人も増えてるんだ,"but lately, it's become popular to enjoy it with wine.",もう しつこいな いい加減にしてくださいよ,You're so stubborn. -Why won't you stop? -I'm not here for work.,,,,,,,,,,,,,,
じゃ 猿川パイセン よろしくお願いします うん,"Now, Mr. Sarukawa, please introduce yourself.",いや 今日気合い入れに来たのは 猿川パイセンっすよ,We're here to recharge Sarukawa today.,あ 僕 初めての店は スタンダードから 行きたいタイプなんで,I always order the standard item when trying out new restaurants.,へぇー 詳しいんですね 猿川さん,"I see. Mr. Sarukawa, you're so knowledgeable.",営業じゃありません,-Why won't you stop? -I'm not here for work.,,,,,,,,,,,,,,
猿川健太です 大学時代は応援団に所属し,I’m Kenta Sarukawa. I was in the cheer squad during college.,聞いたよ 爆死だって,I heard you bombed it.,いただきます,Thank you for the food.,いえ,Not at all.,なんだぁ それならそれと 早く言ってくださいよぉ,"Oh, I see! You should have told me that a lot sooner!",,,,,,,,,,,,,,
不肖ながら 団長を務めてまいりました,I was the leader of the squad.,いきなり２辛なんて無理だったのよ けど これも勉強だから,Spice level two was too difficult for you. But this is all part of the learning experience.,その言い訳は通るんかい,That poor excuse is acceptable?,（店員）お待たせしました パクチーツリーサラダになります,Thanks for waiting. -Here's the Cilantro Tree Salad. -Thank you.,（牛島）一名様ご来店でーす,We have one customer coming through.,,,,,,,,,,,,,,
あの自分 根性だけは… （店員）お待たせしました,I have the guts to-- -Thanks for waiting.,自分だって,You bombed it too.,つべこべ言ってないで 早く食べなさいよ,Shut up and eat already.,（まり子）ありがとうございます,-Here's the Cilantro Tree Salad. -Thank you.,（健太）相手の懐に入るには とりあえず これしかない,"Right now, this is the only way to gain his trust.",,,,,,,,,,,,,,
猿川君 すまない 来てしまった,"Sorry, Mr. Sarukawa, the food is here.",失礼します 七輪 置きますね,Excuse me. Grill coming through.,鬼や… この地獄には鬼がおる,It's the devil. The devil is inside this pot of hell.,美味しそう 私 パクチー大好きなんです,It looks delicious. I love cilantro!,（牛島）お茶割りです,Here's your drink.,,,,,,,,,,,,,,
では いただくとしよう,Let's dig in!,熱いんで気をつけてください,Please be careful.,鬼たちが いまかいまかと 待ってやがる,The devil is waiting for me,そっか よかった,Really? I'm so glad.,（ミユキ） ありがとうございまーす じゃ いただきます,Thank you. Cheers.,,,,,,,,,,,,,,
いただきます,Thank you for the meal!,お待たせしました カルビとハラミ,Thanks for waiting. Here's the short rib and the skirt steak.,俺が足を踏み入れるその時を,to step my foot inside.,（健太）やっぱり女の子は パクチー好きが多い,It seems like most girls love cilantro.,カンパーイ,Cheers.,,,,,,,,,,,,,,
な なんや この人たち…,What’s with these people?,こちら野菜の盛り合わせです,Here are the vegetables.,怖すぎるやろ,This is too scary.,さすが 室長 わかってますね,Just as I expected of our manager. He's on top of it.,アカリさんって そんなに人気なんですか？,Is Ms. Akari really popular?,,,,,,,,,,,,,,
なんやあれ？,What is that?,ぼっかけも お待ちどおさまです,Here's the bokkake.,あれ もしかしてパイセン ビビってます？,"Mr. Sarukawa, are you scared by any chance?",どうぞ （まり子）ありがとうございます （健太）いえ,-Here you go. -Thank you.,うん いっつもナンバーワン,Yes. She's always number one.,,,,,,,,,,,,,,
遠慮しないで 早く食べないとなくなるよ,Don’t be shy. You should eat before it’s all gone.,待ってましたぁ,Thank you.,な… な なわけないだろ,Of course not.,（２人）いただきます,Let's eat.,だから店長に 信頼されてるっぽいんだよね,That's why the manager trusts her a lot.,,,,,,,,,,,,,,
遠慮やないねんけどなあ…,I wasn't being shy…,じゃ お肉のほう焼いちゃいますね う う うん,I'll start grilling now. -Okay.,いただきます,Let's try it.,うん ほんとだ タイ料理とワイン合いますね,You're right. Thai food goes very well with wine.,店長 アカリの言うことは 何でも聞くもんね,Manager listens to everything Akari says.,,,,,,,,,,,,,,
ネギ 大好物です,Welsh onion? It’s my favorite.,すいませーん ライスおかわり はーい ありがとうございます,"I'd like another serving of rice, please. -Okay.",鬼や…,It's the devil.,でしょ？,Right?,なに アカリのこと 気になってんの？,Are you interested in Akari?,,,,,,,,,,,,,,
いただきます,Thank you for the food.,美味(うま)そう,That looks delicious.,お待たせしました ラー油ご飯 失礼します,Thanks for waiting. Here's the rice with chili oil.,調べてきたかいあったぁ,It was worth all the research.,えーミユキ 猿川さんのこと タイプだったのに,No way! You are totally my type!,,,,,,,,,,,,,,
辛っ…,It’s so spicy.,室長が言ってたとおり 気合い入ってくる,Manager was right. This is recharging me.,ありがとうございます,Here you go.,（店員） 失礼します あ すいません,Excuse me. This is the Pad Pong Curry,えっ あ 別に そんなんじゃないよ,It's not like that.,,,,,,,,,,,,,,
なんや 何がこん中に… これはネギやし,"What’s in here? These are Welsh onions, right?",単純,How easy.,ここのラー油 最高,This chili oil is amazing.,パッ･ポンカリーと トード･マンクン,This is the Pad Pong Curry and Tod Mung Goong. It's deep-fried shrimp cakes.,（ミユキ）本当に？ （健太）うん,-Really? -Yeah.,,,,,,,,,,,,,,
それはネギじゃない 青唐辛子だ,Those aren’t Welsh onions. It’s green chili.,はいよ はいどうぞ ありがとうございます,Here you go. -Thank you. -Sure.,炭水化物は任せた,You can have my rice.,エビのすり身揚げです 熱いのでお気をつけください,"and Tod Mung Goong. It's deep-fried shrimp cakes. Careful, it's hot.",ヨンペリ入れてくれたら 信じてあげる,I'll believe you if you order the Yom Perignon.,,,,,,,,,,,,,,
と 唐辛子!?,Chili?,５にしといたよ,I made it five.,なんで あんな美味そうに 食えんねん,How can he eat it so deliciously?,（まり子）どれも美味しそう,It all looks delicious.,ヨンペリ？,Yom Perignon?,,,,,,,,,,,,,,
ここの料理にはね 青唐辛子がたくさん入ってるんだ,There are lots of green chili in all of the dishes.,５？,Five?,そうか この卵溶けば 味がマイルドになるんやな,"Oh, I see. This egg yolk will make the flavor a lot milder.",うん 美味しい,It's so good.,猿川さん おねがい,"Please, Mr. Sarukawa.",,,,,,,,,,,,,,
すいませーん オイカラください,"Excuse me. Ex-spice, please.",なぁなぁ こ これは？,"Hey, what is this?",なんでもっと早くに 気づかんかったんや,Why didn't I realize this sooner?,どれもほんとに美味しいです,Everything is delicious.,おねがい,Please.,,,,,,,,,,,,,,
オイカラ？,Ex-spice?, いやもちろん 焼肉のタレっすよ そりゃ 見たらわかるわ,It's the sauce for the grilled meat. -Obviously.,ん？ ぐああ… 変わらんやんけ,What? It didn't change anything!,よかったぁ,I'm so glad.,いっちゃいますか,Let's do it.,,,,,,,,,,,,,,
追い唐辛子のことっすよ 僕 もらってきます,It means an extra serving of chili. I’ll go get it.,もういいんじゃない？ ですね どうぞ どうぞ,I think it's ready. -I agree. Let's eat.,お待たせしました 中華風ゴーヤチャンプル でございます,Here's the Chinese-style stir-fried bitter melon.,（健太）室長 完璧です 疑ってすいませんでした,"Manager, everything is perfect. I'm sorry for doubting you.",本日もありがとうございます これ 領収書,Thank you very much. Here's your receipt.,,,,,,,,,,,,,,
えぇ…,What?,パイセンも食べちゃってください あ うん,"Eat up, Mr. Sarukawa. -Okay.",待ってましたぁ,I've been waiting for this.,（店員）はい 失礼しまーす あぁ ありがとうございます,Please excuse me. Thank you.,あとこれ 次回使える割引券,Here's the coupon for your next visit.,,,,,,,,,,,,,,
オイカラの到着です,Here's the ex-spice.,いただきます,Thank you for the food.,こちら春巻きでございます はーい,Here are the spring rolls. -Okay.,パッ･キーマオ タイの焼きそばです,Pad Kee Mao. It's stir-fried noodles.,ああ これうちのお酒の資料です,"Oh, I almost forgot. Here's the list of our alcoholic beverages.",,,,,,,,,,,,,,
はい,Here you go. -Thanks.,な なあなあ このタレ 何が違うの？,What's the difference between these two sauces?,タレこちらに置いておきますね 失礼します,I'll place the sauce here. -Okay. -Excuse me.,これは？,What is this?,はいはい どうもどうも お気をつけて,Thank you and take care.,,,,,,,,,,,,,,
ええ…,No way!,食べてみればわかりますよ,You'll see when you try it.,はい みんなも食べて,"Take some, everyone.",あ パッタイみたいなものかな ああ 私 大好きです,-It's similar to Pad Thai. -Oh. I love that!,（女の子たち）バイバ～イ,Bye.,,,,,,,,,,,,,,
亮介 おかわり はい どうぞ,"Ryosuke, more rice, please. -Here you go.",こういうのって普通 甘口と辛口やんな,"Usually, one is sweet and the other is spicy.",うわ うまそう はい パイセンもどうぞ,This looks delicious. -Here you go. -Thanks.,（健太）ほんと？ （まり子）はい,-Really? -Yes.,（牛島）これ 捨てといて （ボーイ）はい,-Throw this away. -Okay.,,,,,,,,,,,,,,
ジンジン来る えっ？,I can feel the burn. -What?,こっちが甘口かな,Is this one sweet?,あぁ ありがとう,-Here you go. -Thanks.,ありがとう いいえ,-Thank you. -You're welcome.,困りましたねぇ,BILL TO LONRON This is not good.,,,,,,,,,,,,,,
わかんない？,Don't you feel it too?,うまっ なんぼでも食えそうや,It's delicious. I can eat this endlessly.,え？,What?,いただきまーす,Let's try it.,ほんとに 申し訳ございません,I'm very sorry.,,,,,,,,,,,,,,
この唐辛子のビタミンＡ Ｅ Ｃで 代謝が高まって,"The feeling of Vitamin A, E, and C in the chili boosting your metabolism",今食べたのはこの店特製のタレで カラっていうんだ 辛いからカラ,"What you ate, is this restaurant's original sauce called Kara. It's really spicy.",パイセン 全然 減ってないじゃないすか,"Hey, you haven't eaten at all.",（健太）辛っ なんやこれ,What is this?,18万？,Hundred and eighty thousand yen?,,,,,,,,,,,,,,
カプサイシンが 肌の奥までくる感じ…,as the capsaicin is absorbed deep under the skin.,えぇ…,What?,そんなことないよ,That's not true.,ごめん 辛いの苦手だった？,I'm sorry. Can you not handle spicy food?,マジかよ お猿…,"Saru, are you serious?",,,,,,,,,,,,,,
この刺激はデトックスの高鳴りだ,That’s the surge you get from a detox.,青唐辛子に ジョロキアを混ぜてあるの,Ghost pepper is mixed in with green chili.,ったく なに 恐る恐る食べてるのよ,Why are you being so timid?,はい 普段はあんまり,I don't usually eat it.,パイセンやっちゃいましたね,You're in real trouble now.,,,,,,,,,,,,,,
そして流れる汗は優美な雨音 まるでショパン,The droplet of sweat is like the sound of rain. Just like Chopin.,ヒョロヒヤ？,Ghost pepper?,躊躇しちゃダメ 一気にいかないと,Don't hesitate. Just go for it.,パッ･キーマオはタイ語で 酔っ払い炒めっていう意味で,"In Thai, pad kee mao means ""drunken noodles"".",キャバクラだとヨンペリが あんなに高くなるとは知らなくて,I didn't know that Yom Perignon would be so expensive.,,,,,,,,,,,,,,
ショパン？,Chopin?,世界で三番目に辛い唐辛子よ,It's the third spiciest pepper in the world.,唐辛子の辛みが アツアツの餡と相まって,The spiciness of the chili pepper is combined with the scorching sauce,酔っ払いのお酒も冷めちゃうぐらい 辛いから そういうらしいですよ,These noodles are spicy enough to sober up a drunkard.,とりあえず 経理にかけあってみます,I'll try to talk to accounting.,,,,,,,,,,,,,,
お待たせしました 蛸ボッサムでーす,Thank you for waiting. -It's octopus bossam.,ほ ほれぱ？,What's that?,容赦なく舌を痛めつけてくる,to mercilessly attack my tongue.,（健太）最悪や ここまではよかったのに,What a horrible situation. It was going so well until now.,あんな大金 経費で落とせるかな,I don't think accounting will expense an amount like that.,,,,,,,,,,,,,,
おーきたきた みなさん メインディッシュの到着です,"It's here! Everyone, it’s the main dish!",カプサイシン もっと辛いやつ,Capsaicin. It's a lot spicier.,追い打ちをかける 山椒の突きさすような刺激,The fiery Japanese pepper is what provides an additional blow.,タイ料理？,"""Thai food""?",経理部はあの一件で 厳しくなってきたからなぁ,"Since accounting is very strict these days,",,,,,,,,,,,,,,
イエイ！,"It's here! Everyone, it’s the main dish! Yes.",も もっと!?,A lot spicier?,辛い 辛すぎる もう限界や…,It's so spicy. It's too spicy. I've reached my limit.,私の行きつけで 妻と初めて食事をした店なんだ,"I'm a regular there, and it's where I had my first date with my wife.",もしかしたら18万 自腹になるかもしれないぞ,"you may have to pay 180,000 yen out of pocket.",,,,,,,,,,,,,,
え… また？,This chili again?,脂肪がメラメラ燃えて 体中の血の巡りがよくなるって…,It burns fat while it improves blood circulation.,ん？,What is that?,（健太）へぇ…,I see.,自腹？,Out of pocket?,,,,,,,,,,,,,,
完成です,Please enjoy.,まさに 神ね,This is godly.,なんや この優しい舌触りは,What is that? What's this soft texture?,もし行くなら 私の オリジナルコースを予約しておく,"If you'd like, I can call to reserve my original course menu.",秋山さんが行けって言ったから 行ったんですよ,I went because you told me to go!,,,,,,,,,,,,,,
うちのメンバーは 辛いものが好きなんだ ええ…,Everyone on our team loves spicy food.,カプサイシンって神様なん!?,Capsaicin is a god?,ああ 豆腐か まるで地獄で見つけたオアシス,It's the tofu. It's as if I've found an oasis in hell.,（健太） 室長を信じた俺がアホやった,It was stupid of me to trust that manager.,お前 あの店 絶対に落とせ,You have to get a contract with them!,,,,,,,,,,,,,,
君はどう？,How about you?,あ そうだ 言い忘れちゃったんですけど,"Oh, I forgot to mention that I ordered the highest spice level for both sauces.",しびれた舌が癒されていく,It's healing my burning tongue.,あ 無理しなくていいよ これ 俺が食べるからさ,You don't have to eat this. I'll finish it myself.,契約さえ取ってくれば 室長が何とかしてくれる,"If you get a contract, our manager will take care of the rest.",,,,,,,,,,,,,,
え？ まあ あの す 少しくらいは,Just a little…,タレはどっちも一番辛い ５辛を頼んだっす,"Oh, I forgot to mention that I ordered the highest spice level for both sauces. -It's spice level five. -That's what he meant by five?",あれ？,What?,（まり子）すみません （健太）いいえ,-I'm sorry. -No problem.,（秋山）死に物狂いでやれよ,Do it as if your life depends on it.,,,,,,,,,,,,,,
わかるかな 本物の辛(から)さを知ってこそ,"Did you know that experiencing real heat,",５って そういう意味!?,It's spice level five. -That's what he meant by five?,ちゃんと味わってみると,"Now that I'm tasting it again,",（健太） 辛い 完全に油断してた,It's so spicy. I had completely let my guard down.,（アカリ）あ この前の （健太）あ どうも,-I remember you. -Hello.,,,,,,,,,,,,,,
何事にも打ち克つ力が備わる,gives you the strength to overcome any difficulties?, からーい でも美味しい,What? -It's spicy but delicious.,辛みの奥に ジューシーな肉の旨みが,"Now that I'm tasting it again, there's a juicy flavor of meat within the spiciness.",これがタイ料理の 本気の辛さなんか,This is how spicy Thai food can get?,ごめんなさい ほかの人に呼ばれてて,-I'm sorry I made you wait. -Not at all.,,,,,,,,,,,,,,
辛いっていう字は ツライとも読める,"The kanji character for ""spicy"" can also be read as ""pain"".",なあ あの子のとこは？,Hey. What level is their sauce?,美味い… かも,This might be… delicious.,ん？ でも いける,But I can still eat it.,あ いえ なに飲みますか？,-I'm sorry I made you wait. -Not at all. What would you like to drink?,,,,,,,,,,,,,,
しかし 辛いという字に一本足せば 幸せという字になるんだ,"But adding one line to the word ""spicy"" will turn that word into ""happiness"".",（亮介）常連さんっぽいんで,"They look like regular customers,",最高,This is excellent.,東京に来て いろんな激辛に 挑んできた今の俺になら,I've eaten all sorts of spicy things ever since I came to Tokyo.,じゃあ ヨンペリもらおうかな,I'll have the Yom Perignon.,,,,,,,,,,,,,,
さあ 食べようか,Let's eat.,たぶん４辛か５辛くらい じゃないっすか？,so it must be spice level four or five.,いやぁ～ 仕上がった 仕上がった,I feel complete now.,食べられへん辛さじゃない,This is not as spicy as the other dishes I've tried.,（アカリ）どうしたの？,What's wrong?,,,,,,,,,,,,,,
これが 東京…,So this is Tokyo…,子供に負けるつもり？,Will you lose against a child?,美味かったっすね,That was delicious.,辛いけど うまい,It's spicy but delicious.,すいません あの 今日は そこまでお金持ってなくて,I don't have enough to pay for Yom Perignon today.,,,,,,,,,,,,,,
東京なんよな,"Oh, right. I’m in Tokyo now.",お ハラミもＯＫっすよ,The skirt steak is done.,仕上がった,I feel complete.,すごいですね 猿川さん,"Mr. Sarukawa, you're amazing.",あなた お酒の契約取りたいんでしょ？,"You want to supply alcohol here, right?",,,,,,,,,,,,,,
猿川先輩 負けないでください,"Mr. Sarukawa, please do your best.",おっ おー,All right!,どう？ もう一軒 イエイ！,How about a second round? -Sure.,え？,What?,店長に営業したけど 相手にされない,Our manager didn't listen to your sales pitch.,,,,,,,,,,,,,,
先輩なら東京へ行っても 必ず成功します,We’re confident you’ll succeed in Tokyo.,いただきまーす,Let's dig in!,僕はここで,I'll be leaving now.,辛いもの食べられる人って 尊敬しちゃいます,I respect people who can eat spicy things.,だから私に協力してもらおうと 思って指名した,"So you asked for me, hoping to get my cooperation.",,,,,,,,,,,,,,
フレー フレー,Hurray! Hurray!,お パイセン 今度はシビでいくんっすか？,"Oh, Mr. Sarukawa. You're trying the shibi sauce?",えー？ パイセンも行きましょうよ,Why? Let's all go together.,私の知らない美味しさを 知ってるんだろうなって,Because they get to experience flavors that are foreign to me.,違う？,Am I wrong?,,,,,,,,,,,,,,
サルーカワー！,Sarukawa!,シビ？ シビは痺れるからシビ,Shibi? -It's a numbing sauce.,ちゃんと味わってみようと思うんだ,There's something I need to do.,尊敬って 大げさだよ,Respect? Isn't that an exaggeration?,どうしても ここの営業 成功させたいんです,I want to secure this sale no matter what.,,,,,,,,,,,,,,
フレ フレ 猿川 フレ フレ 猿川！,"Hurray, Sarukawa! Hurray, Sarukawa.",味噌ダレに 花山椒を混ぜ込んであるの,Japanese pepper is mixed inside the miso-based sauce.,失礼します,Goodbye.,え… 激辛じゃないですよね？,It better not be spicy.,東京にも 自分自身にも 負けたくない,I don't want to lose against Tokyo or myself.,,,,,,,,,,,,,,
ありがとう,Thank you.,やっぱ どっちも辛い,Both of the sauces are so spicy.,何の用だ？,What do you want?,私を信じなさい きっとうまくいくはずだ,Trust me. It'll all go well.,（健太）このまま 引き下がりたくないんです,I don't want to give up.,,,,,,,,,,,,,,
あー 仕上がった 行くか,I'm so full. -Let's go.,ん？ 辛さの奥の方から なんか…,What? I can taste something beyond the spice.,この道場に入門させてください,Please let me train at this dojo.,（健太）そういうことか そういうことですね 室長,"So that's what he meant. I finally understand what you meant, Manager.",だからお願いします 何かヒントだけでも,"Please. Can you give me any kind of help? Please, Ms. Akari.",,,,,,,,,,,,,,
そういえば 昨日の晩から まともに メシ食うてないな,"Come to think of it, I haven’t eaten anything since last night.",これって 肉の旨み… いや 違う,Is this the sweet flavor of the meat?,気合いが入っとらん 押忍！,More strength! Osu!,やっぱり いただきます,I'm going to eat some too.,このとおりです アカリさん,"Can you give me any kind of help? Please, Ms. Akari.",,,,,,,,,,,,,,
いらっしゃい あちらどうぞ はい,-Welcome. Have a seat over there. -Thanks.,タレや,No. It's this sauce.,蹴り！,Kick!,え 無理しなくていいよ,You don't have to force yourself.,じゃあ 教えてあげる,Then I'll tell you.,,,,,,,,,,,,,,
はい,Here you go.,タレが肉の美味さ 引き立ててる,It heightens the flavor of the meat.,本日は ここまで,Today's practice is over.,だって猿川さん すっごく 美味しそうに食べるんだもん,But you make it look so delicious.,あそこのお客さん,That customer over there.,,,,,,,,,,,,,,
はい お待ち,Thanks for waiting.,ただ辛いだけのタレじゃないんか,It's not just a spicy sauce.,押忍,Osu.,（健太）え？,Really?,ヨントリー営業部のお酒担当,He's in charge of alcohol at Yontori Sales Department.,,,,,,,,,,,,,,
あ すいません ラーメンください,"Excuse me. I’ll have ramen, please.",やっぱりそうや どっちのタレも 肉の美味さを引き立ててる,"Yes, I can taste it. Both of these sauces compliment the meat.",お前ら！ まだまだ気持ちが足らんぞ,Everyone. Put more soul into it!,だ 大丈夫？ 辛い,-Are you okay? -It's spicy.,しかも店長の大学の先輩で,He was also our manager's senior in high school.,,,,,,,,,,,,,,
あと 目玉チャーシューと 小ライス,"I'll also have a fried egg, char siu, and rice.",で 辛さが 味に深みを与えてるんや,The spiciness adds depth to the flavor.,どした,What's the matter?,けど… 美味しいかも,But… I think it's good.,うちがオープンしたときから 懇意にしてくれてる,He's been supporting us ever since we opened.,,,,,,,,,,,,,,
ありがとうございます,Thank you.,お待ちどおさまです ホルモンです,Thanks for waiting. Here's the offal.,どけ,Move aside.,（まり子）やっぱ辛い （健太）辛いね,It's still spicy. It sure is.,だから店長がお酒の仕入れ先を 変えることは絶対にない,So there's no way our manager will change our supplier.,,,,,,,,,,,,,,
