Script,Translation
登山家は、山にある小屋で暮らしています。一人で元気に暮らして います。毎朝、三時間山を登ります。そして、野菜を育てて、食べています。登山家は、病院に行ったことがありません。とても元気なので、病気になったことがありません。今日も昼にキノコをとりに行きます。登山家は、キノコについてよく知っています。食べられるキノコと食べられないキノコがあります。その夜、登山家は病気になって、初めて救急車を電話で呼びました。病院に着いたとき、医者は言いました。「食べられないキノコを食べましたか?キノコはとても危険なので、気を付けてください。でも、もう大丈夫です。でも、目が悪くなっています。知っていましたか?休んだ方がいいですよ。」そして、登山家は毎年病院に行って、健康診断を受けます。,"Mountaineers live in huts in the mountains. He lives well on his own. Every morning he climbs the mountain for three hours. He grows vegetables and eats them. The climber has never been to the hospital. He is very healthy and has never been sick. Today, he is going to pick mushrooms for lunch. The climber knows a lot about mushrooms. There are mushrooms that can be eaten and mushrooms that cannot be eaten. That night, the climber got sick and called an ambulance for the first time. When he arrived at the hospital, the doctor said, ""You ate inedible mushrooms. Did you eat inedible mushrooms? Mushrooms are very dangerous, so be careful. But I am fine now. But your eyes are getting worse. Did you know that? You should rest."" The climbers then go to the hospital every year for a checkup."
物語が大好きな科学者は、毎日十冊も小説を読みます。だから、一年で一万冊も本を読みます。そして、毎月新しい小説を買います。でも、すぐに全部読んでしまいます。ある日、科学者は物語を書く機械を発明しました。その機械は人工知能を持っていて、人間が好きな物語をたくさん書きます。科学者は喜びました。でも、機械が物語を書くより科学者が読むほうが速いので、科学者はもっと物語がほしいと思います。そして、科学者は機械に言いました。「もっとたくさん物語を書いて!」科学者が発明した機械は、物語を書く機械を発明しました。この新しい機械も人間が好きな物語を書くことができます。科学者は、この新しい機械に頼んでみました。「たくさん物語を書いて!」でも、まだ2台の機械が物語を書くより科学者が物語を読むほうが速いです。科学者が発明した機械は、また物語を書く機械を発明しました。今、科学者は物語を書く機械を3台も持っています。科学者はいつも新しい物語を読むことができるので、とても幸せです。,"Scientists who love stories read ten novels every day. So in a year, he reads ten thousand books. And he buys a new novel every month. But he soon reads them all. One day, a scientist invents a machine that writes stories. The machine has artificial intelligence and writes many stories that people like. The scientist was delighted. But the scientist wants more stories, because the scientist reads the stories faster than the machine writes them. Then the scientist says to the machine, ""Write more stories! Write more stories! The scientist invents a machine that writes stories. This new machine can also write stories that humans like. The scientist asked the new machine, ""Write lots of stories! Write lots of stories! But the scientist still reads the stories faster than the two machines write them. The scientist invents a machine that writes stories again. Now the scientist has three story-writing machines. Scientists are very happy because they can always read new stories."
"小さな村の郊外にある湖がありました。二つの白鳥と良い友達だった亀は湖に住んでいました。彼らはお互いにプレーし、物語を伝える時間を渡すでしょう。
一年間、そこには雨はなかったと湖が干上がっ始めました。
「湖はほとんど乾燥しています。私たちが生きるためにいくつかの他の場所を見つける必要があり、」白鳥の亀は言った。「我々は、飛び回る、適切な場所を探します、」白鳥は語りました。どちらの白鳥は住みやすい場所の検索に異なる方向に飛びました。少し離れ、白鳥の一つは、大きな湖を発見しました。これは、多量の水を持っていたし、それには多くの魚がありました。彼は他の人に伝えるために戻って飛びました。
それらの3つが検索に非常に興奮していました。ワオ！今、私たちはすべての問題を持っていないだろう、」亀は言いました。
「一つだけ問題があり、」1羽の白鳥は答えた。「私たち二人は時間がないのが飛ぶことができます。しかし、あなたは非常にゆっくりとクロールします。そして、それは離れていくつかの距離である。あなたがそこに到達することはありません。」
亀はいくつかの時間のためにと思いました。突然、彼の顔が点灯します。「私はアイデアを持っている、」彼は言った。「あなたは私のスティックを持って来る。私は私の口の中に棒の中心を保持します。あなたの両方がいずれかの側にスティックを保持することができます。あなたが私たちにあなたと私を飛ぶことができますこの方法新しい家。」
「それは非常に良いアイデアですが、あなたが何らかの理由であなたの口を開けていないことを確認する必要があります。そうした場合、あなたはあなたの死に分類されます、」白鳥のいずれかを警告しました。
カメは、合意されました。
彼らは飛ぶ準備ができましたと白鳥を思い出し「私たちは、あなたが言ったことを覚えておいてください」。やがて彼らは空高く飛んでいた。彼らは湖に到達するために、村の上空を飛行していた。彼らは村の上に飛んだとして、人々がなくなりました通りには、この驚くべき光景を見て。
「どのような巧妙な鳥。彼らはスティックにカメを運んでいる！」一人の男が叫んだ。一人一人がこのような素晴らしい光景を見て興奮しました。
「それは私のアイデアでした。私は巧妙な一人です。私はそれらを知らせる必要があり、」亀は、彼は説明して彼の口を開いた。思ったが、愚かな亀は何も言うことができる前に、彼がドサッと落ちて死亡しました。
白鳥は、彼らの死んだ友人を見下ろし、彼の愚かさに激しく頭を横に振りました。「彼は彼の口を閉じ保たれていた場合、彼は私達と生きていると幸せになる、」彼らはその後、上から自分の家のようになり、大きな湖で上陸したように、他に1白鳥は述べています。","There was a lake on the outskirts of a small village. Two swans and a turtle who were good friends lived on the lake. They would pass the time playing with each other and telling stories.
For a year there was no rain and the lake began to dry up.
The lake is almost dry. We need to find some other place to live,"" said the swan turtle. We will look for a suitable place to fly around,"" the swan said. Both swans flew in different directions in search of a suitable place to live. A short distance away, one of the swans spotted a large lake. It had a large amount of water and there were many fish in it. He flew back to tell the others.
Three of them were very excited to search. Wow! Now we won't have any problems,"" said the turtle.
Only one problem,"" replied one swan. We two don't have much time to fly. But you crawl very slowly. And it is some distance away. You will never get there.""
The turtle thought for some time. Suddenly, his face lit up. I have an idea,"" he said. ""You bring me the stick. I hold the center of the stick in my mouth. You both can hold the stick on either side. This way you can fly me with you to our new home.""
That is a very good idea, but you must make sure that you do not open your mouth for any reason. If you do, you will be classified as dead,"" warned one of the swans.
The turtles agreed.
They were ready to fly and reminded the swans, ""Remember what we told you. Soon they were flying high in the sky. They were flying over the village to reach the lake. As they flew over the village, people disappeared into the streets to see this amazing sight.
What clever birds. They are carrying turtles on sticks!"" One man exclaimed. Every single person was excited to see such an amazing sight.
It was my idea. I am the clever one. I have to let them know,"" the turtle opened his mouth to explain. The thought occurred to him, but before the silly turtle could say anything, he fell with a thud and died.
The swans looked down at their dead friend and shook their heads violently at his stupidity. If he had kept his mouth shut, he would be alive and happy with us,"" said one swan to the other as they then landed in a large lake that became like their home from above.








"