Kanji,K.Meaning,Words.A,Words.B,Words.C,Words.D,W.Meaning.A,W.Meaning.B,W.Meaning.C
崩,crumble,崩す。崩れる。切り崩す,雪崩。崩壊。崩落,値崩れ。型崩れ。崖崩れ,山崩れ。煮崩れ。放射性崩壊,tear down。collapse。cut through,avalanche。collapse。 crash,price collapse。losing shape。landslide
壊,break,壊す。壊れる。取り壊す,破壊。崩壊。壊滅,壊れ物。損壊。自壊,破壊的。決壊。壊滅的。倒壊。全壊,break。fall apart。tear down,destruct。collapse。annihilate,fragile article。damage。disintegrate
潰,crush,潰す。潰れる。暇潰し,崩潰。潰滅。倒潰,潰走。潰乱,潰しにする。潰し値段,smash。crushed。time wasting,collapse。annihilate。destruct,stampede。 corruption
保,keep,保つ。保証。保護,保守。保健。保険,保存。確保。保管,火災保険。生命保険,keep。guarantee。protection,maintenance。preservation of health。insurance,preservation。securing。safekeeping
守,protect,守る。見守る。守備,留守。保守。守衛,遵守。厳守。留守番,保守的。子守唄。看守,protect。watch over。defense,absence。 maintenance。 guard,obey。strict observance。care-taking
育,bring up,育つ。育てる。子育て,教育。体育。育児,発育。飼育。育成,生育。体育館。教育的。養育,raised。raise。child rearing,education。physical education。childcare,growth。breeding。rearing
児,child,幼児 。孤児。児童,育児。小児。未熟児,乳幼児。孤児院。双生児,産児制限。小児科。園児。胎児。女児,toddler。orphan。children,childcare。infant。premature baby,infants。orphanage。twins
滑,slide,滑る。滑らか。円滑,滑稽。滑走路。滑り台,滑走。潤滑油。滑空,滑車。地滑り。滑り込む。横滑り,slide。smooth。undisturbed,funny。runway。slide,gliding。lubricant。air gliding
