Words,Reading,M1,M2,M3,S1,T1
の,no,"p. case of, in, at, for, by",,,彼はこの大学の学生だ。,He is a student at this university.
に,ni,"p. case at, on, in, to, for",,,私は大阪に住んでいます。,I live in Osaka.
は,wa,p. topic,,,好きなスポーツはテニスです。,My favorite 	sport is tennis. 
た,ta,aux. past,,,昨日、彼を見ましたか。,Did you see him yesterday? 
を,o,p. case accusative,,,彼は毎晩ビールを飲む。,He drinks beer every night.
だ,da,aux. copula,,,僕は英語が苦手だ。,I’m not good at English.
が,ga,p. case nominative,,,こちらが私の妻です。,This is my wife.
て,te,p. conj. reason,,,お金がなくて、海外旅行できない。,I don’t have money so I can’t travel abroad.
と,to,"p. case and, or, with, if",,,彼とレストランへ行った。,I went to a restaurant with my boyfriend. 
ます,masu,aux. polite (after verb),,,来週京都へ行きます。,I will go to Kyoto next week. 
も,mo,"p. too, also",,,彼が行くなら、私も行きます。,"If he is going, I will go too. "
で,de,"p. case in, at, from, by",,,東京駅で彼女に会った。,I met her at Tokyo station. 
ている,teiru,cp. continuation,,,雨が降っている。,It’s raining.
です,desu,aux. copula,,,彼は独身です。,He is single.
れる,reru,aux. passive,,, 日本で使われている通貨は円です。,The currency used in Japan is yen. 
という, toiu,"cp. called, named",,,太郎という男の子を知っていますか。,Do you know a boy called Taro? 
事,koto,n. thing,,,今年はいろいろな事があった。,All kinds of things happened this year. 
言う,iu,"v. say, speak, talk",,,はっきり言うと、あなたの言っていることは無意味です。,"Frankly speaking, you are talking nonsense."
のです,nodesu,cp. assertion,,,どうしたんですか。,What’s the matter?
する,suru,"v. do, make",,, 仕事をしなければなりません。,I have to do my work. 
まあ,maa,interj. wow! oh my god!,,,まー、なんて素晴らしいんでしょう。,Wow! 	That’s amazing! 
の,no,p. possessive,,,彼が言ったのは本当だ。,What he said is true.
ある,aru,"v. be (existence), have (possession), happen, occur",,,彼の報告書は問題がある。,His report has some problems.
ね,ne,"p. disc. isn’t it?, don’t you?",,,いい天気ですね。,"It’s a nice day, isn’t it?"
ない,nai,aux. not,,,彼は朝ごはんを食べない。,He doesn’t have breakfast. 
なる,naru,"v. become, get, come to do, start to do, turn into",,, 彼は金持ちになるでしょう。,He will become rich. 
か,ka,p. disc. question,,,コーヒーか紅茶はいかがですか。,Would you like some coffee or tea? 
その,sono,adn. that,,,そのカバンを取ってくれませんか。,Can you pass me that bag? 
けれど,keredo,"conj. though, although",,,このアパートはあまり良くないけれど安い。,"This apartment is cheap, though it’s not so nice."
から,kara,p. case from,,,ここからその店までは遠い。,The shop is a long way from here. 
よう,you,aux. inducement,,,一緒に映画を見よう。,Let's watch a movie together.
思う,omou,"v. think, believe, feel, expect",,,私はそう思いません。,I don’t think so.
で,de,"conj. so, then",,,で、あの話はどうなりましたか?,So what happened about the story you mentioned? 
か,ka,p. if; or,,,誰か来たようだ。,It seems that someone has come. 
が,ga,p. conj. adversative,,,いい天気だが、風が冷たい。,It’s a sunny day but the wind is chilly. 
物,mono,"n. thing, object, stuff",,,そんなに高い物は買えません。,I can’t buy such expensive stuff. 
そう,sou,"adv. so, such",,,私もそう思います。,I think so too.
何 ,nani,"pron. what, something, anything, nothing",,,何を考えているんですか?, What are you thinking?
と,to,"p.conj. if, when, with",,,お酒を飲みすぎると、眠くなってしまう。,Drinking too much makes me sleepy.
私,"watashi, watakushi, atashi ",pron. I,,, 私は寿司が好きです。, I like sushi.
てしまう,te shimau,cp. end up doing,,,ダイエット中なのに、つい、甘いものを食べてしまう。,"I’m on a diet, but I can’t stop eating sweets."
それ,sore,pron. that,,,それは明子さんのカバンですか。, Is that Akiko’s bag?
とか,to ka,"p. and, or",,,ケーキとかチョコレートばかり食べるから、君は太るんだ。,"You gain weight, because you always eat cake and chocolate."
この,kono,adn. this,,,この本をもう読みましたか。,Have you read this book?
無い,nai,"i-adj. there is no, no, not",,,今、お金が無いんです。,I have no money now.
行く,"iku, yuku",v. go,,,すぐ行きます。,I'll be right there.
のだ,no da,n da cp. assertion,,,彼女は何も知らないのだ。,She doesn’t know anything.
せる,seru,aux. causative,,,子供にピアノを習わせたい。,I want my child to learn how to play the piano.
これ,kore,pron. this,,,これをください。,I will take this. 
もう,mou,"adv. already, soon, again",,,もう寝ます。,I’ll go to bed soon.
である,de aru,cp. copula (formal),,,これが実験の結果である。,These are the results of the experiment.
時,toki,n. time,,,時が悲しみを癒してくれますよ。,Time will heal your sorrow.
な,na,p. disc. prohibition,,,動くな、手を挙げろ。,Don’t move! Get your hands up!
ず,zu,aux. negation,,,彼は何も言わずに去ってしまった。,He left without saying anything.
ので,no de,"p. conj. as, because, since",,, 娘はまだ小さいので手がかかります。,"As my daughter is still very young, she needs to be looked after."
人,hito,"n. person, people, human being",,,その歌手は若い人に人気がある。,That singer is popular among young people.
よ,yo,"disc. assertion, reminding (informal)",,,また来るよ。,I will come again.
こう,kou,"adv. so, like this",,,粉と水を混ぜ、こうしてよくこねてください。,"Mix flour and water together, and knead the dough like this."
から,kara,"p. conj. because, since",,,雨が降っているから、出かけるのはやめます。,"I will not go out, because it’s raining."
ば,ba,p.conj. if,,,雨がふれば、試合は中止だ。,"If it rains, the game will be cancelled."
や,ya,"p. and, or",,,結婚式に家族や友人を招待した。,We invited our family and friends to the wedding. 
てはいけない,te wa ike nai,"cp. must not, should not",,,約束を忘れてはいけない。,You must not forget your promise.
正しい,tadashii,"i-adj. right, accurate, proper",,,三つの中から正しい答えを選びなさい。,Select the right answer from the three options.
ほぼ,hobo,"adv. about, nearly, almost",,, 私は毎日ほぼ同じ時間に起きます。,I wake up at about the same time every morning.
表わす,arawasu,"v. show, express, symbolize",,,この言葉は私の気持ちをよく表している。,These words really express my feelings.
毎年,maitoshi,"adv., n. every year, annually",,,私の家族は毎年海外に行きます。,My family goes abroad every year.
文字,moji,"n. letter, character, writing",,,世界には文字を持たない言語も多くある。,There are many languages in the world that have no writing.
空,sora,"n. sky, air",,,空には雲が一つもない。,There is not a cloud in the sky. 
に対し ,ni taishi ,"cp. toward, against, in contrast to ",,, 皆会社に対し多くの不満を持っていた。,Everyone had many complaints against the company.
明日,asu,"adv., n. tomorrow",,,明日は晴れるでしょう。,It will be fine tomorrow.
役割,yakuwari,"n. part, role",,,彼はプロジェクトで重要な役割を果たしている。,He plays an important role in this project.
地球,chikyuu,"n. earth, globe",,,月は地球の周りを回っている。,The moon orbits the earth. 
公園,kouen,n. park,,,公園で散歩するのが好きだ。,I like having a walk in the park.
個人,kojin,n. individual,,,参加するかどうかは個人の自由だ。,It’s up to individuals whether to participate or not.
やら,yara,"p. and, or",,,掃除やら洗濯やらやることが多い。,"I have many things to do, such as cleaning the house and doing the"
消える,kieru,"v. go off, disappear",,,急に電気が消えてしまった。,The light suddenly went out.
激しい,hageshii,"i-adj. fierce, intense, severe",,,背中に激しい痛みを感じた。,I felt an intense pain in my back.
短い,mijikai,i-adj. short,,,あの髪の短い女の子が私の娘です。,That girl with short hair is my daughter.
薬,kusuri,n. medicine,,,この薬は一日三回飲んでください。,Take this medicine three times a day.
試合,shiai,"n. match, game, bout",,,試合は六時に始まります。,The game will start at six.
成長する ,seichou suru,n. growth,v. grow,,子どもは成長が早い。,Children grow quickly.
おなか,onaka,"n. stomach, belly",,,ちょっとおなかが痛いんです,I have a little pain in my stomach.
機能する,kinou suru,"n. function, capability, feature","v. function, work",,この新しいモデルのほうが機能が多い。,This new model has more features.
ボール,booru,n. ball,,,ゴールに向けてボールを蹴った。,I kicked the ball toward the goal.
少年,shounen,"n. boy, juvenile",,,野球は日本の少年に最も人気のあるスポーツの1つだ。,Baseball is one of the most popular sports among boys in Japan.
五時,go ji,n. five o’clock,,,彼は五時ごろ戻ります。,He’ll be back around five o’clock. 
弁当,bentou,n. boxed lunch,,,お弁当を買いに行く。,I’m going to get a lunch box.
方達 ,kata-tachi,n. people (honorific),,,私はその方達に大変感謝しています。,I am very grateful to those people. 
久しぶり,hisashiburi,n. after a long time,,,彼女から久しぶりに電話が来た。,I had a call from her for the first time in a long time.
とたん,totan,n. as soon as,,, 警察官を見たとたん、彼は逃げ出した。,As soon as he saw the policeman he ran away.
要する,yousuru,"v. need, take",,,世界経済は回復するのに数年を要します。,The global economy will need several years to recover.
幅,haba,"n. width, breadth, difference, latitude ",,,その橋は幅が二十メートルある。,The bridge is twenty meters in width.
周辺,shuuhen,"n. outskirts, around",,,そのホテルの周辺にはたくさんの店やレストランがある。,The area around the hotel has many shops and restaurants.
十日,too-ka,"n. tenth (date), ten days",,,十一月十日までにお返事をください。,Please respond by November 10.
取得する,shutokusuru,n. acquisition,v. acquire,,その国への入国はビザの取得が必要です。,You need to acquire a visa to enter the country.
挑戦する,chousensuru ,n. challenge,"v. challenge, try",,若い人には新しいことに挑戦してほしい。,I want young people to try new things.
まあまあ,maamaa,"na-adj. so-so, not bad","adv. fairly, moderately",,レポートの出来はまあまあだった。,The result of the report was not bad.
動揺する,douyou suru,n. unrest,v. be agitated,,彼女は激しく動揺した。,She was violently agitated.
一段,ichidan,n. one step,,,本堂は一段高い場所にある。,The main building is located one level higher. 
相次ぐ,aitsugu,v. happen one after another,,,不可解な事件が相次いでいる。,Mysterious incidents are happening one after another.
免れる,manugareru,"v. escape, avoid",,,最悪の事態は免れた。,We avoided the worst situation.
略,ryaku,"n. omission, abbreviation",,,ユネスコが何の略か知っていますか。,Do you know what UNESCO stands for?
気楽,kiraku,"na-adj. comfortable, easy, easygoing",,,彼女は気楽に話ができる友達だ,She is a friend that I can talk with comfortably.
来週,raishuu,n. next week,,,来週から学校が始まる。,School starts next week.
三千円,sanzen en,n. three thousand yen,,,このシャツは三千円です。,This shirt costs three thousand yen.
示唆する,shisa suru,n. suggestion,v. suggest,,彼の発言は示唆に富んでいた。,His remarks were full of suggestions.
しみじみ,shimijimi,"adv. keenly, heartily, from one’s heart",,,彼女の親切さをしみじみと感じた。,I felt deeply how kind she was.
詩人,shijin,n. poet,,,彼は有名な詩人だ。,He is a famous poet.
署名する,shomei suru ,n. signature,v. sign,,千人の署名を集めた。,"We collected the signatures of 1,000 people."
給付する,kyuufu suru,n. provision,v. provide,,失業保険の給付を受けた。,I was provided with unemployment insurance.
柿,kaki,n. persimmon,,,柿を食べた。,I ate persimmons.
二日目,futsu-ka-me,n. second day,,,プログラムの二日目は大変よかった。,The second day of the program was very good.
診察する,shinsatsu suru,"n. medical examination, consultation",v. examine,,専門医の診察を受けたほうがいいだろう。,You’d better consult the specialist.
ハム,hamu,n. ham,,,ハムのサラダを作った。,I made a ham salad.
悪魔,akuma,"n. devil, demon",,,彼は悪魔のような人だ。,He is a fiendish person.
にらむ,niramu,v. stare,,, 知らない人がこちらをにらんでいる。,A stranger is staring at me.
 放出する,houshutsu suru,n. emission,v. emit,,大気中に二酸化炭素を放出する。,It emits carbon dioxide into the atmosphere.
 解除する,kaijo suru,n. cancellation,"v. cancel, lift",, 規制が解除された。,The regulation was lifted.
本能,honnou,n. instinct,,,彼は本能のままに生きている。,He lives by instinct.
地形,chikei,"n. topography, landform",,,この辺りの地形は複雑だ。,The topography of this area is complicated.
二十九,nijuu kyuu,num. twenty-nine,,,息子は二十九でまだ無職だ。,"My son is twenty-nine, but still has no job."
なじみ,najimi,n. familiarity,,,なじみの店で買い物をする。,I shop at familiar shops. 
例える,tatoeru,v. compare,,,人生はよく旅に例えられる。,Our life is often compared to a journey.
返済する,hensai suru,n. repayment,v. repay,,借金を返済した。, I repaid my debts.
民法,minpou,n. civil law,,,民法を学ぶ。,I study civil law.
切り取る,kiritoru,"v. cut off, tear off",,,新聞記事をはさみで切り取った。, I cut out the newspaper article with scissors.
研究開発,kenkyuu kaihatsu,n. research and development,,,ここで新技術の研究開発が行われている。,The research and development of new technology are carried out here.
痛める,itameru,v. hurt,,,腰を痛めてしまった。, I hurt my back.
手話,shuwa,n. sign language,,,手話を習いたい。,I want to learn sign language.
六年生,oku nen-sei,"n. sixth grade, sixth year",,,娘は六年生です。,My daughter is in Year Six.
家,uchi,"n house, home",,, 家においでよ。,Come to my house.
塔,tou,n. tower,,,向こうに塔が二つ建っている。,Two towers stand over there.
しつこい ,shitsukoi,i-adj. persistent; over-rich (food),,,セールスマンにしつこく勧誘された。,The salesman persuaded me persistently.
プラスチック,purasuchikku, n. plastic,,,プラスチックの玩具は簡単に壊れない。,Plastic toys do not not break easily.
追い詰める,oitsumeru,"v. run down, corner",,,犯人はついに追い詰められた。,The criminal was cornered at last.
遅く,osoku,n.late,,,夫は遅く帰ってくる。,My husband comes home late.
イスラエル,isuraeru,n. Israel,,,初めてイスラエルを訪問した。,I visited Israel for the first time.
信念,shinnen,"n. belief, faith",,,あの人は強い信念を持っている。,That person has strong faith.
数日,suu-jitsu,n. few days,,,完成まで数日かかるだろう。, It will take a few days to complete.
あきれる,akireru,"v. be amazed, be disgusted",,,彼の非常識な行為にあきれてしまった。,I was disgusted with his senseless behavior.
抗議,kougi,"n. protest, objection",v. object,,彼は強く抗議した。,He protested strongly.
花粉,kafun,n. pollen,,, 今年は花粉の量が多い。,The pollen count is high this year.
みそ,miso,n. miso; key point,,,野菜にみそをつけて食べた。,I ate the vegetables with miso. 
何時間,nanjikan,n. how many hours,,,何時間待てばいいのだろうか。,I wonder how many hours I will have to wait.
一回目,ik-kai-me,n. first time,,,一回目は失敗した。,The first time was a failure.
調味料,choumi-ryou,"n. seasoning, spice",,,足りない調味料を買ってくる。,I will go to buy the seasonings we lack.
無言,mugon,"n. silence, in silence, without speaking",,,彼女は無言のままうなずいた。,She nodded in silence.
住宅街,juutaku-gai,n. housing; residential area,,,住宅街にすむ。,He lives in a residential area.
心境,shinkyou,n. state of mind,,,彼の心境は変化した。,His mental state has changed.
居間,ima,n. living room,,,居間で家族と食事をする。,We have dinner in the living room.
大嫌い,daikirai,na-adj. hate,,,私はゴキブリが大嫌いだ。,I hate cockroaches.
作曲,sakkyoku,n. musical composition,v. compose,,この曲はモーツァルトが作曲した。,This song was composed by Mozart.
日中,nitchuu,n. during the day,,,日中は外に出ない。,I won’t go out during the day.
適度,tekido,na-adj. moderate,,,あの食べ物は適度な温度で保つことが大切だ。,It’s important to keep that food at a moderate temperature.
五歳 ,go-sai ,n. five years old,,,うちの孫は五歳です。,My grandson is five years old.
うどん,udon,"n. udon, thick white noodles",,,うどんが好きだ。,I love udon.
汽車,kisha,n. train,,,汽車で旅行に行く。,We will go on a trip by train.
業種,gyoushu,"n. category of business, type of industry",,,業種ごとに名刺を並べる。,Arrange the business cards according to the type of business.
ただただ,tadatada,"adv. all (one) can do is, simply, nothing but",,,ただただ泣いてばかりいた。,All she could do was cry.
倍,bai,n. times,,,二の二倍は四だ。,Two times two is four.
祝う,iwau,v. celebrate,,,私たちは先日銀婚式を祝った。,We celebrated our silver wedding the other day.
乏しい,toboshii,"i-adj. few, little",,,この国は資源が乏しい。,This country has few natural resources.
国鉄,kokutetsu,n. national railway,,,あれは国鉄の駅です。,That is a national railway station.
受賞,jushou,n. winning a prize,"v. win (receive) a prize, be awarded a prize",,受賞者がスピーチをした。,A prize winner made a speech.
立ち上げる,tachiageru,"v. boot up, start",,,新しい事業を立ち上げる。,We will start up a new business.
留める,todomeru,"v. hold, keep",,,被害を最小限に留めることが大切だ。,It is important to keep the damage to a minimum.
支度,shitaku,n. preparations,v. prepare,,支度は終わりましたか。,Did you finish the preparations?
髭,hige,n. mustache; beard,,,髭を伸ばす。,He is growing a beard.
異様,iyou,na-adj. strange,,,異様な光景だった。,It was a strange sight.
一周,is-shuu,n. one round,,,このコースは一周5キロです。,This course is five kilometers from start to finish.
はたち,hatachi,n. twenty years old,,,私の娘は今年はたちになった。,My daughter turned twenty this year.
中途半端 ,chuuto hanpa,"na-adj. unfinished, half-done",,,中途半端にするな。,Don’t leave things unfinished.
味わい,ajiwai,"n. profound, thought-provoking",,,味わい深い言葉だ。,The remark is very profound.
熱する,nessuru,v. heat,,,フライパンを十分熱してから肉を焼いてください。,Please fry the meat after heating the frying pan well.
大概,taigai,n. generally,,,大概郵便は十時頃くる。,Generally the mail is delivered about ten o’ clock.
分量,bunryou,"n. quantity, amount",,,材料の分量を量る。,I measure the quantity of materials. 
薄れる,usureru,v. become dim,,,あのころの記憶は薄れてしまった。,I have only faded memories of those days.
六十年,rokujuu nen,n. sixty years,,,この町に住んで六十年だ。,I have lived in this town for sixty years. 
だし,dashi,n. soup stock,,,このカニの出しはおいしい。,The crab soup stock is delicious.
職務,shokumu,n. duty,,, 職務について質問する。,He asks about the person’s duties.
各々,onoono,n. each,,,各々でお昼ご飯は持ってきてください。,Please each bring lunch.
人柄,hitogara,n. personality,,,彼は人柄がいい。,He has a nice personality.
明く,aku,v.open,,,眠くてなかなか目が明かない。,I’m so sleepy that I can’t keep my eyes open.
感触,kanshoku,"n. feel, touch",,,このかばんは感触がやわらかい。,This bag is soft to the touch.
ボーリング,booringu,n. bowling,,,日曜日にボーリングに行こう。,Let’s go bowling on Sunday.
刑事,keiji,n. police detective,,,刑事が事件について聞き込みをする。,A police detective is carrying out interviews about the incident.
つ,tsu,p. [indicating contrasts or coordinations],,,走者達は抜きつ抜かれつ先頭を争っている。,The runners are taking the lead and being overtaken alternately.
網,ami,n. net,,,たくさんの魚が網にかかった。,A lot of fish were caught in the net.
既存,kizon,n. existing,,,既存の枠組みを見直すべきだ。,The existing framework should be reexamined.
埃,hokori,n. dust,,,埃だらけになった。,I was covered with dust from head to toe.
資する,shisuru,v. contribute,,,その発明はあのビジネスに大きく資することになるだろう。,The invention will contribute greatly to the development of that business.
何せ,nanise,"adv. anyhow, after all, in any case",,,何せ朝から晩まで働いて疲れきっているんだ。,"Anyhow, I’m tired out from working from morning till night."
顔色,kaoiro,n. kaoiro,,,彼は顔色が悪い。,He has a sickly complexion.
同一,douitsu,"na-adj. same, identical",,,それは私が失くした時計と同一の物だ。,That is the same watch as the one I lost.
塩分,enbun,n. salt,,,塩分をとりすぎると体に悪い。,Eating food that contains a lot of salt is bad for one’s health.
明記,meiki,n. writing clearly,v. write clearly,,名前と住所を明記してください。,Please write clearly your name and address.
