Words,Reading,Meaning,S1,T1
相手,あいて,"companion, partner, opponent",彼女の相手をするのは楽しい。,I enjoy her company.
気温,きおん,air temperature,気温が摂氏10度に上がった。,Temperatures rose to 10 degrees Celsius.
世話,せわ,"looking after, help, aid, assistance",その少年は私の伯母の世話になっている。,The boy is in the care of my aunt.
何とか,なんとか,"somehow, one way or another",何とか宿題を仕上げた。,I managed to finish my homework.
卒業式,そつぎょうしき,graduation ceremony,卒業式は三月二十日に行われます。,The graduation ceremony will take place on March 20.
自信,じしん,"confidence, self-assurance",彼は自分の言葉に自信が無い。,He is not confident in his words.
点,てん,"point, mark, spot",それが重要な点です。,That is an important point.
大都市,だいとし,"big city, metropolis",東京は日本のどの都市にも劣らない大都市だ。,Tokyo is as big a city as any in Japan.
へそくり,へそくり,"secret savings, stash",へそくりでブラウスを買った。,I bought a blouse with the savings I had tucked away.
違い,ちがい,difference,あなたは違いが分かります。,You can tell the difference.
文化,ぶんか,culture,彼は日本の文化に詳しい。,He is an expert on Japanese culture.
節約,せつやく,"savings, economising",自分で服を作ったら節約になりますよ。,You can save money if you make your own clothes.
事,こと,thing,起こりうる三つ目の事は非常に素晴らしいものです。,The third thing that can happen is very wonderful.
一,いち,one,他人に対しては一から始めます。,"For others, we start from scratch."
物,もの,thing,それは私が使う物です。,It's for my personal use.
人,ひと,people,人を捜している。,I'm looking for someone.
二,に,two,私は二時間ここにいます。,I have been here for two hours.
三,さん,three,この仕事は三時間かかった。,This job took three hours.
時,とき,"hour, time",私の時はまだ来ていません。,My time has not come yet.
十,じゅう,ten,もう夜の十時だ。,It is already ten o'clock at night.
方,ほう,"way, direction",どっちの方へみんなは行きましたか。,Which way did everyone go?
中,ちゅう、なか,"in, inside, middle, among",東京駅はラッシュ中だ。,Tokyo Station is in rush hour.
五,ご,five,彼女は五歳です。,She is five years old.
所,ところ,"place, spot",遠足に好適の所が見つかった。,We found a good place for an excursion.
四,よん,four,四時間以上も歩きつづけています。,We have been walking for more than four hours.
為,ため,"good, advantage, benefit, sake",学生の為に便宜をはかる。,Accommodations for students.
自分,じぶん,myself,自分の事をしなさい。,Do your own thing.
日本,にっぽん,japan,まさに日本的な考え方だ。,This is a very Japanese way of thinking.
日,ひ,"day, sun",日がさんさんと照っている。,The sun is shining brightly.
千,せん,thousand,この機械は１時間に千個のねじを製造する。,This machine produces a thousand screws per hour.
二十,にじゅう,twenty,彼は一日二十ドル稼ぐ。,He makes twenty dollars a day.
今,いま,now,今チェックしたよ。,I just checked now.
六,ろく,six,私は六年間英語を勉強している。,I have been studying English for six years.
場合,ばあい,case,もし無理な場合は注文をキャンセルします。,"If this is not possible, we will cancel the order."
前,まえ,"before, ago, in front",彼には前に会ったと思う。,I think I met him before.
八,はち,eight,仕事は八時までには終わるだろう。,Work would be over by eight o'clock.
七,なな,seven,私は七時に家を出た。,I left home at seven o'clock.
上,うえ,"above, top",テーブルの上にラジオがあります。,There is a radio on the table.
家,いえ,"house, home",８時に私の家に来て下さい。,Come to my house at 8:00.
気,き,"spirit, mind, heart, nature, mood, ambiance",そのアイデアは気に入らない。,I don't like that idea.
九,きゅう,nine,九時に来ていただきたいのですが。,I would like you to come at nine o'clock.
内,うち,"inside, within, among",明るい内にテントを張ってしまおう。,Let's set up the tent while it's still light.
九百,きゅうひゃく,nine hundred,九百年であった。,It was nine hundred years.
三十,さんじゅう,thirty,もう三十分待った方が良いと思う。,I think we should wait another thirty minutes.
他,ほか,"other, the rest, besides",他には考えられない。,I can't think of anything else.
子供,こども,children,彼は子供のころからの友達だ。,He's been a friend of mine since we were kids.
間,あいだ,"space, gap, interval, span, between",東京と名古屋の間をバスが通っている。,Buses run between Tokyo and Nagoya.
問題,もんだい,"problem, issue",そんな提案は問題にならない。,Such a proposal is not a problem.
訳,わけ,"reason, cause, conclusion, meaning",訳もなく断るわけにはいかない。,I couldn't just say no for no reason.
必要,ひつよう,need,あなたに必要なものは勇気である。,What you need is courage.
度,ど,degree,この食品は１０度以下で保存したほうがいい。,This food should be stored below 10 degrees Celsius.
手,て,hand,私のは手に持っています。,I hold mine in my hand.
時間,じかん,time,お時間わかりますか。,Do you know what time it is?
人間,にんげん,"human being, person",君には人間らしい心はないのか。,Do you not have a human heart?
万,まん,ten thousand,月一万では生活していけない。,I can't live on ten thousand yen a month.
関係,かんけい,"relation, relationship, connection",私はそのグループとは関係なかった。,I had nothing to do with that group.
話,はなし,"talk, speech, story",その話を聞かせなさい。,Let them tell that story.
国,くに,country,日本はとてもきれいな国なんだ。,Japan is a very beautiful country.
男,おとこ,"man, male",二人の男はバーで飲んでいた。,Two men were drinking at a bar.
百,ひゃく,hundred,私の息子は百まで数えられる。,My son can count to a hundred.
社会,しゃかい,society,彼は社会によかれと思ってそれをした。,He did it for the good of society.
顔,かお,face,きれいな顔の女の人。,A woman with a beautiful face.
五十,ごじゅう,fifty,その列車は時速五十マイルの速さで走っている。,That train is going fifty miles per hour.
次,つぎ,next,次のページを見なさい。,See next page.
言葉,ことば,words,その言葉は初めて聞きました。,I had never heard that word before.
子,こ,child,かわいい子紹介してよ。,Introduce me to a cute girl.
四十,よんじゅう,forty,彼らは四十分にクラスから出る。,They leave class at forty minutes.
意味,いみ,meaning,私の言っている意味が分かりますよね。,You know what I mean.
侭,まま,"as it is, condition, state",その結果はまだ調べられていないままだ。,The results remain unexamined.
力,ちから,"power, force, energy, capability, ability, effort",それは人間の力ではできない。,That cannot be done by human power.
心,こころ,"mind, heart, spirit",人間は心と体から成っている。,Human beings consist of mind and body.
時代,じだい,"era, period, epoch",私は学校時代をよく覚えている。,I remember my school days well.
世界,せかい,world,それは大きな世界です。,It is a big world.
九十,きゅうじゅう,ninety,雇用主の活動がカレンダー上で九十日間停止させられる場合もある。,The employer's activities may be suspended for ninety days on the calendar.
女,おんな,"woman, female",ボスの女はグラマーだ。,The boss's woman is glamorous.
会社,かいしゃ,company,その会社は何を作っているのですか。,What does the company make?
声,こえ,voice,声を大にして協力の必要を説く。,Speak out loud and preach the need for cooperation.
仕事,しごと,work,新しい仕事を割り当てられた。,I was assigned a new job.
共,とも,together,夕食を共にした。,I had dinner with him.
一人,ひとり,one person,一人ずつ来てください。,Come one at a time.
皆,みな,everyone,皆一緒に行こう。,Let's all go together.
下,した,"below, under",スーツケースを下に置いた。,I put my suitcase down.
数,すう,"number, amount",私はそれを数ダース持っている。,I have several dozen of them.
六十,ろくじゅう,sixty,私はここに六十年余り住んでいる。,I have lived here for more than sixty years.
以上,いじょう,more than,これ以上できません。,I can't do this any more.
生活,せいかつ,life,彼は平和な生活をしている。,He lives a peaceful life.
会,かい,"meeting, gathering",会は５時頃に終る予定です。,The meeting will end around 5:00.
二人,ふたり,two,スパゲッティを二人前注文した。,I ordered two servings of spaghetti.
八十,はちじゅう,eighty,五年から八十年です。,Five to eighty years.
頃,ころ,"approximation, around, about",日付の変わる頃にホテルにチェックイン。,Check in to the hotel around the time the date changes.
女性,じょせい,"woman, female",その女性はメモを取っている。,The woman is taking notes.
先,さき,"earlier, some time ago",私が家を買えるのはずっと先のことだろう。,It will be a long time before I can afford a house.
法,ほう,"law, act, principle, 	method
",私たちは常に法を守らなければならない。,We must always obey the law.
全て,すべて,all,すべての学生がその提案に同意した。,All students agreed to the proposal.
相手,あいて,other party,彼女の相手をするのは楽しい。,I enjoy her company.
本当,ほんとう,"truth, reality, right",それが本当なら彼らは驚くでしょう。,They would be surprised if that were true.
学校,がっこう,school,学校が終わってから公園で遊ぼう。,Let's play in the park after school.
点,てん,"spot, point, mark, score, aspect, matter",品質の点ではこの品物があれよりもすぐれている。,"In terms of quality, this item is better than that one."
母,はは,mother,母の胸に抱かれて眠る幼子。,An infant sleeping on its mother's chest.
零,れい,zero,試験で零点をとる。,Score a zero on the exam.
七十,ななじゅう,seventy,温度は七十度です。,The temperature is seventy degrees.
アメリカ,あめりか,america,アメリカのミュージカルを見ました。,I saw an American musical.
形,かたち,"form, figure, shape",これらの靴は大きさは違うが形は違わない。,These shoes are different in size but not in shape.
方法,ほうほう,"method, process, manner",あなたが一番いいと思う方法でやってください。,Do it the way you think is best.
筈,はず,should,彼は来るはずでした。,He was supposed to come.
企業,きぎょう,"enterprise, business, corporation",その薬を作っているのは日本の企業である。,It is a Japanese company that manufactures the medicine.
情報,じょうほう,information,その問題に関する情報を集める。,Gather information on the issue.
研究,けんきゅう,research,彼らは放射能を研究している。,They study radioactivity.
頭,あたま,head,まだ頭がクラクラする。,My head is still spinning.
通り,とおり,"street, avenue",彼の家はにぎやかな通りに面している。,His house faces a busy street.
先生,せんせい,teacher,最近は先生と生徒間のコミュニケーションが乏しい。,Communication between teachers and students is scarce these days.
生,なま,"raw, fresh",彼は魚を生で食べない。,He does not eat fish raw.
存在,そんざい,"existence, being",プライバシーなんて存在しない。,There is no such thing as privacy.
名,な,name,彼の名はこの町のみんなに知られている。,His name is known to everyone in this town.
経済,けいざい,"economics, business, finance, economy",経済をうまく運営できる政府は少ない。,Few governments can manage the economy well.
大学,だいがく,university,彼は大学に行く必要がある。,He needs to go to college.
父,ちち,father,父は中国へ行ってしまった。,My father went to China.
店,みせ,store,このバッグはどの店にも置いていません。,This bag is not available in any store.
別,べつ,another,知っていることと教えることはまったく別だ。,Knowing and teaching are two very different things.
口,くち,mouth,私達は口で食べる。,We eat with our mouths.
質問,しつもん,question,質問をさせてください。,Let me ask you a question.
現在,げんざい,current,現在の工場の規模ではこれ以上の増産は見込めない。,"With the current scale of the plant, further increase in production cannot be expected."
市,し,city,この市を案内していただけませんか。,Could you please guide us through this city?
中国,ちゅうごく,china,彼は中国に行きたがっている。,He wants to go to China.
語,ご,language,日本語が大好きです。,I love Japanese language.
水,みず,water,私に水を少しください。,Please give me some water.
電話,でんわ,phone,私は電話で彼と話しました。,I spoke with him on the phone.
二千,にせん,two thousand,あのレストランは毎日二千食準備している。,"That restaurant prepares 2,000 meals every day."
気持ち,きもち,feeling,あなたの気持ちがよく分かる。,I know exactly how you feel.
結果,けっか,result,結果はどうなりましたか。,What were the results?
主義,しゅぎ,"principle, doctrine",我々は同じ主義を抱いている。,We embrace the same principle.
側,がわ,side,私の街は海の側にある。,My city is by the sea.
地,ち,ground,彼は地に足がついていない。,He doesn't have his feet on the ground.
今日,きょう,today,今日何を食べてみたいですか。,What would you like to eat today?
教育,きょういく,education,非常に厳しい教育を受けた。,He received a very rigorous education.
県,けん,prefecture,日本には４３県があります。,There are 43 prefectures in Japan.
道,みち,"road, street, way",道を教えてもらえませんか。,Could you please show me the way?
二百,にひゃく,too hundred,私は税金に二百ドル払った。,I paid two hundred dollars in taxes.
殆ど,ほとんど,"almost, most",状態は去年とほとんど変わりがない。,The condition is much the same as last year.
山,やま,mountain,日本で一番高い山は何ですか？,What is the highest mountain in Japan?
風,かぜ,wind,風が強くなってきたよ。,The wind is getting stronger.
場,ば,"place, field, occasion, scene, session",この場をお借りして一言挨拶を申し上げます。,I would like to take this opportunity to say a few words.
人々,ひとびと,people,ここにいた人々はみんな行ってしまった。,All the people who were here have gone.
姿,すがた,appearance,彼女は自分の姿を気に入っている。,She cares a lot about her personal appearance.
一緒,いっしょ,together,全部一緒にするといくらになりますか。,How much would it cost to put it all together?
状態,じょうたい,"state, current status, condition",患者は依然として意識不明の状態が続いている。,The patient remains unconscious.
自然,しぜん,"nature, natural",私たちは自然をよい状態にしておかなければなりません。,We must keep nature in good condition.
部屋,へや,room,部屋にエアコンはありますか。,Is there air conditioning in the rooms?
部分,ぶぶん,part,ぼくはこの問題のこの部分は詳しくない。,I am not familiar with this part of the issue.
実,じつ,"truth, reality",実のところ彼の発言に少々驚いている。,"As a matter of fact, I am somewhat surprised by his statement."
学,がく,"study, knowledge, education, study of",今日は私たちの最終学日です。,Today is our last day of school.
多く,おおく,"much, many",多くの事をすることが出来ます。,It can do many things.
活動,かつどう,acctivity,彼女は多くの学校の活動に参加する。,She participates in many school activities.
事件,じけん,"event, affair, incidents",私はその事件と何の関係もなかった。,I had nothing to do with that incident.
利用,りよう,"use, utilization, application",ホテルのプールが利用できる。,You can use the hotel's swimming pool.
一般,いっぱん,"general, universal, common",その公園は一般の人々のために作られた。,Its park was created for the general public.
最初,さいしょ,"first, beginning",最初から始めよう。,Let's start at the beginning.
実際,じっさい,"actual, practical, reality, actual conditions",実際感じたままを話してよい。,You may speak as you actually feel.
地域,ちいき,"local, area, region",この地域は雨が続くでしょう。,Rain will continue to fall in the region.
理由,りゆう,reason,これが私がここへ来た理由だ。,This is why I came here.
説明,せつめい,"explanation, description",彼にはその理由を説明する必要がありますか。,Does he need to explain the reason for this?
身,み,"body, 	oneself",こっちの身にもなってよ。,Put yourself in my position.
政治,せいじ,"politics, government",政治に興味がありますか。,Are you interested in politics?
神,かみ,god,僕は神世界の神になる。,I will be a god of the god world.
場所,ばしょ,"location, place",水が漏れている場所がわかった。,We found where the water was leaking.
評価,ひょうか,"rating, valuation, estimation",学生の能力を評価する。,Evaluate students' abilities.
普通,ふつう,"normal, usual, ordinary",そのような行動は幼児には普通のことだ。,Such behavior is normal for young children.
音,おと,sound,私はピアノの音が好きだ。,I like the sound of the piano.
図,ず,"figure, diagram, chart, graph, sight, scene",彼は図を使って説明した。,He used diagrams to illustrate.
内容,ないよう,contents,ビュッフェの内容を見せていただけますか。,Can you show us the contents of the buffet?
条,じょう,"article, provision",第６条議長は全会議を主宰するものとする。,Article 6. The president shall preside at all meetings.
労働,ろうどう,labor,その企業は週５日労働制を実施した。,The firm implemented a five-day work week.
自由,じゆう,freedom,彼女は自由を完全に保障された。,She was guaranteed full freedom.
外,そと,outside,部屋の外でちょっとの間待ちなさい。,Wait outside the room for a moment.
違い,ちがい,"difference, discrepancy",子供でも違いがわかるだろう。,Even a child would know the difference.
当時,とうじ,at that time,当時としては彼の意見は進歩的だった。,His views were progressive for the time.
自身,じしん,"self, personally",あなた自身が行った方がいいよ。,You should go in person.
意識,いしき,"awareness, consciousness",彼は３時間後に意識を回復した。,He regained consciousness three hours later.
事業,じぎょう,"business, project, operations",彼は私と一緒に事業をしていた。,He was my business associate.
結婚,けっこん,marriage,結婚に踏み切る。,Entering into marriage.
状況,じょうきょう,situation,現場の状況がわかったら知らせてくれ。,Let me know when you know what's happening on the ground.
文化,ぶんか,culture,彼は日本の文化に詳しい。,He is well versed in Japanese culture.
使用,しよう,"use, application, utilization",その会議室は現在使用中です。,That meeting room is currently in use.
夜,よる,night,彼は森で夜を明かした。,He spent the night in the woods.
理解,りかい,understanding,彼の講義は私にはさっぱり理解できない。,I have no idea what his lectures are about.
戦争,せんそう,war,その2国間で戦争が起こった。,War broke out between those two countries.
制度,せいど,"institution, system, organization",彼らは古い制度を廃止した。,They abolished the old system.
家族,かぞく,family,公園は近所の家族連れで賑わっていた。,The park was crowded with neighborhood families.
最近,さいきん,"lately, most recent, these days, recently",彼にはつい最近会ったばかりです。,I met him only recently.
程度,ていど,"degree, amount",彼はどの程度興味を示したのですか。,To what extent did he express interest?
八百,はっぴゃく,eight hundred,私はこの本に八百円を払った。,I paid eight hundred yen for this book.
型,かた,"type, model",コンパクト型にはおしゃれなデザインが多いですね。,There are many stylish designs in the compact type.
以外,いがい,"other than, with the exception of, excluding",水以外何も見えない。,I see nothing but water.
個人,こじん,individual,社会は個人に大きな影響を与える。,Society has a great impact on the individual.
村,むら,village,小さな村で彼の幸せが続いた。,His happiness continued in the small village.
例,れい,"example, practice, custom, instance",例を一つ示してください。,Please provide one example.
親,おや,parent,彼女は親の言う事を良く聞く。,She listens to her parents well.
歴史,れきし,history,彼は大学で歴史の勉強をしている。,He is studying history in college.
中心,ちゅうしん,"center, middle",その町の中心にすてきな公園がある。,There is a nice park in the center of the town.
目的,もくてき,"purpose, goal, aim",彼女をだまそうとした目的は何か。,What was the purpose of trying to deceive her?
元,もと,"origin, source",ここは元は荒れ地だった。,This place used to be a wasteland.
感,かん,"sense, feeling",彼女は感極まって泣いた。,She was so moved that she cried.
環境,かんきょう,environment,子供は環境から学ぶものである。,Children learn from their environment.
政府,せいふ,government,政府は増税を検討している。,The government is considering raising taxes.
技術,ぎじゅつ,"technology, 	technique, skill",日本の科学技術はすばらしい進歩をとげた。,Japanese science and technology have made wonderful progress.
其々,それぞれ,each,学生たちはそれぞれ自分の意見を持っている。,Each student has his or her own opinion.
最後,さいご,last,やるからには最後までやり通すんだよ。,"If you're going to do something, you have to finish it."
行動,こうどう,action,彼らの迅速な行動が彼の命を救った。,Their quick action saved his life.
色,いろ,color,このスカーフはぬれたら色があせた。,This scarf faded when it got wet.
一方,いっぽう,on the other hand,この家はもう一方にも入り口がある。,The house has an entrance on the other side.
基本,きほん,"basic, basis, standard, foundation",和服は直線が基本になっている。,Japanese clothes are based on straight lines.
写真,しゃしん,photo,その俳優の写真を撮る。,Take a picture of that actor.
感じ,かんじ,"feelings, sense",そんな感じだと思っていました。,I thought it was something like that.
事実,じじつ,"facts, truth, reality",この事実は彼らにほとんど知られていない。,This fact is largely unknown to them.
名前,なまえ,name,お名前をお聞かせいただけますか。,Could you please tell us your name?
運動,うんどう,"exercise, movement",犬は毎日運動させる必要がある。,Dogs need to be exercised daily.
足,あし,"feet, legs",転んで左足を折った。,I fell and broke my left leg.
昔,むかし,olden days,昔は婦人に選挙権が与えられていなかった。,"In the past, women were not given the right to vote."
変化,へんか,change,経済的変化を受ける。,Undergo economic change.
保険,ほけん,insurance,宝石商は常に十分な保険に入っている。,Jewelers are always well insured.
地方,ちほう,"district, region, locality",東北地方の冬は大変厳しい。,Winters in the Tohoku region are very severe.
世紀,せいき,century,今世紀最大の作曲家。,The greatest composer of this century.
管理,かんり,"management, control",彼は病院の管理運営に責任がある。,He is responsible for the administration and management of the hospital.
新聞,しんぶん,newspaper,彼は食事をしながら新聞を読む習慣がある。,He has a habit of reading the newspaper while eating.
客,きゃく,"customer, guest, visitor",あの店はお客が多い。,That store has a lot of customers.
国民,こくみん,people,彼らは日本の国民となった。,They became Japanese citizens.
