Words,Reading,Meaning,S1,T1
精神,せいしん,"spirit, mind, soul, heart",目の前の仕事に精神を集中させなさい。,Focus your mind on the task at hand.
娘,むすめ,daughter,ただ美しくなりたいという娘心さ。,I am just a girl who wants to be beautiful.
病院,びょういん,hospital,今日ようやく病院を出ます。,I am finally leaving the hospital today.
全体,ぜんたい,"overall, entirety, whole",その問題全体を検討しなさい。,Examine the question in its entirety.
調査,ちょうさ,"investigation, examination, survey",何人の人がその製品を使用したか調査が行われた。,A survey was conducted to determine how many people used the product.
経験,けいけん,experience,彼女は運転の経験が長いですか。,Does she have a long driving experience?
論,ろん,"theory, argument, discussion, dispute",この問題に対して可否の論が色々とあった。,There were various arguments for and against this issue.
効果,こうか,"effect, effectiveness, efficacy, result",この薬は彼の回復に効果があるかもしれない。,This drug may be effective in his recovery.
組織,そしき,"organization, structure, system",その組織について何か聞いたことがありますか。,Have you heard anything about the organization?
経営,けいえい,"management, administration, operation",彼には経営の才があります。,He has a talent for management.
行為,こうい,"act, deed, conduct",彼の行為の理由は説明できない。,The reasons for his actions cannot be explained.
メール,めーる,mail,もうサポートセンターにメールを送りました。,I already sent an email to the support center.
五百,ごひゃく,five hundred,事実な五百程度ではないかと思う。,I think it is about five hundred in fact.
国家,こっか,"state, country",国家はこれを構成する個人からできている。,The state is made up of the individuals who make it up.
責任,せきにん,"duty, responsibility",私の責任でこの研究を始めます。,I am responsible for starting this study.
自己,じこ,"self, oneself",彼は自己の主義に忠実でいる。,He remains true to his principles.
奴,やつ,"him, fellow, guy",なんて嫌なやつだ。,What a nasty fellow he is.
影響,えいきょう,"influence, effect, impact",爆発は周りの家には大した影響がなかった。,The explosion had no significant impact on the surrounding houses.
軍,ぐん,military,我が軍は敵の防御を突破した。,Our troops broke through the enemy's defenses.
海,うみ,sea,彼女の家は海の近くにあります。,Her house is located near the ocean.
三百,さんびゃく,three hundred,この部屋は三百人収容できる。,This room can accommodate three hundred people.
商品,しょうひん,goods,本当に最高の商品です。,It really is the best product.
機能,きのう,"function, feature, facility, faculty",その機能は働かなくなるだろう。,That function would not work.
夫,おっと,husband,夫はいつもベッドで本を読むんです。,My husband always reads in bed.
計画,けいかく,plan,週末の計画を立てる。,Plan for the weekend.
式,しき,"formula, equation, ceremony, style",その式に参加してくれますか。,Will you participate in that ceremony?
生産,せいさん,"production, manufacture",その自動車の生産は１９８０年に始まった。,Production of its cars began in 1980.
花,はな,flower,わたしはその花を見ている。,I am looking at the flower.
同時,どうじ,"simultaneous, same time",妹と出発が同時でしたか。,Were your sister and your departure at the same time?
対象,たいしょう,"target, object, subject",彼は研究の対象を拡大した。,He expanded the scope of his research.
辺り,あたり,"around, neighborhood, vicinity",あたりには誰も見えなかった。,No one was visible in the area.
船,ふね,ship,彼は船で旅行した。,He traveled by boat.
男性,だんせい,"man, male, masculine",入会を男性に限る。,Admission is limited to men only.
価値,かち,"value, worth, merit",この本を読む価値があると思いますか。,Do you think this book is worth reading?
思い,おもい,thought,私はそんな場所で彼女に会うとは思いもしなかった。,I never thought I would meet her in such a place.
表現,ひょうげん,expression,自分の気持ちを表現できない。,I cannot express my feelings.
量,りょう,"quantity, amount",質より量の方がむしろ重要である。,Quantity is rather more important than quality.
テレビ,てれび,"tv, television",テレビを見たくないです。,I don't want to watch television.
確認,かくにん,confirmation,当局に情報の確認を求める。,Ask the authorities to verify the information.
妻,つま,wife,彼女は私の妻の一友人だ。,She is a friend of my wife's.
以前,いぜん,"before, ago, since, previous",彼は以前この町に住んでいた。,He lived in this town before.
銀行,ぎんこう,bank,銀行の営業時間は午前9時から午後3時までです。,Banking hours are from 9 a.m. to 3 p.m.
文字,もじ,character,この絵は文字がないころに描かれた。,This picture was drawn when there were no letters.
木,き,tree,そこにはいろいろな木が生えていた。,All kinds of trees grew there. 
奥,おく,"interior, inner part, inside, back",奥へ行ってカウンターのところで聞いてください。,Go in and ask someone behind the counter.
現実,げんじつ,reality,現実を現実として認めなければならない。,We must accept reality as it is.
判断,はんだん,judgment,答えが正しいのかどうか判断がつかない。,I can't judge whether the answer is right.
都市,とし,city,神戸は人口が100万を越える大都市だ。,Kobe is a big city with a population of more than one million.
近く,ちかく,near,彼の家は駅のすぐ近くだ。,His house is quite near the station.
川,かわ,river,私たちは川へ魚釣りに行った。,We went fishing in the river. 
面,めん,"surface, face, side, aspect",どんな悪いことにも良い面がある。,There is a good side to every bad thing.
駄目,だめ,no good,浸水で商品は全部駄目になった。,The flooding ruined all the merchandise.
システム,しすてむ,system,そのシステムは現在とてもうまく動いている。,That system is currently working very well.
時期,じき,"time, period",スキーの時期は過ぎた。,Ski season has passed.
機関,きかん,"institution, system, engine",その機関は１９６０年代後半に設立された。,That institution was established in the late 1960s.
表,ひょう,"table, chart, list, surface, outside, exterior",会員の名前がこの表に載っている。,The names of the members are listed in this table.
光,ひかり,light,その物体は鈍い光を放っていた。,The object was emitting a dull light.
条件,じょうけん,"conditions, terms",彼はそれを条件付きで承認した。,He approved of it on certain conditions.
役,やく,"role, position",私は献立を決める役を引き受けた。,I took on the role of deciding the menu.
率,りつ,"rate, ratio, proportion, percentage",大学に進学する高校生の率は高い。,A high percentage of high school students go to college.
首,くび,neck,彼女は首にスカーフを巻いている。,She wears a scarf around her neck.
作品,さくひん,"work, production",何てすばらしい作品を作ったんでしょう。,What a fine piece of work you've produced.
際,さい,occasion,今後旅行の際はぜひ当社をご検討ください。,Please consider us for your future trips.
友達,ともだち,friends,あなたと友達になりたがっている。,He wants to be friends with you.
市場,しじょう,market,この新しい型は市場で手に入りますか。,Is this new mold available on the market?
幾,いく,"number of, some, how many",彼らは幾年間も、その土地の所有権について論争した。,For years they disputed the ownership of the land.
積り,つもり,"intention, plan",バスで東京に行くつもりですか。,Are you planning to go to Tokyo by bus?
以下,いか,less than,ぼくの成績は平均点以下だった。,My results were below average.
決定,けってい,"decision, determination",決定次第お知らせします。,We'll inform you as soon as the decision is made.
夢,ゆめ,dream,私は楽しい夢を見た。,I had a pleasant dream.
酒,さけ,wine,酒が飲みたい。,I want to drink alcohol.
章,しょう,"chapter, section",この問題は第3章で扱います。,This issue is addressed in Chapter 3.
天皇,てんのう,emperor,天皇は国家の象徴である。,The Emperor is the symbol of the nation.
心配,しんぱい,"worries, concern, anxiety",彼女の最大の心配事は子供の教育だ。,Her biggest concern is the education of her children.
国際,こくさい,international,国際感覚を身につける。,Develop an international mindset.
対応,たいおう,"correspondence, interaction, response, compatibility",我々の訴えに対する政府の対応。,The government's response to our appeal.
土地,とち,land,この土地の広さはどのぐらいですか。,What is the size of this lot?
原因,げんいん,"cause, origin, source",彼の病気は粗末な食事が原因だった。,His illness was caused by a poor diet.
注意,ちゅうい,"attention, caution",そのおもちゃは彼の注意を引いた。,The toy caught his attention.
毎日,まいにち,daily,彼は毎日のように電話をしてきた。,He called me every day.
警察,けいさつ,police,帰らないと警察を呼ぶぞ。,Go home or I'll call the police.
人生,じんせい,life,彼は人生経験が豊富である。,He has a lot of life experience.
逆,ぎゃく,"reverse, opposite", 君の意見と私の意見はまったく逆だ。, Your opinion and mine are completely opposite.
死,し,death,死が迫っている。,Death is imminent.
患者,かんじゃ,patient,医者は患者に禁煙するように勧めた。,Doctors encouraged patients to quit smoking.
裁判,さいばん,"trial, judgement",その事件は裁判沙汰にならずに解決した。,The case was resolved without court action.
自ら,みずから,"himself, oneself",それは彼が自ら選んだ職業である。,It is a profession he has chosen for himself.
期間,きかん,"period, term, interval",そこでの私たちの滞在期間は1週間です。,Our stay there is for one week.
今度,こんど,"next time, soon,, now, recently",今度からもっと気をつけます。,I will be more careful next time.
紹介,しょうかい,referral,日本への新製品の紹介。,Introduction of new products to Japan.
額,ひたい,amount,損失額は全部で400万円以上に達している。,The total loss amounted to more than 4 million yen.
絶対,ぜったい,absolute,彼は絶対安静が必要だ。,He needs absolute rest.
意見,いけん,opinion,新しい学校図書館の建設に彼は賛成意見を述べた。,He spoke in favor of building a new school library.
能力,のうりょく,"ability, faculty",彼は言葉を簡単に学ぶ能力をもっている。,He has the ability to learn languages easily.
家庭,かてい,"home, family, household",どうか幸せなご家庭を築いてください。,Please build a happy family.
一体,いったい,"unity, one form, one style, what the heck",一体どこで彼に会ったんだ。,Where on earth did you meet him?
指導,しどう,"guidance, coaching",ご指導のほどよろしくお願い申し上げます,Thank you for your guidance.
自動,じどう,"automatic, self-motion",ほとんどのエレベーターは自動で動く。,Most elevators operate automatically.
委員,いいん,committee member,計画委員を組織した。,Planning committee members were organized.
連絡,れんらく,contact,彼となかなか連絡がつかない。,I can't get in touch with him easily.
始め,はじめ,start,ものには全て始めというのがあるはずだ。,There must be a beginning for everything.
主人,しゅじん,master,犬は不安そうに主人をながめた。,The dog looked anxiously at his master.
構造,こうぞう,"structure, framework, construction",脳の構造は複雑だ。,The structure of the brain is complex.
政策,せいさく,"policy, political measures",その政策には多くの不満がある。,There are many complaints about its policies.
サービス,さーびす,services,サービスが悪かったのでクレームをつけた。,I complained because of the poor service.
母親,ははおや,mother,彼女の母親は素晴らしいピアニストだ。,Her mother is a great pianist.
フランス,ふらんす,france,フランスには行ったことある。,I have been to France.
治療,ちりょう,"medical treatment, cure",どんな治療も効果がなかった。,No treatment of any kind worked.
様子,ようす,"condition, state of affairs, appearance, sign",その家には人の住んでいる様子はない。,There is no sign of human habitation in that house.
限り,かぎり,"limit, bounds, degree, extent, as long as",学問の世界に限りはない。,There is no limit to the world of learning
料理,りょうり,cooking,若い女性はフランス料理が好きだ。,Young women like French food.
無理,むり,"impossible, unreasonable",無理を承知で仕事を頼んだ。,I asked him to do a job he knew was impossible.
胸,むね,chest,彼女は赤ん坊を胸に抱きしめた。,She held her baby against her breast.
反対,はんたい,opposition,彼は我々の考えに反対の意を表した。,He expressed his opposition to our idea.
参加,さんか,participation,そのチームの参加が取り消された。,The participation of that team was cancelled.
報告,ほうこく,"report, information",彼は道路の状況について何も報告を受けていなかった。,He had not received any reports on the condition of the road.
薬,くすり,medicine,この薬は風邪に効きますか。,Is this medicine effective for colds?
事務,じむ,office work,彼は事務効率をよくする案を出した。,He came up with a plan to improve office efficiency.
回答,かいとう,"reply, answer",金曜日までに回答が必要です。,Responses must be received by Friday.
不安,ふあん,"anxiety, uneasiness, insecurity",彼は不安な気持ちだった。,He was anxious.
ドイツ,どいつ,germany,先生はドイツに行ったことがありますか。,Has your teacher ever been to Germany?
相談,そうだん,"consultation, discussion",お値段のほうはご相談に応じますよ。,We will be happy to discuss the price with you.
一部,いちぶ,"partial, one part, one portion",その話の一部は本当です。,Part of that story is true.
取り引き,とりひき,"dealings, transactions, business",その会社との取り引きは中止になった。,The deal with that company was canceled.
外国,がいこく,foreign country,そろそろ転勤で外国へ出る時期だ。,It's time for me to leave the country for a new job.
設定,せってい,"setup, option setting, establishment, creation",設定料金に労務費用は含みません。,Set-up fees do not include labor costs.
耳,みみ,ear,彼女は耳にリングをつけている。,She wears rings in her ears.
駅,えき,station,その大学は駅から遠い。,That university is far from the station.
七百,ななひゃく,seven hundred,その七十万ドルで七百頭の牛までくれたのです。,They even gave us seven hundred cows for that seven hundred thousand dollars.
専門,せんもん,specialty,専門が違う人と話しをするのは面白い。,It is interesting to talk to people with different specialties.
出品,しゅっぴん,"exhibit, display",また各出品展示会情報も掲載しています。,Information on each exhibition is also available.
病気,びょうき,"sickness, illness, disease",お姉さんのご病気はいかがですか。,How is your sister's illness?
契約,けいやく,"contract, agreement",彼は契約内容に同意した。,He agreed to the terms of the contract.
開発,かいはつ,"development, exploitation",土地の開発がしばしば自然破壊につながる。,Development of land often leads to the destruction of nature.
規定,きてい,"regulation, stipulation, prescription, provision, rule",医者は彼女に厳しい規定食を勧めた。,The doctor recommended a strict regimented diet for her.
支配,しはい,"control, dominate, rule, guide",誰がこの国を支配していたか。,Who ruled this country?
歌,うた,song,彼は歌を歌って子供たちを楽しませた。,He entertained the children by singing songs.
発生,はっせい,"occurrence, outbreak, spring forth, incidence, generation",地震は時を選ばず発生する。,Earthquakes occur at any time.
映画,えいが,"film, movie",映画は良かったですか。,Was the movie good?
六百,ろっぴゃく,six hundred,既に六百日余りしか残っていません。,There are already only a little over six hundred days left.
四百,よんひゃく,four hundred,おおよそ四百人の人々が彼と共にあった。,Roughly four hundred people were with him.
無し,なし,"none, unacceptable, not alright, unsatisfactory, without",こんなものなしでも十分やれるよ。,You can do just fine without all this stuff.
食事,しょくじ,"meals, to eat",一緒に食事でもいかがですか。,Would you like to have dinner with us?
選択,せんたく,"choice, selection, option",この問題において選択の自由はない。,There is no freedom of choice in this matter.
障害,しょうがい,"obstacle, hindrance, disability, disorder",彼はあらゆる障害にも関わらず成功した。,He succeeded despite all obstacles.
結局,けっきょく,after all. eventually,彼女は結局彼と結婚することになった。,She eventually ended up marrying him.
代表,だいひょう,"representation, representative, represents",彼はクラスを代表して会場に出た。,He represented his class in the hall.
少年,しょうねん,"boy, juvenile, young lad",すべての少年たちは逃げた。,All the boys ran away.
友人,ゆうじん,friend,私たちは昔からの友人です。,We are friends from way back.
具体的,ぐたいてき,"concrete, tangible, definite, specific",具体的な情報が欲しい,I need specific information.
局,きょく,"bureau, department",東京特許許可局はどこですか。,Where is the Tokyo Patent Office?
右,みぎ,right,右の道を行け。,Take the right road.
成長,せいちょう,growth,子供は成長が早い。,Children grow up fast.
人物,じんぶつ,"person, character, figure",彼は非常に重要な人物だ。,He is a very important person.
身体,しんたい,"body, physical system","身体は精神と共に発達しなければならない。
",The body must develop along with the spirit.
息子,むすこ,son,私の息子はプロゴルファーになりたいと思っている。,My son wants to be a professional golfer.
位置,いち,"position, place, situation, location",私はパレードが見えるいい位置にいた。,I was in a good position to see the parade.
ホテル,ほてる,hotel,このホテルにはジムとプールがあるんだ。,This hotel has a gym and a pool.
立場,たちば,"position, situation, standpoint",私は今難しい立場にいます。,I am now in a difficult position.
主,ぬし,"head, lord, proprietor, proprietress, master",君は君自身の運命の主でもあります。,You are also the master of your own destiny.
互い,たがい,"each other, mutual, reciprocal",その二人の女性が互いをよく知っているのは明白だった。,It was obvious that the two women knew each other well.
勉強,べんきょう,study,彼には勉強する部屋がない。,He has no room to study.
音楽,おんがく,music,私は音楽がとても好きだ。,I like music very much.
大阪,おおさか,osaka,すぐに大阪に行ってもらいたい。,We need you to go to Osaka immediately.
王,おう,"king, ruler",彼らは王の敵に回った。,They turned against the king.
表示,ひょうじ,"display, indication, expression, 	representation",箱の内容はラベルに表示されている。,The contents of the box are indicated on the label.
利益,りえき,"profit, gains, benefit, advantages, interest",彼はその本から大きな利益を得た。,He profited greatly from the book.
科学,かがく,science,彼女は科学が最も苦手だ。,She is the worst at science.
期待,きたい,"expectations, anticipation, hope",あまり多くを期待するな。,Don't expect too much.
作業,さぎょう,"work, operation, manufacturing",工場は作業を停止中だ。,The plant is shutting down operations.
兄,あに,brother,彼女には兄が五人いる。,She has five older brothers.
宗教,しゅうきょう,religion,どんな宗教をあなたは信じていますか。,What religion do you believe in?
常,つね,"always, usual state of things",私は家に帰る途中でその本屋に立ち寄るのが常であった。,I used to stop by that bookstore on my way home.
落札,らくさつ,"successful bid, winning a tender",架橋工事はわが社が落札した。,Our company won the bid for the bridge construction.
石,いし,stone,石の多い土地ですね。,"It's a very rocky soil, isn't it?"
中央,ちゅうおう,"central, center, middle, metropolis",私たちはその部屋の中央に座った。,We sat in the center of the room.
主張,しゅちょう,"claim, request, assertion, contention, insistence",彼女はそこに行くと主張した。,She insisted on going there.
項,こう,"term, clause, item, paragraph, argument",これについては下記日本の項参照のこと。,See the Japan section below for more information on this.
段階,だんかい,"phase, grade, steps. level, stage, order",ガンは第一段階で発見すれば容易に治療できる。,Cancer is easily treatable if detected in the first stage.
犬,いぬ,dog,私の犬を捜してるんです。,I'm looking for my dog.
保護,ほご,"care, protection, shelter, safeguard",親は子供たちを保護する。,Parents protect their children.
イギリス,いぎりす,"united kingdom, great britain, engalnd",イギリスに行ったことはありますか。,Have you ever been to the United Kingdom?
学生,がくせい,student,学生たちが戻って来ました。,The students returned.
種類,しゅるい,"variety, kind, type, category",どんな種類のスポーツが好きですか。,What types of sports do you like?
台,だい,"stand, rack, table, counter for machines",パソコン３台持ってるよ。,I have three computers.
消費,しょうひ,"consumption, expenditure",日本の米の消費は減少している。,Rice consumption in Japan is declining.
周り,まわり,"around, circumference, vicinity, surroundings",子供たちは周りに集まってきた。,Children gathered around.
データ,でーた,data,コンピューターにデータをいれる。,Put data into the computer.
所為,せい,"due to, result, consequence, outcome, blame",彼女は自分の失敗を病気のせいにした。,She blamed her illness for her failure.
比較,ひかく,comparison,この二つは比較にならない。,There is no comparison between the two.
高校,こうこう,high hchool,高校時代にジャズを演奏し始めた。,He began playing jazz in high school.
危険,きけん,danger,彼女の命は危険な状態にある。,Her life is in danger.
知識,ちしき,knowledge,彼は経済学の知識が十分ある。,He has a good knowledge of economics.
資本,しほん,"capital, funds",彼は2000万円の資本で本屋を始めた。,He started the bookstore with a capital of 20 million yen.
生徒,せいと,"pupil, student",生徒たちは言葉と文化についてはなします。,Students talk about language and culture.
価格,かかく,price,もっと安い価格になりませんか。,Can the price be lower?
税,ぜい,taxes,政府はワインに新たに税を貸した。,The government has lent a new tax on wine.
現代,げんだい,"modern, present-day",現代の重要な課題。,An important issue of our time.
億,おく,billion,人体は何十億という小さな細胞から構成されている。,The human body is composed of billions of tiny cells.
発展,はってん,"development, growth, advancement, expansion",経済の発展はゆっくりと進んだ。,Economic development proceeded slowly.
構成,こうせい,"composition, organization, configuration",水は水素と酸素から構成されている。,Water is composed of hydrogen and oxygen.
城,しろ,castle,私の町には大きな城があった。,There was a big castle in my town.
方向,ほうこう,"direction, orientation, bearing, course",彼はどっちの方向へ行きましたか。,Which direction did he go?
産業,さんぎょう,industry,科学技術関連産業を強化する。,Strengthen science and technology-related industries.
処理,しょり,"processing, dealing with, treatment",ある物質を酸で処理する。,A substance is treated with an acid.
