Excerpts,Translation
"2021年の大みそかにオープンするや、瞬く間に人気店となった「すば」は、京都では数少ない、立ち食い蕎麦（そば）の店です。昼時を過ぎても客足が途切れることなく、カウンターで蕎麦をすする人々は老若男女、観光客から地元客まで、実にさまざま。ひと足早い年越し蕎麦をいただきに、活気でにぎわう店を訪ねました。
 <br><br>暮らすように、小さな旅にでかけるように、自然体の京都を楽しむ。連載「京都ゆるり休日さんぽ」はそんな気持ちで、京都の素敵なスポットをご案内しています。
 <br><br> 素っ気ないほど何もない空間に、ひときわ目を引く玉虫色のカウンターが2台。注文を済ませた客は番号札を持ち、思い思いの場所に立ちます。出汁（だし）の香りが店じゅうに漂い、ズズズッと威勢の良い音があちこちから聞こえるのも、昔ながらの立ち食い蕎麦屋そのもの。食べ終わったらすぐに席を外す、わずか10分ほどの食事時間ながら、どんぶりを返す人の顔はみな満足げです。  <br><br>それもそのはず。「すば」の蕎麦は、全国からその時期一番良い蕎麦粉を厳選し、毎朝店の2階で製麺する自家製麺。利尻昆布と本ガツオ、サバ、ウルメイワシなど上質な素材で引いた関西風の出汁に、生産者から直接仕入れる野菜と、立ち食い蕎麦とは思えない本格派の味が人気の理由です。<br><br> 冬の楽しみは、根まで食べられる「三関（みつせき）せり」をたっぷりのせた蕎麦。寒さの厳しい秋田県湯沢市周辺ではセリが葉茎より根が長く成長し、白く柔らかいことから、根まで食べられるセリとして市場に出されるのだそう。食べる前からセリの香りが立ちのぼり、シャキシャキとした食感が細めの蕎麦と調和する上品な味わいです。  <br><br>他にも、お品書きには「国産牛ホルモンと黄ニラ」「飛驒ジャンボなめこ」「たらばカニカマ天」とパンチの効いた名前の蕎麦がずらり。一見斬新にも見えるメニューについて、オーナーの鈴木弘二さんはこう話してくれました。
 <br><br>「創作蕎麦のように思えるかもしれませんが、メニューは地方の地野菜や名物料理からヒントを得たものがほとんどなんです。なじみのあるものを再解釈して、こんなにおいしいと知ってもらえたら」
<br><br>東京では、駅前や駅ナカにたいていある立ち食い蕎麦屋。出張に行くたびに、そのファストフード感と大衆食堂らしさに居心地の良さを感じていた、と鈴木さんは言います。京都ではなじみの薄い立ち食い蕎麦だからこそ、味に妥協せず、立場や食文化の垣根なく楽しんでもらえるスタイルを構築しました。
 <br><br>「気軽でクイックで、観光客や外国人、菜食中心の食生活の人でも食べてもらえる。うれしかったのは、車いすのお客様が『（少しの間なら立てるから）立って食べたい』と楽しんでくれたこと。立ち食いという体験をおもしろがってくれる方も多いです」（鈴木さん）  <br><br>「時間がないから」「安いから」という理由で選ぶのではなく、「おいしくておもしろい」から、立ち食い蕎麦を選ぶ。「すば」のシンボルとなった巨大なカウンターもそんなエンターテインメントの一環です。黒地に玉虫色の色彩が混じる箱形のカウンターは、滋賀県の陶芸家・橋本知成氏による作品。陶製で、大きすぎるゆえ重さで天板がたわみ、どんぶりを置くと傾いてしまうのですが、それも味の一つ。  <br><br>「昔、自分の店を持った弟子に、すし屋の大将がヒノキのカウンターを贈って『店つぶれたらこれを売ったらええ』と激励する、みたいな話を聞いたことがあって、このカウンターはそういう存在なんです」と鈴木さんは笑います。
 <br><br> 奇抜でユニークにも見える「すば」ですが、蕎麦も、内装も、営業スタイルも、実は「昔ながらの文化」がソースになっています。地方の味や市井の文化が再解釈され、新しい風が吹いて、現在進行形の文化になっていく。新鮮なのにちょっとなつかしい、進化した立ち食い蕎麦はもう、京都に欠かせぬ存在です。","Suba"" opened on New Year's Eve in 2021 and quickly became a popular restaurant, one of the few standing noodle stores in Kyoto. Even after lunchtime, the number of customers never stops, and the number of people sipping soba at the counter varies widely from tourists to locals, young and old, men and women. We visited this bustling restaurant to enjoy an early New Year's Eve soba.

Enjoy Kyoto in its natural state, as if you were living in Kyoto or going on a small trip. The series ""Kyoto Yururi Holiday Sanpo"" is a guide to Kyoto's wonderful spots with this in mind.

Two iridescent counters stand out in a plain, empty space. After placing their orders, customers take their number cards and stand where they want to be. The aroma of dashi (soup stock) wafts throughout the restaurant, and the lively sound of ""zu-zu-zu"" can be heard here and there, just like an old-fashioned stand-up buckwheat noodle restaurant. After finishing their meal, customers leave their seats immediately, and although the eating time is only about 10 minutes, the faces of those who return their bowls of food are all satisfied with their meal.

That's no wonder. The soba noodles at ""Suba"" are made in house every morning on the second floor of the restaurant from carefully selected buckwheat flour selected from all over Japan at the time of the season. The Kansai-style soup stock is made from high-quality ingredients such as Rishiri kelp, Hongatsuo (dried bonito), mackerel, and Japanese sardines, and vegetables are purchased directly from the farmers.

One of the winter delights is soba noodles topped with plenty of ""mitsuseki seri,"" a type of buckwheat noodles that can be eaten down to the root. In the area around Yuzawa City in Akita Prefecture, where the weather is severely cold, the roots of the celeri grow longer than the leaf stalks and are white and tender, so they are marketed as celeri that can be eaten down to the roots. The aroma of the parsley rises in the air even before you eat it, and its crunchy texture harmonizes with the thin soba noodles to create an elegant taste.

Other items on the menu include soba noodles with punchy names such as ""Japanese beef hormone and yellow chives,"" ""Tobiton jumbo nameko mushrooms,"" and ""Taraba kanikamaten. The owner, Mr. Koji Suzuki, explains the seemingly novel menu as follows: ""At first glance, it seems like a creative soba dish.

It may seem like creative soba, but most of our menu items are inspired by local vegetables and specialties of the region. I hope that by reinterpreting familiar dishes, people will discover how delicious they are.

In Tokyo, you can usually find standing buckwheat noodle restaurants in front of or inside train stations. Whenever he went on business trips, Mr. Suzuki says he felt comfortable with the fast-food atmosphere and the mass diner-like atmosphere of these restaurants. Because standing-only noodle restaurants are unfamiliar in Kyoto, we have created a style that allows customers to enjoy the food without compromising on taste and without any boundaries of position or food culture.

It's casual, quick, and accessible to tourists, foreigners, and people with vegetarian diets,"" Suzuki said. What made me happy was when a customer in a wheelchair said, 'I want to eat standing up (because I can stand for a while). Many people enjoy the experience of eating standing up,"" says Suzuki.

Customers do not choose standing-eating buckwheat noodles because they do not have time or because it is cheap, but because it is tasty and interesting. The huge counter that has become the symbol of ""Suba"" is part of such entertainment. The box-shaped counter, which is black with iridescent colors mixed in, is the work of Shiga Prefecture ceramic artist Tomonari Hashimoto. The counter is made of ceramic, and because it is so large, the top is bent under the weight, causing it to tilt when a bowl of rice is placed on it, but that is part of the charm of the counter.

I once heard a story about a sushi restaurant owner who gave a cypress counter to his apprentice who was going to open his own restaurant and encouraged him to sell it if the restaurant went under.

Although ""Suba"" may seem eccentric and unique, the soba noodles, the interior, and the business style are in fact based on ""traditional culture. Local flavors and city culture are reinterpreted, a new wind blows, and they become an ongoing culture. Fresh yet nostalgic, the evolved standing-only soba is now an indispensable part of Kyoto."
