W1,T1,W2,T2,W3,T3
表情も見えないし,I can't even see his expression.,声だけって,Just a voice.,普通の恋愛ではない,This is no ordinary love affair.
めちゃめちゃ不思議っすね,It's so strange!,現実なのか,Is it real?,分からんくなってきた,I don't know. I don't know anymore.
僕の目が見えなくなっても,Even though I'm blind.,あなたに恋をする,I fall in love with you,めっちゃ不思議じゃない?,Isn't it so strange?
めっちゃ好きみたいな,"Like, I love you so much.",目から入ってくる,It's coming through my eyes.,情報で判断しがち,We tend to judge based on information.
所でつながれる,I can connect with you there.,出会えたら,If we meet,掛け替えのない関係かも,Maybe the relationship is irreplaceable.
やっぱり今まで,I knew it. I knew it. I knew it.,外見なしに恋愛してきた,I've fallen in love without appearances,でもこう長期的に見たら,But in the long run.
一番大事なものではやっぱりない,It's still not the most important thing.,運命の人が見つけたいです,I want to find my destiny.,めっちゃキレイ,So beautiful.
恋愛に影響してきた,It's affected my love life.,身体的な不安,Physical insecurity,この実験では体型は抜きで,"In this experiment, we're not going to look at body shape."
これまでの恋愛は散々だった,My love life so far has been a mess.,運命の人を探しに来た,I'm here to find my destiny.,見た目でなく,Not by the way you look.
見つけたい,I want to find it.,まずは内面を知りたい,I want to know what's going on inside first.,観光業セールス,Tourism Sales
タイプがこうとかって言うより,It's not about the type.,ホントに内面的にこう相手のこと,Really internal about the person you are talking to,めっちゃ好きになれたら,If you like it so much...
その居酒屋には,In that tavern,一本入った路地にある,It's in an alley down the street.,商店街から,From the shopping district
勇気を持ってくぐった者,Who have had the courage to pass through.,気づくだろう,You'll notice.,うまい酒とおいしい料理,Good sake and good food
ここにいることを,That you're here.,コートお預かりしますね,I'll take your coat.,どこの家庭でも,In every home
金取ってる,I'm getting paid.,ありきたりの料理でもな,Even if it's just a plain old cookout.,一つ丁寧に心込めて作んだ,I put my heart and soul into each and every one of them.
思わず笑みを浮かべるような一皿,A dish that will make you smile,それができて初めて,Only then can you do it.,払った金惜しくねえって,I'm not going to miss what I paid for.
何の料理作んの？,What are you cooking?,ニンジンの葉っぱ食べさせて,Let them eat the carrot leaves.,翌日から楽しめますよ,You'll enjoy it the next day.
出来上がり,Ready to serve.,蓋をすれば,If you put a lid on it,潰さないようにそっと置きます,Place it gently so as not to crush it
調味料を入れたみそ床に,In a bed of miso with seasonings.,卵黄のみそ漬け,Egg yolk in miso,楽しめるお酒です,It's a sake to be enjoyed.
肴と合わせると,When combined with snacks,相互のうまみが溶け合って,Mutual flavor melds with each other,膨よかなうまみが楽しめるお酒,Sake with a full-bodied umami taste.
そして今時珍しい義理人情がある,And there's a sense of righteousness that's rare these days.,お待ちどおさま,"Here you are, my dear.",そこまでじゃない,Not that far.
じゃあこれ頼む,"Okay, I'll take that, then.",あっとごめんなさい間違えた,"Oh, I'm sorry, I made a mistake.",みそ漬けじゃないってば,I told you I'm not pickled in miso.
親方さんたちも大変ねえ,"It's hard work, isn't it?",塩気がないとつまらなくなる,It would be boring without saltiness.,ききすぎてても,I don't care if it's overdone.
でも今はちゃんと働いてる,But I'm working now.,冷静になって考えたらしいんだな,He's cool with it. He's thought about it.,でもどういう風の吹き回し？,But what kind of windfall?
あの逃げ出しちゃった人,The one who ran away.,弟子が朝一番で現場に来たんだよ,My apprentice came on the scene first thing in the morning.,現場がうまく片づいたんでな,The scene was cleared up nicely.
たまには違う辛さもいいでしょ,It's nice to have a different kind of spice now and then.,じゃあ頂いてこうかな,I guess I'll just take it then.,昨日の大根どうだった？,How were the daikon radishes last night?
春の先駆けの菜めし,The first greens rice of spring,外はまだ寒いけど,It's still cold outside.,春はすぐそこまでって感じよね,It's like spring is just around the corner.
鮮やかだね,It's so bright.,大根には葉っぱが付き物ですから,"Daikon radishes come with leaves, you know.",今日はもう締めにしましょ,Let's call it a day.
思い出があるとか？,You have a memory?,お姉ちゃんとってもキレイ,"You look so beautiful, sis.",自転車置いてきちゃった,I left my bike here.
何時に寝たの？,What time did you go to bed?,いい天気だよね,"It's a beautiful day, isn't it?",腕を回します,I'll put my arm around you.
何か華道家って名乗ってるけど,You call yourself some kind of flower arranger.,新しい流派なの ,It's a new school. ,すごい勢いでお弟子さん集めてる,He's recruiting his disciples at an incredible rate.
私には関係ない,It has nothing to do with me.,うちも相当削られてるって,"I hear we've been cut down a lot, too.",出戻ったからって期待しないで,Don't get your hopes up just because I'm back.
別に何ともなってない,I'm not in any trouble.,もちろん回復すれば,"Once you recover, of course.",それは本当の恋じゃないと気付く,I realize it's not real love.
私が慰めますよ,Let me comfort you.,私たち付き合うことになったの,We're going out.,どんな夢も現実になるよ,Any dream can come true.
適当に座ってください,Please sit down at your leisure.,そんなことするはずがないよ,You're not gonna do that.,本気で言ってる？,Are you serious?
気になるなって思ったし,I thought you'd be interested.,出てくるような料理で,With the kind of food that comes out,元気が湧いてきそうだ,It's gonna cheer me up.
会いたいしさ,I want to see you.,料理食べた人,People who ate the food.,明日に響くから,It's gonna be a problem tomorrow.
顔を見てないのにさ,I haven't even seen his face.,客が思ってくれるようになんだ,I want my customers to think,顔向けすぎじゃない？,I think you're showing your face too much.
そうじゃなくて,"No, I don't mean that.",お好みの漬かりは具合をお楽しみ,Enjoy your favorite pickling condition.,それだけじゃなくて,That's not all.
音楽やってます,I play music.,そこに取り分けた卵黄を置きます,Place the separated egg yolk on it.,廃業に追い込まれたところもある,Some places are going out of business.
やっぱりその外見っていうのは,I think that appearance is the most important thing.,しっかりとしたうまみのある,with a firm umami flavor.,くだらない,Nonsense.
見た目で何か,Something about the way you look.,こよいのお酒は,Sake of Koyoi is,そしてそれらを破壊します,And destroy them
私自身が判断される,I will be judged on who I am.,今日のおすすめは,Today's recommendation is,やがて娘は感謝して,"Eventually, my daughter will thank me."
内面を愛してくれる人,Someone who loves me on the inside.,みそ漬けになることを祈って,Praying to be pickled in miso,愛してたら憎まない,"If I loved you, I wouldn't hate you."
すぐにでも結婚したい,I want to get married right away.,塩っぱくて食べられなくなる,It's too salty to eat.,別に何ともなってない,I'm not in any trouble.
それこそもう運命の出会いですよ,That's exactly what it's meant to be.,謝りに行ったんだよ,I went to apologize.,外はまだ寒いけど,It's still cold outside.
暖簾が掛けられている,The curtain is hung,今日は来られなかったはずじゃ？,I thought you couldn't make it today.,そうじゃなくて,"No, I don't mean that."
そして優しい人たち,And kind people,冬の名残のおでんと,"With oden, the last remnants of winter",私たち付き合うことになったの,We're going out.
では行ってみましょうか,"Well, let's go.",ちょっと聞いてみます価格と,"I'll ask around, see if I can get a better price.",日本橋にも来ることあるんですけどね,I sometimes come to Nihonbashi.
黒門市場入場します,Entering Kuromon Market,ここで食べれるか,Can we eat here?,特にうちは有名やで,Especially ours. We're famous.
週末来たらもっと人が多いんですけど,I'm sure there would be more people if I came on a weekend.,そこで食べられるんですか？,You can eat there?,先払っておいたらいいですか,Can I pay you in advance?
こんなに沢山入って500円？,500 yen for such a lot of food?,じゃあ食べます,Then I'll eat.,テレビ出てるで,You're on TV.
食べれるなら食べようと思います,"If I can eat it, I'll eat it.",好きなん取り？,You like it?,ハマっちゃうかもしれないですけどね,"You might get hooked, though."
そこ、みな美っていうお店,"There, a restaurant called Minami.",何が違いますか,What's the difference?,ハマっちゃいますね,I'm hooked.
有名らしいです,I hear it's famous.,めっちゃ優しい,You're so sweet.,手間かけて申し訳ないんですが,I'm sorry to take up so much of your time.
もう一本食べてもいいですか,Can I have another one?,包まれている感がしたいので,I want to feel wrapped up in it.,もう一個頼んでもいいですか,Can I ask for another one?
よく言われるんですけどね,I got told that a lot.,座ってやってみますか,Shall we sit down and try?,鬼怒川駅方面が見える感じですね,You can see the direction of Kinugawa Station.
ドヤ顔してるつもりないんですけど,"I don't mean to be smug, but...",肩甲骨は離れて広がっている,Shoulder blades spread apart.,はいもうちょっと探検していきます,"Yes, I'll explore some more."
もしかしたら思っているから,Maybe because I'm thinking it.,右を向く,Turn to the right.,お布団が入っております,It contains some futons
内心成功したぜ,I've succeeded on the inside.,後ろを向いて彼を見る,Look back at him. ,朝ごはんが到着しました,Breakfast has arrived.
送っていただけると嬉しいです,I would appreciate it if you could send it to me.,南を向いた部屋,A room facing south ,しばらくゆったりまったり過ごします,I relaxed and took it easy for a while.
お待ちしております,We'll be waiting for you.,そのホテルは海に向いている,The hotel faces the sea.,釜飯が出来上がりました,Kettle rice (Kama-meshi) is ready!
ボタンから送ることもできます,You can also send it via the button,その窓は庭に向いている,The window opens onto the garden.,盛り付けました,I served it up (dished up).
温泉にやってきました,We came to the hot springs.,女性に向いた仕事,A job suitable for a woman ,ほっこりしちゃう,"It makes me feel warm (warm and fluffy, soft)."
雪が残ってますね,There's still snow.,鏡に向かう,Look in a mirror.,ライトアップされているの,It's all lit up.
あらかじめカットしておく,Cut them in advance.,彼は大群衆に向かって演説を始めた,He faced the large crowd and began to make a speech.,では早速入ってみましょう,So let's get in there.
今度やってみようかな,Maybe I'll try it next time.,駅に向かってるとこだよ,I'm on my way to the station.,早速オープンしていきたいと思います,I would like to open it immediately
飽きたし,I'm tired of it.,彼は私に向かってくる,He comes to me.,おつまみ的なものを買ってきました,I bought some snack food.
焚き火して,Make a bonfire.,今向かってます,I'm heading over there now.,感想は？ いい体をしてました,What did you think? He had a good body.
夜更かししたり,And staying up late.,右を向いてください,Turn to the right.,性格はとても重要だと思ってます,I believe that character is very important.
絶妙に混ざりあって,Exquisitely mixed.,この服は寒い冬の日には向かない,These clothes are not appropriate for a cold winter day.,自分が持っている魅力だけで,Just the charm that you have.
食べ過ぎだろ,You eat too much.,公園の方に足を向けた,I walked toward the park.,島を探検してください,Explore the island.
そんなやり方あったんだ,I didn't know that was how it was done.,彼はその絵に目を向けた,He turned his attention to the picture.,遠い所に設置したみたいですね,Looks like they set it up far away from here.
いつもきな粉零しちゃうんだよ,I always spill soybean flour.,彼に背中を向ける,Turn one's back on him.,今日のおすすめ商品でした,This was today's recommended product.
絡めようとして,I'm just trying to mix it together.,銃を彼に向ける,Aim one's gun at him.,修学旅行はみなさんご存知ですか？,Have you ever heard of school trips?
火を起こしていきたいと思います,I'd like to make a fire.,こっちに顔を向けなさい,Turn your face this way,日光で何したかは全然覚えてないです,I don't remember what I did in Nikko at all.
オシャレ感が増しました,It's more stylish.,出てくるかな？,Do you think it'll come out?,是非教えていただければと思います,I'd love to know what you think.
映えを意識した設置となっております,The installation is designed to look good.,日本食食べたくなりますからね,It makes me want to eat Japanese food.,歴史の勉強してみたいな旅行でした,It was a trip that made me want to study history.
火がついてきました,It's catching fire.,お味噌汁飲みたい,I want to drink miso soup.,行く場所はいろいろなんですけど,There are many places I go.
薪を持ってきてくれました,He brought me some firewood.,お寿司食べたい,I want to eat sushi.,海を調査しなきゃいけないのね,We'll have to survey the ocean.
本気で照れる,It's really embarrassing.,恋しくなるんですよ,I miss it!,やっぱり海って怖いじゃないですか,"After all, the ocean is scary, isn't it?"
順調に炎は燃え上ってきています,The flame is burning steadily.,時代は変わってきてるんですかね,"Times are changing, aren't they?",その深海魚っていうのがすごい好き,I really like that deep-sea fish.
消えたなあ,It's gone.,探せばあるんでしょうけどね,I'm sure it's out there if you look for it.,海って危ないよね,The ocean is dangerous.
火吹き棒で再熱を試みる,Trying to reheat with a fire blowtorch,サーモンを出して頂いて,They served me salmon.,止まらずに進みたいと思います,I'd like to keep going without stopping.
対面授業を受けに行った,I went to take a face-to-face class.,マスクを着用し,Wear a mask.,ヒルが結構いるみたいなので,It seems like there are quite a few leeches.
一番奥の席を確保しました,I got a seat at the far end.,では早速館内を散策してみましょう,Let's take a walk around the building at once,ピッタリですよね？,"It's perfect, isn't it?"
そんなに苦手なら買わなきゃいいのに,"If you're that bad at it, you shouldn't buy it.",ではテラスに出てみます,I'll go out on the terrace.,簡単でヘルシーで美味しい鍋,"Easy, Healthy and Delicious Hot Pot"
一緒に行こう,Let's go together,こちらは水盤テラスです,This is the water table terrace.,改めて言われると恥ずかしい,I'm embarrassed to say it again.
彼は何度も繰り返して言った,He said it over and over,では早速座布団をしいて,"Now, let's put the cushions on.",そっちゃおうかな,Maybe I think I should take it off.
その手紙を３回も繰り返し読んだ,I read the letter three times,足湯を利用したいと思います,I'd like to use the footbath.,素直に思えたので,It seemed honest to me.
単語を繰り返して書く,Write the word repeatedly.,早速足湯に浸かってみます,I'm going to take a soak in the footbath right away.,案内係できる,I can lead the way.
透けちゃった,It's transparent.,疲れが癒されました,My fatigue was relieved.,沈んじゃうよ,It’s going to sink.
透けちゃうのか,It's transparent?,お部屋に到着しました,We've arrived at our room.,からめていきましょう,Let's mix it up.
奥に入っちゃいました,I'm in the back.,では早速開けてみたいと思います,"Now, I'd like to open it right away.",時刻は17時を回りました,The time is around 5:00 p.m.
こういう見方じゃないですか？,Isn't this how you see it?,窓からの眺めはこんな感じです,Here's the view from the window.,体感の変化がありましたら,If there are any physical changes.
届いてますかね？,Did you get my message?,またここ最近ですと,Also recently,台本じゃないんですよ,It's not a script.
宜しくお願い致します,please treat me well,この時間の担当は,The person in charge of this hour is,いかがお過ごしでしょうか？,How are you doing?
桜を眺めて,Viewing the cherry blossoms,帰宅している方も増えてくる,More and more people are returning home.,今日は広く穏やかな天気で,Today's weather is broad and mild.
皆さんいかがでしょうか ？,How is everyone doing?,以前から番組を知ってくださってね, You've known about our program for a long time.,英語がペラペラな方がいるんですけど,I know someone who speaks English very well.
