P1,T1,P2,T2,P3,T3
あん 残るといいけどね,I hope there's enough left.,ウフフッ スープ仕立てのほうがいいかしら？,Would you like it in soup?,白菜漬けは 漬ける前に,Before pickling Chinese cabbage.
宇都宮餃子会と共同開発した,Jointly developed with the Utsunomiya Gyoza Association,いやいや お湯でいいよ お湯がいい,"No, just hot water. I like hot water.",半日くらい陰干しすると,Dry it in the shade for about half a day.
すっきりとした喉越し きめ細かい泡,It has a clean throat and fine foam.,分かりました,I understand.,うまみや甘みが凝縮されます,It concentrates the flavor and sweetness.
テフロン加工されたフライパンを 熱します,Heat a nonstick frying pan.,決めた！ 水と焼き どっちも食べる,I've decided! I'll eat both water and grilled.,昆布やタカノツメを加えて漬けると,"If you add kombu or hawthorn to the pickles, it will make them taste better."
小麦粉水を作ります,Make the flour water.,フッ 食べられるといいけどね,I hope you can eat them.,一層うまくなります,It becomes even better!
泡が 少なくなってきたら,When the bubbles start to diminish.,はい どうぞ 熱いから気をつけて ,"Here you go. Be careful, it's hot.",おやすみなさい,Good night.
蓋を開けます,Open the lid.,しょうゆと お酢おくれよ あとラー油も,"Give me soy sauce, vinegar, and chili oil.",特技もないし,I don't have any special skills.
ゴマ油を流す時は,When pouring the sesame oil,あっ ごめんなさい タレね,"Oh, sorry, the sauce.",味付けには 何の不満もないけど,I have no complaints about the seasoning.
餃子に かからないように,Try not to get it on the dumplings.,いやいやいや バラで,"Oh no, I want them separately.",客が自分で采配できるってのも ,It's a little interesting that the customer can call the shots. 
この乾いたパチパチッという音が 鳴ったら,When you hear this dry crackling sound.,じゃ 結構 普通な 食べ方らしいんだけどね,So it's a pretty normal way to eat.,スープ代わりにも なるじゃないって,I thought it could be used as a soup.
もう一度 蓋を開けてみましょう,Open the lid again.,宇都宮… 餃子で有名な？,Utsunomiya... famous for its dumplings?,試してみたら なかなか おつな味でね,"I tried it, and it tasted pretty good."
お皿をかぶせて,Cover with a plate.,私も初めは驚いたけどさ,"I was surprised at first, too.",以来 水餃子 食べる時は ずーっと これ,"Since then, I've always eaten dumplings with this."
お姉ちゃん 最高,You're the best.,こうすりゃ タレも薄まらないし―," This way, the sauce won't dilute.",今でも録画消さずに取っといてありますもん,I'm still keeping the recording.
今日は、天ぷらの作り方をご紹介します,"Today, I will introduce how to make tempura.",では最後までお楽しみください,Please enjoy until the end.,などからの素敵な景色を眺めながら,While enjoying the beautiful view from the
とても簡単に作ることができます,You can make it very easy.,無事つきましたホテル三日月です,I've arrived safely at the Hotel Crescent.,のんびりまったりと過ごしておりました,I spent the day relaxing and taking it easy.
必要なのは小麦粉と卵,You need only flour and eggs.,では早速館内を散策してみましょう,Let's take a walk around the museum.,りっこ国立公園のお土産ですね,A souvenir from Rikko National Park.
ぜひお試しください,Please try.,インスタ映えスポットが所々に,Instagrammable spots are everywhere.,詰まってるうっそー サミットなんだこれ,"It's jammed. Oh, shit. It's the summit."
では、始めましょう！,Let's get started!,ではテラスに出てみます,I'll go out on the terrace.,中身はですねこんな感じでしたおいしそうだ,I'm sure you'll be pleased to know that I'm not the only one.
天つゆを作って食べます,Make tempura soup and eat.,はい外はねすごくラグジュアリーな感じ,"Yes, outside, it's very luxurious.",要氏はですねこちらに美味しい釜飯の炊き方,"The point is, here's how to cook a good pot of rice."
クッキーが欲しい,I want cookies.,そして自然豊かで本当にロケーションが最高,"And the location is really great, rich in nature.",作りたいと思います,I'd like to make one.
お野菜食べたらクッキーたべよう,"If you eat vegetables, let's eat cookies Ok?",こちらは水盤テラスで,This is the water table terrace.,明日良い香りがめっちゃ吸うわ火をつけます,"It's going to smell so good tomorrow, I'm going to light it."
ご飯食べたらクッキー食べよ,"If you eat rice, eat cookies.",温度は約40度,Temperature is about 40 degrees Celsius.,ちょっと付いたと言ったんいただきます,I said I got a little something for you.
さつまいもをスライスして水に浸します,Slice the sweet potatoes and soak them in water.,水盤テラスには手湯と足湯がありました,There were hand and footbaths on the water table terrace.,かわいい切り方とか,Like a pretty cut.
ほら、入れると白くなった,"You see, it turned white when I put it in.",では早速座布団をしいて,"Now, let's put the cushions on.",もう差しに言えば耐えています,"I've already endured it, to put it mildly."
水につけとくね,Soak it in water.,足湯を利用したい と思いまーす,I would like to use the footbath.,わさびをつけたいかと言うんですよ,He asks if I want to put wasabi on it.
そしてお茄子,and eggplant.,タオルもあるのでとても,"There are towels, so it's very",親指へオニオンソースがソックァンは,Onion sauce on the thumb.
おてて、使っていいよ,Use your hands.,便利でした,It was convenient.,彼に向いたことないんですよ,I've never been good enough for him.
次に大根おろしをつくります,Next we use Daikon radish.,早速足湯に浸かってみます,I'm going to take a soak in the footbath right away.,ほっこりしてる いただきまーす,I'm dusty. Let's eat.
なんていうの？,What do you say?,ロングスカートだとちょっと大変でしたね,It was a little difficult with the long skirt.,盛り付けました ,I served it up. 
おきになさらず,Don't mind me.,はい、すごくあったかかったです,"Yes, it was very warm.",ふわふわだねうわすごい夕日が尋常じゃ,I'm sure you'll be fine.
びっくりしました,I was so surprised.,じんわり とに温まることができました,It warmed me up nicely.,夜のプールは昼間とは違った雰囲気で,The pool at night has a different atmosphere than during the day.
これはエビですか？,Is this a shrimp? ,ここまでの旅の疲れが癒されました,It was a great relief from the exhausting journey so far.,素敵でしたライトアップされているの,"It was beautiful, all lit up."
できる？じゃ、全体お口に手を入れないよ,Are you sure? Don't put your hands in your mouth.,時間になりましたのでお部屋に入りたい,It's time to go to your room.,がすごくいい感じですよね,"is really nice, isn't it?"
約束できる？「はい」,"Can you promise? ""Yes"" Then",エレベーターを使って7階まで上がります,Take the elevator up to the seventh floor.,では早速入ってみましょう,So let's get in there.
じゃ、やってもらおう,Then let's do it.,はいお部屋に到着しました,"Yes, we've arrived at your room.",このね端っこのところまで行ってみました,I went to the end of the line.
こうやってか？,Are you doing this?,本日の部屋は759号室です,Today's room is room 759.,夜もところでございます,It is late at night
これ、むいていって？,Can you peel this off for me?,おしゃれな和テイストのお部屋ですね,It's a stylish Japanese style room.,しばらくゆったりまったり過ごします,I'll be relaxing for a while.
ぬがしてあげて？,Can you take it off?,結構のこのレトロなタイプの鍵私好きです,I like this retro type of key.,そしてお部屋に戻る前に大浴場,"And before going back to our room, we took a bath."
すごいね、なんでもやらしてみるもんやね,It's amazing. You can try anything.,では早速開けてみたいと思います,"Now, I'd like to open it right away.",視察しに行きたいと思います,I'd like to go and inspect it.
集中しております,I'm focused.,かなり開放感のある素敵なお部屋です,It's a nice room with quite an open feel.,なんだかすごいところに入れました,I've been in some amazing places.
パンツは脱がさないでね,Don't take off your pants,では ルームツアーをしていきたいと思います,"Now, I'd like to give you the room tour.",音があれば女に多くにあるんですねしかも,I'm sure you'll be able to find a lot of people who are interested in this.
いい感じ,Good feeling ,和洋室ですね おお、おお素敵,"It's a Japanese-Western room. Oh, how nice.",思いっきり三ッ葉間違えたという,I made a big mistake.
ちょっと待って みてて,Wait a minute. Watch this.,大きなベッドが2つもありますね,You have two large beds.,健康なまみたい一回一 の,I want to be healthy once and for all.
このように切ります,Cut it like this.,窓からの眺めはこんな感じです,Here's the view from the window.,では7階のお部屋に戻ります,"Now, back to your room on the seventh floor."
これが元の尻尾です,This is the original tail.,鬼怒川駅方面が見える感じですね,You can see the direction of Kinugawa Station.,ちょっとここでゆっくりしたいと思います,I think I'd like to relax here for a bit.
貝殻の水が原因で油が飛び散る,Oil splatters due to the water in the shell,テラスもありますねこう見るとね,"There's also a terrace, if you look at it this way.",ちょっと時間がたったら,After a little while.
ああ、アスパラガスを忘れてた！,"Oh, I forgot about asparagus!",鬼怒川温泉駅かなり近いですね,It's pretty close to Kinugawa Onsen Station.,大浴場に行ってこようか なと思っております,I'm thinking of going to the big bath.
アスパラガスをいれようか？,Shall we add asparagus?,ほんとにもうすぐそこです,We're really close.,ということで大浴場に向かいます,So I'm heading for the big bath.
とても日本的な香りがします,It has a very Japanese flavor.,なかなかでレトロな作りでかなりね,It's a pretty retro look.,あっという間に温泉から上がりました,We were out of the hot spring in no time.
何をしているの？,What are you doing?,趣があります,It has a certain charm.,ここで撮影してなかったのです,I wasn't shooting here.
カットした野菜の水を拭きます,Wipe the water from the cut vegetables.,冷蔵庫内にミネラルウォーターがあると,You can find mineral water in the refrigerator.,夜の音おつまみ的なものを買ってきました,I bought some sound snacks for the evening.
野菜とエビの準備ができました！,The vegetables and shrimp are ready!,いうことでちょっと早速,So I'll get right to it.,骨組みという感じてですねお米でできた,"It's like a skeleton, you know, made of rice."
サクサク揚げていこうと思います,I'm going to fried it crispy,はいもうちょっと探検していきます,"Yes, I'll explore some more.",控えめな表示にちょっと惹かれました,I was a little attracted to the discreet display.
なに今日？どうしちゃったの？,What happened today,これがねちょっと独特のたぬきでしょうか,"This is... a rather unique tanuki, isn't it?",意識して買ってみました,I bought it consciously.
テンプラのバッターを作ってください,Make a tempura batter, 爪楊枝入れですね, It's a toothpick holder.,食べていきたいとおもいます,I'd like to eat it.
「テンツユ」はテンプラを浸すスープです,Tentsuyu is a soup that soaks tempura.,そしてこっちは何だ？,And what's this?,はい朝ごはんが到着しました,"Yes, breakfast has arrived."
もちろん、おだしやみりんも使えます,"Of course, you can also use odashi and mirin.",隣はだいたい空って決まってるんですよ,It's always empty next to me.,双方もですねお部屋食にいたしましたでは,Both of us had room service.
だし粉小さじ半分,A half of tea spoon of dashi powder.,ここはこんな感じですね,Here's what it looks like.,早速オープンしていきたいと思います,I'd like to open it as soon as possible.
火にかけておきます,Place on the fire.,あそこ気になりますね,I'm curious about that place.,鮭の切り身をような2個の素管にでしょう,The salmon fillets would be in two bare tubes like
揚げ油を準備します,Prepare the oil.,そうだろうと思ったけど,I thought you might.,聞かとマグロですね,You're asking about tuna.
うん、帰ってくるよ,"Yeah, I'll be back.",メイクができます,I can do makeup.,オムレツにフルーツ サラダが入ってます,Omelet with fruit and salad.
先に食べちゃおう！,Let's eat first!,そして感染予防対策,And infection prevention measures.,ごはんを出できました,I'm ready to serve rice.
手を合わせてご一緒に！ いただきます！,"Put your hands together, please! Itadakimasu!",これはね持ち帰っていいそうです,You can take this home with you.,今日はちょっと外はねにしてみました ,I've decided to splash out a little today. 
お手てで食べてもいい,You can eat with your hands.,持ち帰って使わせていただきます,I'll take it home and use it.,入ってから帰りたいと思います,I'd like to come in and then go home.
おつゆに、ちょんちょんして,Dip it into the dipping sauce.,温泉をプールのように楽しむ,Enjoy the hot spring like a swimming pool,はい非常に楽しい旅でした,"Yes, it was a very enjoyable trip."
まちがいないやつ、おいしい！,"You're right, it's delicious!",ちょっとそのまま読んじゃったんだけど,I kind of read it straight through.,なってしまうのでもうちょっと急いで,It's been a very enjoyable trip.
大根とかがあれば、天つゆの中に入れて,"If you have daikon radish, add in the soup.",ああ、お布団ですね ここは,"Oh, a futon. Here.",から帰りたいと思います,I'd like to go home from
誰みたい？,Who are you like?,お布団が入っております,Your futon is in there.,もうの呼ぶとはまた違った雰囲気で,It's a different atmosphere from what we call it anymore.
エビもぷりぷりやし！,Shrimp is also plump!,ということは必然的にこちらはね,"So, inevitably, this one is.",ゆっくりと者の時間を過ごすことができた,I was able to spend some time with him.
なんでも合うよね,It goes with everything.,たぶん部屋着とかそういったものでしょうね,Probably loungewear or something like that.,大学生のときにスペイン語を学びました,I learned Spanish when I was in college.
天ぷらが余ったら、明日は,If I have leftover tempura.,玄関にはですね,At the entrance.,スペイン語って、あの、難しいですけれども,"Spanish is, you know, difficult."
天つゆと卵でとじて、天丼にしたりします,I sometimes make a tendon with tempura soup and eggs.,こんな感じで大きい姿見もありました,There was also a large mirror like this one.,学ぶ楽しさはやっぱりありますよね？,"It's fun to learn, isn't it?"
おそば、食べたくなるなぁ,I want to eat soba.,今回も私、謎柄で来ました,I came with a mysterious pattern again this time.,女性名詞と男性名詞があって,There are feminine and masculine nouns.
お風呂、はいっておいで！,Come take a bath!,謎柄でございます,It's a mystery pattern.,それぞれ変わるんですよ,Each one is different.
今度ドラマ 評判いいみたいじゃない,I hear the drama is getting good reviews,すごい柄だねほんとに,"It's an amazing pattern, really.",外国語を学ばれた方いらっしゃいますか？,Have you ever studied a foreign language?
そんなんじゃないわよ,It's not like that.,かわいい柄でしょ？,"Cute pattern, right?",皆さん、第二外国語は何にしていましたか？,What did you choose as your second language?
マスター白菜漬け 大盛りね,"A big bowl of pickled Chinese cabbage, Master.",そしてここはたぶんトイレですかね,And this is probably the bathroom.,流れて行っちゃった,It just drifted away.
うまみや甘みが凝縮されます,The cabbage will taste sweeter as they dry out.,温泉に入ればいいということでプレイ,Play with the idea of taking a hot spring bath.,コメントがすぐに流れちゃうので,The comments flow so quickly.
一層うまくなります,It becomes even better!,辺動きでですね,It's an edge movement.,結構スペイン語が多いですね,It's pretty much all Spanish.
ちょっとしきり直して,Let's start over.,あっ透けちゃった,"Oh, it's transparent.",なんだろうこれ？,What is this?
子供が乗るやつですか？,Is that the one the kids ride?,タイヤ交換するやつ？,The one where you change the tire?,いいですかね？,Are you sure?
建物写ってましたね,You got a picture of the building.,建物など無くね,There's no building.,感じでみなさんは撮ってください,Please take pictures like this.
泣かないように気をつけて,Try not to cry.,でもすっごい涙もろいんですよ,But I'm very easily moved to tears.,感動してすぐ泣いちゃいますし,I get emotional and cry easily.
感極まってもすぐ泣いちゃいますし,"Even when I'm overwhelmed with emotion, I cry easily.",あと怒ったり悔しくなってもすぐ泣いちゃう,I also cry easily when I'm angry or frustrated.,ポテトが気になっていたので,I was curious about the potatoes.
作ってみました！,I made it!,ということで、上手いじゃないかー！,"So, you're good at it!",そういうこと言わないで！,Don't say that!
私のハリネズミも可愛かったでしょ！,Wasn't my hedgehog cute too!,今準備が整ったそうなんですけども,I heard it's all set up now.,スタッフさんが出していいのか？,Is it okay for the staff to let you out?
しょうがない…出していいですよ,I don't have a choice... you can let me out.,でも面白い！,But it's funny!,まあ私のは笑えるからいいですよね,"Well, mine's good for a laugh."
みんなもめっちゃ笑ってくれてる！,You guys are laughing so hard!,これはですねー自分と一緒に撮ってみました,Here's a picture of myself with it.,ほんとそわそわしてたんですから,I've been really nervous.
写真撮ってみましたよ,I took some pictures.,楽しんでみましたーもうほんと楽しかった,I really enjoyed it!,そしてですね忘れてはいけない,And don't forget...
今日姉の日というのを初めて知ったので,I've never heard of today being my sister's day before.,姉にありがとうと言うことを伝えたい,I just want to say thank you to my sister.,これは必ず実践していますね,You always practice this.
今日から優しく唇全体につけたいと思います,I'm going to start applying it gently all over my lips today.,身長が同じくらいもうちょっとかな？,"We're about the same height, maybe a little taller.",スカイツリー本当に高くていいですね,Sky Tree is really tall and nice.
右上なんですけどここらへんです,"It's in the upper right corner, but it's around here.",でも結構黒目がちなのかなぁ？,But I wonder if she has pretty dark eyes?,ちょっと報告をしていた,I've been doing some reporting.
さらっと報告していきたいと思います,I'd like to make a quick report.,もう一回やり直したい,I want to do it all over again.,時刻は17時30分を回りました,The time was around 17:30.
すすらないようにっていうより,Rather than trying not to soak it.,あんまりこう音を鳴らさないようにすする,Sip without making too much noise.,っていう感じにしているかもしれない私,I might be making it look like that.
ほんと日用品を買いに出たんですよ,I really just went out to buy some supplies.,日用品を買いに行ったって言ってるじゃない,I told you I went to buy some supplies.,結構皆さんのおかげですね,That's pretty much all of you.
袋のあいたさつまいもパンが,The sweet potato bread with the bag open.,天使が降臨しちゃった,The angels have descended.,本当に幸せな一ヶ月間だったと思います,I think it's been a really happy month.
最終回くらい重かったごめんなさい,I'm sorry it was as heavy as the last episode.,でも1か月間本当に濃かったんですよね,But it's been a really intense month.,さっきデビューしたばっかだからもう本当に,"I just made my debut, so I'm really ready to go."
無事に過ごしましょう、いい天気ですね,Let's stay safe. It's a beautiful day.,それでは安全に素敵な夜をお過ごしください,Have a safe and wonderful evening!,結構皆さんのおかげですね,Thanks to all of you!
