Sentences,Translation
子供たちが迷惑をかけるのは当たり前だ。,It is common for children to cause trouble.
腕を前後に振りなさい。,Swing your arm back and forth.
試合の直前にはいつもあがっています。,I always get nervous just before a match.
彼女の料理の腕前は上がってきている。,She's making progress in cooking.
私たちの前途には幾多の困難が横たわっている。,There lie many difficulties before us.
事前に予約を取っておくべきだ。,We'd better make a reservation beforehand.
アメリカも本音と建前を使い分ける国だ。,The U.S. is also a country that uses both real intentions and pretense.
大きな乗用車が止まり、背の高い女性が降りた。,A big car drew up and a tall lady got out.
バスの運転手は乗客の安全について責任がある。,A bus driver is responsible for the safety of the passengers.
乗務員全員が食中毒で苦しんだ。,The entire crew suffered from food poisoning.
彼は乗馬を仕込まれた。,He was brought up to riding.
ちょうどいいね。新型の試乗してってもらうね。,Good timing. I'll get you to test drive the new model.
韓流ドラマブームに便乗して、韓国の製品を売る業者が増えた。,"Taking advantage of the popular boom in Korean drama, workers selling Korean goods have increased."
列車に乗車した後で、私は財布を家に置き忘れてきたことに気が付いた。,"After I got on board a train, I found I had left my wallet behind at home."
２人の女性が乗船していた。,There were two women on board.
途中で乗り換えが必要ですか。,Is it necessary to change trains along the way?
帰宅の途中電車の中で居眠りをして乗り越してしまった。,I dozed off on the train on my way home and missed the train.
万一この飛行機が乗っ取られたら、君は一体どうするだろうか。,"If this airplane were to be hijacked, what in the world would you do?"
道路は様々な乗物で混雑していた。,The road was crowded with various vehicles.
私が乗り込むやいなや、汽車は動き出した。,I had barely got aboard when the train began to move.
ホテルまでに車に乗せてくれませんか。,Will you give me a ride to my hotel?
バスは乗客を乗せるために止まった。,The bus stopped to take up passengers.
明日の朝立ち寄ってあなたを車に乗せていきましょう。,I'll come by and pick you up tomorrow morning.
彼は金沢行きの列車に乗った。,He got on a train bound for Kanazawa.
その一件はめでたく落着するだろう。,The affair will come to a happy conclusion.
その用件は明日まで待てますか。,Can the matter wait till tomorrow?
そちらの条件を受け入れましょう。,We will accept your conditions.
この案件をどう処理するか、君に下駄を預けるよ。,I'm just going to leave it up to him to figure out how to clean up this mess.
交通事故の件数が増加している。,There has been an increase in the number of traffic accidents.
その事件によって彼の勇敢さが試された。,That incident put his courage to the test.
利用条件を予告なしに変更することがあります。,Terms of use may be changed without notice.
彼らは労働条件を改善したがっている。,They want to better their working conditions.
無条件でその計画に同意した。,We agreed to the plan without qualification.
適合率とは取り出した記事のうち、どの程度の記事が検索条件に合っているかを示す指標です。,The precision ratio is an index that indicates how many articles meet the search criteria out of all of the articles retrieved.
私は高校の全課程を修了した。,I completed the whole high school curriculum.
私は修学旅行を大変楽しみにしている。,I am looking forward very much to the school excursion.
彼女は３年前に修士の学位をとりました。,She got a master's degree three years ago.
研修会は午後４時開始の予定。,The training session is scheduled to begin at 4 p.m.
体育の授業は全員が必修です。,The physical fitness courses are required for everyone.
失礼ですが御提案を修正させていただきます。,I beg to modify your proposal.
私は彼に時計を修理させた。,I had my watch mended by him.
その城は修復され市民に公開されている。,The castle has been restored and is open to the public.
私は彼女がスカートを修繕しているのに気づいた。,I found her mending a skirt.
その本はいちばん下の棚に置いてください。,Put the book on the bottom shelf.
専門家はその絵に高い評価を下した。,Experts put a high valuation on the painting.
７時から８時の間に電話してください。,Please call me up between seven and eight.
彼が階下に降りて来るのが聞こえた。,We heard him come downstairs.
お茶の質は下がりつつある。,The quality of tea is going down.
その店では傷物の値段を４０パーセント下げた。,They marked the damaged goods down by 40%.
いつ来てくださっても準備はできています。,I'm ready whenever you may come.
私は毎朝銀座で地下鉄に乗る。,I get on the subway every morning at Ginza.
彼はスーツにあう靴下を選んだ。,He selected a pair of socks to match his suit.
地下はショッピング街です。,There is a shopping district underground.
廊下は大変混雑していたので歩けなかった。,The corridor was so crowded that we couldn't walk.
今朝は零下３度以下だった。,The thermometer stood at three degrees below zero this morning.
この国では出生率が急速に低下している。,The birthrate is rapidly declining in this country.
学生でも下宿させてもらえますか。,Do you take in students?
彼は叔母さんの家に下宿していた。,He boarded with his aunt.
下痢をしています。,I have diarrhea.
その事故は下手な運転のせいだった。,The accident was due to bad driving.
この時計は非常に価値がある。,This watch is of great value.
この表の数値は千単位で示されている。,The figures in this table are shown in thousands.
周波数の平均値は振幅の増大にしたがって減じる。,The mean value of the frequency decreases with increasing amplitude.
その店は値段が高いので有名だ。,The store is notorious for charging high prices.
この本は読む値打ちがあるとおもう。,I think this book is worth reading.
彼女は値切るのがうまいんだ。,She's good at bargaining the price down.
価格を値引きする店もあります。,Some stores discount the price.
冬は新鮮な野菜は高値である。,Fresh vegetables are very dear in winter.
彼の提案は考慮に値する。,His proposal is worthy to be considered.
その論文は注意深く研究するのに値する。,The article deserves careful study.
社会の価値観はその伝統の中に反映されている。,A society's values are reflected in its traditions.
たまには偏差値の高い人とレベルの高い会話してみたい。,I like to have a deep conversation with a more academic person from time to time.
バス代が２０％値上げになった。,The bus fares have been raised by 20 percent.
４月から公共料金が値上げになる。,Public utility charges will go up next April.
学校は授業料の値上げを発表した。,They announced an increase in tuition fees.
来月から家賃を値上げします。,We will increase the rent next month.
東京証券取引所は後場の終わり値になって持ち直しました。,The Tokyo Stock Exchange rallied at the end of the day.
嵌められた気がしてならない。,I can't help but feel like I'm being set up.
そうするといやが上にも美しく見える。,That makes you even more attractive.
そうするとよけい傷をとがめるよ。,It will aggravate the wound.
そうすると金がその２倍かかるだろう。,It would cost twice as much as that.
彼は会う人ごとに話しかけた。,He spoke to whomever he met.
２時間毎に局部を湿布しなさい。,Apply a compress to the affected part every two hours.
電車は３０分ごとに走っている。,The train runs every thirty minutes.
食前ごとにこの薬を飲みなさい。,Take this medicine before each meal.
そのうわさは果たして本当だろうか。,Can the rumor be true?
これははたして彼の書いた物だろうか。,Can this be his writing?
夏は来たがやがて去る。,"As the summer has come, so it will go."
物価はやがて上がるだろう。,Prices will rise in course of time.
秘密はやがて明らかになるだろう。,The secret will emerge in due course of time.
やがて彼が部屋に入ってきた。,Before long he came into the room.
彼の顔は怖そうに見える反面声は優しくおだやかだった。,"In contrast to his frightening looks, his voice was kind and calm."
彼はいわゆる天才ではない。むしろ彼は努力家なのだ。,"He is not what is called a genius. Rather, he is a hard worker."
彼の研究はいわゆる事実に基づいている。,His study is based on what is called fact.
これはいわゆる斬新なアイデアです。,"This is what we call a ""brand new idea""."
彼が貧しいからといって不幸だということにはならない。,"Just because he is poor, it does not follow that he is unhappy."
体積が大きいからといって常に重量も重いとは限らない。,Great bulk does not always mean great weight.
おいしいからといってなんでも食べ過ぎてはいけない。,You must not eat too much of anything because it tastes good.
彼女が美しいからといって彼女を好きなわけではない。,It is not because she is beautiful that I like her.
生徒はみんな校則を知っていることになっている。,Every pupil is supposed to know the school regulations.
今晩小さなパーティーをひらくことになっている。,We are giving a small party this evening.
今は焦らずに時を待つべきだ。,We should not be rash now; we should wait for a good chance.
英語を習得する努力を続けるべきだ。,You should persist in your efforts to learn English.
君は彼に本当のことを言うべきだった。,You should have told him the truth.
書籍が学問に従うべく、学問が書籍に従うべからず。,"Books must follow sciences, and not sciences books."
雨天の後には晴天が来る。,After rain comes fair weather.
映画でも見ていこうか。,Let's stop off and see a movie.
彼は昨年北海道にいましたか。,Was he in Hokkaido last year?
彼女は私たちに食べるものをくれた。,She gave us something to eat.
この家は家賃がいらない。,This house is free of rent.
誰がそれを知ろうか。,Who'd know that?
私の家に来れる時は、まず電話をして下さい。,"When you can come to my house, please call me first."
奨学金が交付された。,I got a grant for my tuition.
ここから歩いて２時間もの距離だ。,It is no less than two hours' walk from here.
僕の声は届いていますか。,Can you hear I'm calling?
私はその板をインチで計った。,I measured the board in inches.
駅に着く前に列車は発車していた。,The train started before we got to the station.
能力がすべてではない。,Ability alone is not enough.
こういう機器では買いたくなるような値段です。,"It's an attractive price, for this sort of device."
なぜ森の中で道に迷ったのか。,Why did you get lost in the woods?
私に一回だけ言わせてくれ。,Let me say it once for all.
彼は駅で英語の先生にばったり会った。,He met his English teacher at the station by accident.
あちらに富士山が見えます。,We can see Mt. Fuji over there.
正確に言うと私は大学講師です。,"Specifically, I'm a university lecturer."
君は彼に本当のことを言うべきだった。,You should have told him the truth.
私は外国へ行くつもりだったが。,I intended to have gone abroad.
私がここへ来てから二年になる。,It is two years since I came here.
それは何という動物だ。,What an animal it is!
私たちの学校には１０の学級がある。,Our school has ten classes.
農場で一人の男が働いている。,There is a man working on the farm.
このスカーフはすべすべする。,This scarf feels soft.
あなたはこの部屋で眠ったらいけません。,You are not to sleep in this room.
彼は彼女をとても魅力的だと思います。,He thought her very charming.
この国には外国人の観光客が大勢いる。,Foreign tourists in this country are numerous.
あの、本当は、ちょっと具合が悪いんです。,"Well... actually, I'm sick."
医者は少女に抗生物質を服用させた。,The doctor dosed the girl with antibiotics.
どっちの方に行くとよいかな。,Which way shall we go now?
彼女はいつも体の具合が悪いと不平を言っている。,She is always complaining of her poor health.
この規則はいくとおりにも解釈できる。,This rule reads several ways.
私は非常に早く起きたのでその列車に間に合った。,"Because I got up so early, I caught the train."
突然ベルが鳴った。,The bell rang suddenly.
ここの本は学生が誰でも利用できます。,These books are accessible to all students.
あの建物の前に立っている人は誰ですか。,Who is the man standing in front of the building?
彼女は彼よりも優れた指導者だ。,She is a more proficient leader than he is.
賃金や給料は定期的に受け取る給与のことです。,Wages and salary are pay received at regular times.
彼の考えは私の考えと一致しない。,His ideas do not fit in with mine.
自分のすらっとした姿を得意に思っています。,She is vain about her slender figure.
楽しい時って、あっと言う間に時間過ぎちゃうんだよね。,"When you're enjoying yourself, the time seems to fly by."
それらの街の交通法は同じである。,Those cities have uniform traffic laws.
彼は多かれ少なかれ酔っていた。,He was more or less drunk.
あのお店ではおいしいリンゴが販売中です。,There are some nice apples on sale in that shop.
彼は他の事に気を取られている。,He is preoccupied with something else.
私は忙しいし、それには興味もない。,"I am busy, and I'm not interested in that, either."
あなたのご親切を私はけっして忘れません。,I shall never forget your kindness.
何事にも積極的な態度を取るようにしなさい。,Try to have a positive attitude about everything.
冬は道路を凍結するのでよく滑って転びます。,It is easy to slip and fall during icy winters.
暗い道では足元に気をつけなさい。,Watch your step in dark alleys.
質ではこれはあれよりはるかに勝っている。,This one is of much higher quality than that one.
楽しく遊んできなさい。でも道に迷わないように。,"Have fun, but don't get lost."
部屋を見せていただけますか。,Could I see the room please?
魚は尾を動かして泳ぐ。,A fish swims by moving its tail.
すべての人間は法律的には対等である。,All human beings are legally equal.
地震ほど怖い物はない。,Nothing is so terrible as an earthquake.
市内までいくバス乗り場は、どこですか。,Where's the bus for the city?
今日は雨降りなので、買い物はやめよう。,"It being rainy today, let's cancel our shopping."
店にあるのは、これ一つだけです。,It is the only one there is in the shop.
彼はせいぜい１０ドルしか持っていない。,He has not more than 10 dollars.
若いうちに海外へ行かれることをお勧めします。,I advise you to go abroad while young.
私は食事をしながら本を読みました。,I read a book while eating.
彼はその知らせにすっかり失望した。,He was very much disappointed at the news.
彼はその結果を知って満足した。,He was satisfied to know the result.
なんとすてきな顔をしているのだろう。,What a nice face she has!
日本では、月給です。,"In Japan, we are paid by the month."
では明日その事について彼に尋ねてみます。,"I will ask him about it tomorrow, then."
当市には大気汚染はありません。,Our city is free from air pollution.
おっしゃる意味がわかりませんが。,What you said does not make sense.
夫は私より上手に料理する。,My husband is better able to cook than I.
彼は彼女をとても魅力的だと思います。,He thought her very charming.
社会と個人とは不可分である。,Society and the individual are inseparable.
きみの腕や足は十分に強くなった。,Your arms and legs have grown strong enough.
それじゃあこのメモを渡してください。緊急です。,"Then, please give him this note. This is urgent."
その町で最高のホテルはどこですか。,Which is the best hotel in the town?
今度日本に返って来られるのはずっと先のことでしょう。,I guess it will be a long time before I can return to Japan.
私は蛇など全然怖くない。,I'm not in the least afraid of snakes.
そのクラスは５０人の学生から成っている。,The class consists of fifty students.
彼女は音楽家として初めて世に出た。,She made her first appearance as a musician.
この梱包材が断熱機能を担っている。,This packaging material provides heat insulation.
しかしその答えはすべて間違っていた。,But the answers were all wrong.
あなたの乗る電車は１０番線から出ます。,Your train leaves from Platform 10.
彼の娘は美しい女になった。,His daughter grew to be a beautiful woman.
私が部屋に入ると彼らは拍手した。,"As I entered the room, they applauded."
東京は今何時でしょうか。,What's the local time in Tokyo now?
その問題は解決したものと考えた。,I considered the problem as settled.
私は若い頃よく山に行っていたものだ。,I would go to the mountains when young.
制服は学校によって違う。,Uniforms differ from school to school.
そして何時間もいっしょに話したからです。,And we had spent hours talking together.
ミニスカートがまた流行している。,Mini-skirts are back in fashion again.
夜になって、家へ帰った。,"When night came on, we returned home."
日本では夏は非常に暑い。,"In Japan, it is very hot in summer."
その娘はわっと泣き出した。,The girl burst into tears.
彼女の声は震えていた。,There was a tremble in her voice.
熱いスープで彼女の舌がやけどした。,Hot soup burned her tongue.
彼の結論は完全な間違いであることが明らかになった。,His solution turned out to be a complete mistake.
そんな些細な事は問題外だ。,Such a trivial thing is out of the question.
私はよい野菜や米、果物などを栽培したいのです。,"I want to grow good vegetables, rice, fruit and so on."
東京は今何時でしょうか。,What's the local time in Tokyo now?
私の妹は昨日神戸に行った。,My sister went to Kobe yesterday.
彼は大阪で生まれた。,He was born in Osaka.
彼女の目の色は青です。,The color of her eyes is blue.
冬の日は速く暮れる。,The night falls fast in winter.
外に出してやってくれませんか。,Could you let him out?
あなたはその規則を守らなければならない。,You must keep to the rules.
試合の結果について聞きましたか。,Have you heard about the result of the game?
私は昨日２０万円の利益を得た。,"I profited 200,000 yen yesterday."
彼は彼女の手をつかまえた。,He caught her hand.
喜んでそういたしましょう。,I'll do it with pleasure.
次の新幹線は９時ちょうどに出ます。,The next Shinkansen train leaves at just nine o'clock.
さらに研究すればその理論が正しいことがわかるだろう。,Further study will prove that the theory is right.
たまたま私は彼女と東京で出会った。,It happened that I met her in Tokyo.
私の家の庭には昔菜園があった。,There used to be a vegetable garden in our yard.
誰もがその少年を本物の天才と認めている。,Everyone recognizes the boy as a real genius.
いい考えが心に浮かんだ。,A good idea entered my mind.
これ以上まけられませんか。,Is this the last price?
病院の後ろにあるあの建物はなんですか。,What's that building at the back of the hospital?
今日は雨降りなので、買い物はやめよう。,"It being rainy today, let's cancel our shopping."
君は運転免許を取るには、まだ若すぎる。,You're still too young to get a driver's license.
その家は目下建築中である。,The house is now under construction.
今年の日本経済の成長率は０.７％を超えるだろう。,The growth rate of the Japanese economy will top 0.7% this year.
チェックアウトしたいのですが。,I'd like to check out.
彼女は皿を洗い、それから乾かした。,She washed the dishes and she dried them.
その町は成長して経済の中心となった。,The town developed into the center of the economy.
ごめん。道が混んじゃって。,Sorry. Traffic was heavy.
私はよい野菜や米、果物などを栽培したいのです。,"I want to grow good vegetables, rice, fruit and so on."
君に会うのはいつだってうれしいことです。,To see you is always a great pleasure.
彼女の悲しみは無言でこぼす涙になって表れた。,Her sorrow found expression in silent tears.
彼女の異常なふるまいから何を推測しますか。,What do you infer from her strange behavior?
誰にその事故の責任があるのか。,Who is to blame for the accident?
だれでも苦労の無い生活を望んでいる。,Every one wants to live free from care.
一歩でも動いてごらん、崖から落ちてしまうよ。,"A single step, and you will fall over the cliff."
この品の税金分はむこうでお支払い下さい。,Please pay the tax on the items over there.
彼は荒々しいサッカーの試合の間、鉄の棒で殴られた。,He was beaten with an iron rod during a violent soccer match.
彼女は商事会社に勤めている。,She is employed in a trading company.
その劇で彼女は女中と女店員との二役を努めた。,In the play she doubled the parts of a maid and shop girl.
そのときになって初めて私は自分の誤りを悟った。,It was not until then that I realized my mistake.
この役者のことはいままで聞いたことがない。,I've never heard of this actor.
天気の予報は過去のデータに基づいて行われる。,"The weather is forecast, using the past data as a basis."
彼はしろうとの庭師だが、彼の育てる花は美しい。,"He is an amateur gardener, but his flowers are beautiful."
少女たちはさながら蝶のように軽やかに踊っていた。,The girls were dancing lightly like so many butterflies.
革命は新たな時代をもたらした。,The revolution brought in a new era.
私たちはそのまま洞窟の口にボートで突っ込んで行きました。,We plunged into the cave opening on our boat and continued on.
写真に写っている人は皆にこにこしている。,Everybody in the picture is smiling.
緑色である事がその種のりんごの特徴なのです。,A green color is a characteristic of that type of apple.
少女は自転車の後部をチェックしている。,The girl is checking out the rear of the bicycle.
太陽と湿った気候が熱帯雨林を作った。,The sun and a damp climate made the tropical rainforest.
私たちは隣近所とは仲良くしている。,We get on well with our neighbors.
彼はボールをゴールに蹴り入れた。,He kicked the ball into the goal.
病人は救急車で病院へ急いで運ばれた。,The sick person was rushed to the hospital in an ambulance.
私たちはパトカーが全速力で走っているのを見た。,We saw a patrol car running at full speed.
ちょっと勘弁して下さい。,"Give me a break, will you?"
適度な運動は血液の循環を活発にする。,Moderate exercise stimulates the circulation of blood.
私は赤ちゃんが目を覚まさないようにつま先で歩いた。,I walked on tiptoes so as not to wake the baby.
彼女は洗面器に水を注いだ。,She poured water into the basin.
小川が湖に注いでいる。,A stream flows into the lake.
彼は眼鏡越しに私をにらみつけた。,He looked sharply at me over his spectacles.
円高はその会社にとって致命的な打撃だった。,The strong yen was a fatal blow to the company.
私はその計画を承諾することができません。,I cannot approve the project.
彼女は彼の発言を脅迫と解釈した。,She interpreted his remarks as a threat.
