Sentences,Translation
給料が上がりました。,My salary has increased.
風邪で熱が39度まで上がった。,My fever rose to 39 degrees due to a cold.
スピーチをするとき、いつも上がります。,It always rises when I give a speech.
雨が上がったら、出かけましょうか。,Let's go out when the rain stops.
遠慮しないで、どうぞお上がりください。,"Don't be shy, please come up."
かばんを棚に上げます。,I put my bag up on the shelf.
友達の誕生日にプレゼントをあげました。,I gave my friend a present for her birthday.
質問があったら、手を挙げてください。,Please raise your hand if you have any questions.
日本語を教えてあげましょうか。,Would you like me to teach you Japanese?
論文を書き上げたら、連絡します。,I'll call you when I finish my paper.
窓を開けてもいいですか。,Can I open the window?
ドアに鍵がかかっていて、開けられません。,I can't open the door because it's locked.
旅行に行くので、しばらく家を空けます。,"I'm going on a trip, so I won't be home for a while."
今度の日曜日を空けておいてください。,Please leave this Sunday open.
明けましておめでとうございます。,Happy New Year to you.
寝坊したので、朝御飯を食べるのをあきらめました。,"I overslept, so I gave up eating breakfast."
この企画は見込みがない。あきらめよう。,This project has no chance. Let's give up.
あきらめてはいけません。,Don't give up.
ゴールはもう少しだ。あきらめるな。,The goal is almost there. Don't give up.
何を言われても、私はあきらめなかった。,"No matter what they said, I didn't give up."
毎日同じ仕事をするのに飽きました。,I got tired of doing the same job every day.
息子はそのおもちゃにもう飽きたようだ。,My son is already bored with that toy.
勉強に飽きたら、散歩します。,"When I get tired of studying, I take a walk."
すぐに飽きるのはあなたの悪い癖だ。,It's a bad habit of yours to get bored easily.
そんな説教は聞き飽きた。,I'm tired of hearing such sermons.
このボタンを押すと、ドアが開きます。,Press this button to open the door.
鍵が壊れていて、窓が開かない。,The lock is broken and the window won't open.
銀行は9時に開くそうです。,The bank says it will open at nine o'clock.
その席は空いていますか,Is that seat available?
土曜日は忙しいけど、日曜日なら空いています。,"I'm busy on Saturdays, but I'm free on Sundays."
去年、その二つのチームは優勝を争った,"Last year, those two teams fought for the championship."
鈴木さんは佐藤さんと昇進を争っている,Mr. Suzuki is competing with Mr. Sato for a promotion.
その土地が誰の物か、法廷で争われた。,They fought in court over who owned the land.
争うのは好きじゃない,I don't like to fight.
今は一刻を争う時です。,Now is the time to fight for every second.
食事の前に、手を洗いました。,"Before eating, I washed my hands."
このセーターは水でも洗えます。,This sweater can be washed with water.
彼女は子供たちにお皿を洗わせます。,She lets the children wash the dishes.
何度洗っても、このしみは落ちない。,"No matter how many times I wash them, these stains will not come off."
自然の中にいると、心が洗われるようだ。,Being in nature seems to wash my mind.
森から熊が現れた,A bear emerges from the forest.
一時間待っても、彼は現れなかった,"I waited for an hour, but he didn't show up."
彼は、いら立ちが声に表れていた。,His frustration was evident in his voice.
彼女は気持ちがすぐ顔に表れる。,She can easily show her feelings in her face.
雪がとけて、地面が現れ出しました。,The snow melted and the ground began to appear.
突然物陰から男が姿を現した。,Suddenly a man emerged from the shadows.
彼女は感情を態度に表しません。,She doesn't show her emotions in her attitude.
あの看板は何を表しているのでしょうか。,What does that sign represent?
その景色の美しさは言葉では表せない。,The beauty of the scenery cannot be described in words.
彼は亡くなる一年前に自伝を著しました。,He wrote his autobiography a year before he died.
郵便局は駅のそばにあります。,The post office is located near the station.
時間とお金があれば、京都へ行きたいです。,"If I had the time and money, I would like to go to Kyoto."
田中さんから電話がありました。,I got a call from Mr. Tanaka.
時から会議があるので、失礼します。,"I have a meeting at 5:00 p.m., so if you'll excuse me."
ゆうべ遅くに地震がありました。,There was an earthquake late last night.
銀座の街を歩きました,I walked the streets of Ginza.
三十分歩いて、やっと駅に着いた。,"After walking for thirty minutes, I finally arrived at the station."
ちょっと歩こうか。,Let's walk for a while.
駅から家まで歩いて五分ぐらいです。,It's about a five-minute walk from the station to my house.
足が痛くて、歩けません。,"My feet hurt, so I can't walk."
週末、友達と六本木で遊んだ。,"On the weekend, I hung out with my friends in Roppongi."
弟とゲームをして遊ぶつもりです。,I'm going to play games with my brother.
遊んでばかりいないで、勉強しなさい。,"Don't keep playing, you should study."
危険。この川で遊ぶな。,Danger. Don't play in this river.
どうぞ近いうちに遊びに来てください。,Please come and play with us soon.
ボールが窓に当たって、ガラスが割れた。,The ball hit the window and broke the glass.
天気予報が当たって、午後から雪が降った,The weather forecast came true and it snowed in the afternoon.
宝くじで百万円が当たった。,I won one million yen in the lottery.
その映画はとても当たった。,That movie was very successful.
私の部屋は日が当たらない。,There is no sun in my room.
ダーツを的の中心に当てるのは難しい。,It is difficult to hit a dart into the center of the target.
クイズの答えを当てました。,I guessed the answer to the quiz.
この箱の中身は何か当ててみてください。,Guess what's in this box.
額に手を当ててみたら、熱かった。,I put my hand on my forehead and it was hot.
これはあなたにあてた手紙です。,This is a letter addressed to you.
切手がたくさん集まった。,I collected a lot of stamps.
明日は何時に集まればいいですか。,What time should we meet tomorrow?
十時に集まってください。,Please meet me at ten o'clock.
またいつか集まりましょう。,Let's get together again sometime.
コンサートに三千人ぐらいの人が集まりました。,There were about three thousand people at the concert.
私は切手を集めています。,I'm collecting stamps.
生徒たちは全員校庭に集められた。,All the students were gathered in the schoolyard.
論文を書くために、資料を集めておきます。,I will collect materials to write my paper.
集めたごみを燃やしましょう。,Let's burn the garbage we have collected.
彼女の服は、周りの人の注目を集めた。,Her clothes drew the attention of everyone around her.
仕事の後で友達と会って、食事に行きます。,I'm going to meet my friends for dinner after work.
明日三時に駅で会いましょう。,I'll meet you at the station tomorrow at three o'clock.
どこかでお会いしませんでしたか。,Have we met somewhere else?
この靴はサイズが合いません。もう少し小さいのをください。,These shoes are not the right size. Please give me a smaller one.
答えが合っているかどうか、確かめてください。,Please make sure your answer is correct.
遅れたことを彼に謝ったほうがいい。,You'd better apologize to him for being late.
正直に謝ったら、彼女は許してくれた。,"When I apologized honestly, she forgave me."
彼女はとても怒って、彼に謝らせた。,She got very angry and made him apologize.
判断を誤ったかもしれない。,I may have misjudged the situation.
誤って、大切な書類を捨ててしまった。,I accidentally threw away an important document.
あなたの荷物を預かっています。,I'm taking care of your luggage.
このかばんを預かってもらえますか。,Can you take care of this bag for me?
コートはどこで預かってくれますか。,Where can I keep my coat?
こちらでお預かりいたします。,You can take care of it here.
友達が子供を預かってくれた。,A friend took care of my child.
荷物を受付に預けました。,I left my luggage at the reception desk.
荷物を預ける所は、どこですか。,Where can I leave my luggage?
あそこに預けられますよ。,You can leave them there.
彼らは子供を保育園に預けて働いている。,They leave their children at the nursery and go to work.
鈴木さんは銀行に百万円を預けている。,Mr. Suzuki has one million yen deposited in the bank.
肩がドアにぶつかりました。,My shoulder hit the door.
交差点で車とバイクがぶつかった。,A car and a motorcycle collided at the intersection.
この道は少し先で川とぶつかります。,This road collides with a river a little further on.
山田さんはよく上司とぶつかっている。,Mr. Yamada often bumps into his boss.
去年はクリスマスと日曜日がぶつかった。,"Last year, Christmas and Sunday collided."
足を机の角にぶつけてしまった。,She hit her foot on the corner of the desk.
彼女は車をガードレールにぶつけました。,She hit her car against the guardrail.
転んで、頭を床にぶつけそうになった。,She fell and almost hit her head on the floor.
車を駐車場に止めておいたら、誰かにぶつけられた。,I parked my car in a parking lot and someone hit me.
イライラを人にぶつけるのは、やめてください。,Please don't take your frustration out on people.
あの人は日本人ですか。いいえ、違います。,"Is that person Japanese? No, he's not."
この部屋とあの部屋は大きさが違います。,This room and that room are different in size.
私は彼女と意見が違う。,I have a difference of opinion with her.
電話番号が違いますよ。,Your phone number is different.
習慣は国によって違うものです。,Customs vary from country to country.
いすを机に近づけてください。,Please move your chair closer to the desk.
鈴木さんは仕事中、人を近づけない。,Mr. Suzuki doesn't let people near him when he's working.
彼は顔を窓に近づけて、外を見た。,He put his face close to the window and looked out.
子供をストーブに近づけないでください。,Keep your children away from the stove.
悪い友人を近づけないようにしなさい。,Keep your bad friends away from it.
電車は駅に近づいた。,The train approached the station.
危ないから、その機械に近づいてはいけない。,Don't go near that machine because it's dangerous.
クリスマスが近づくと、街はにぎやかになる。,"As Christmas approaches, the city becomes more lively."
天気予報によると、台風が近づいているそうだ。,"According to the weather forecast, a typhoon is approaching."
彼はひどい風邪をひいているから、近づかないほうがいい。,"He has a bad cold, so he should stay away from it."
子供は熊のぬいぐるみを抱いている。,The child is holding a stuffed bear.
彼は息子を両腕にしっかり抱いた。,He held his son tightly in both arms.
友達の赤ちゃんを抱かせてもらった。,I was allowed to hold my friend's baby.
その男の子は母親に抱かれて、眠ってしまった。,The boy fell asleep in his mother's arms.
彼は大きな夢を抱いて、故郷を出た。,He left his hometown with big dreams.
その男はたくさんの人をだました。,The man cheated a lot of people.
彼らは観光客をだまして、高い物を買わせた。,They tricked the tourists into buying expensive things.
彼はうそが上手で、すっかりだまされてしまった。,He was a good liar and he was completely deceived.
そんな下手な言い訳では、親はだませないでしょう。,You can't fool your parents with such a lame excuse.
彼女をだますつもりはなかった。,I didn't mean to deceive her.
かばんから財布を出しました。,I took my wallet out of my bag.
ごみは朝八時までに出してください。,Garbage should be put out by eight o'clock in the morning.
昨日、母に手紙を出しました。,I sent a letter to my mother yesterday.
このレポートは何日までに出さなければなりませんか。,By what date must this report be submitted?
急に雨が降り出しました。,It suddenly started to rain.
出かけましょう。,Let's go out.
加藤さんは買い物に出かけた。,Mr. Kato went out for shopping.
日曜日、どこにも出かけませんでした。,I didn't go out anywhere on Sunday.
午後、用事があって、出かけなければならない。,I have to go out in the afternoon for some errands.
先生は六時ごろお出かけになりました。,The doctor went out around six o'clock.
食事の用意ができた。,The meal is ready.
日本語ができますか。,Can you speak Japanese?
女はピアノを弾くことができます。,The woman can play the piano.
申込書は、できるだけ早く出して下さい。,Please submit the application form as soon as possible.
駅の近くに新しいスーパーができたそうです。,I heard that a new supermarket has opened near the station.
森さんは、もう会社を出ましたか。,Has Mr. Mori left the office yet?
三時に会議に出なければならないので、失礼します。,"I have to go to a meeting at three o'clock, so if you'll excuse me."
新聞に地震の記事が出ています。,There's an article about the earthquake in the newspaper.
彼はアメリカの大学を出たそうです。,I heard that he graduated from an American university.
マラソン大会に出るために、毎日走っています。,I run every day to participate in marathons.
どうしてその仕事を選びましたか。,Why did you choose that job?
どうぞお好きな物をお選びください。,Please choose the one you like.
田中さんは議長に選ばれました。,Mr. Tanaka was chosen as the chairman.
毎朝、妹は服を選ぶのに時間がかかる。,"Every morning, my sister takes a long time to choose her clothes."
先生にいい辞書を選んでいただきました。,My teacher chose a good dictionary for me.
日本語の語彙が増えた。,My Japanese vocabulary has increased.
体重が5キロ増えました。,My weight has increased by five kilograms.
世界の人口は増え続けている。,The world's population continues to grow.
最近、電気自動車の数が増えている。,The number of electric cars has been increasing recently.
転職してから収入が増えた。,My income has increased since I changed jobs.
汚いから、机の上をふいて下さい。,Please wipe the top of your desk because it is dirty.
雨でぬれた髪の毛をタオルでふいた。,"I wiped my hair, which was wet from the rain, with a towel."
外は強い風が吹いている。,A strong wind is blowing outside.
田中さんはフルートが吹けます。,Mr. Tanaka can play the flute.
弟は口笛を吹くのが上手だ。,My brother can play the whistle very well.
税金を含めて、三万五千円です。,"Including taxes, it's thirty-five thousand yen."
鈴木さんを含めると、全部で十人になります。,"If you include Mr. Suzuki, there will be ten people in all."
領収書にこの本の代金を含めないでください。,Please don't include the cost of this book in your receipt.
部屋代を含めずに、一日は五千円ぐらいでした。,"Not including the cost of the room, it was about five thousand yen a day."
彼女はかんで含めるように子供に説明した。,She explained to the child to include it in the kan.
この値段には消費税が含まれていますか。,Does this price include the consumption tax?
このあめには砂糖は含まれていません。,This candy does not contain any sugar.
その事件は複雑な問題を含んでいるようだ。,The case seems to involve a complicated issue.
薬を口に含んで、水で流し込んだ。,He put the medicine in his mouth and poured it down with water.
人工の添加物を含まない食品を買うようにしている。,I try to buy foods that don't contain artificial additives.
このボタンに触れると、ドアが開きます,Touch this button to open the door.
展示品に手を触れないで下さい。,Do not touch the exhibits.
その話題には触れないほうがいい。,It is better not to touch that subject.
道でその看板が目に触れた。,I saw that sign on the street.
法に触れるような行為はしたことがない。,I've never done anything against the law.
雪が降っています。,It is snowing.
雨に降られて、びしょぬれです。,It's raining and I'm soaking wet.
彼女は手を振って、さようならと言った。,She waved and said goodbye.
彼は彼女に振られて、落ち込んでいます。,He is depressed because she rejected him.
漢字にかなを振ってくれませんか。,Could you please write the kana for the kanji?
食べ過ぎて、ちょっと太ってしまいました。,I ate too much and got a little fat.
田中さんは太っています。,Tanaka-san is overweight.
これ以上太らないように、運動を始めた,I've started exercising so I won't get any fatter.
もう少し太ったほうがいいですよ。,You should get a little fatter.
彼女は太った猫を飼っている。,She has a fat cat.
もっと日本語の語彙を増やしたい。,I want to increase my Japanese vocabulary more.
学校は日本語のクラスをもう一つ増やしました。,The school has added another Japanese class.
これ以上、仕事を増やさないでください。,Please don't make more work for me.
息子はもっと小遣いを増やしてほしいと言った。,My son asked for more pocket money.
勉強の時間を増やしたほうがいい。,You should have more time to study.
頑張ってください。,Please do your best.
頑張れ。,Work hard.
彼は家族のために頑張って働いている。,He is working hard to provide for his family.
仕事は大変ですが、頑張りたいと思います。,"It's hard work, but I'll do my best."
あきらめずに、最後まで頑張ろう。,Don't give up and work hard until the end.
電話はどこにございますか。,Where is the phone?
二階にございます。,It's on the second floor.
失礼ですが、山田先生ではございませんか。,"Excuse me, but isn't this Dr. Yamada?"
はい、山田でございますが、どちら様ですか。,"Yes, I'm Yamada, who is this?"
ありがとうございます。,Thank you very much.
部屋に入ってもいいですか。どうぞお入りください,May I enter the room? Please come in.
喫茶店に入って、コーヒーでも飲みましょう。,Let's go to the coffee shop and have a cup of coffee.
時間があれば、スポーツクラブに入りたい。,"If you have time, I'd like to join the sports club."
この箱に何が入っているの。,What's in this box?
この野球場は三万人入れます。,This baseball stadium can hold thirty thousand people.
映画は何時に始まりますか。,What time does the movie start?
会議はもう始まっています。,The meeting has already started.
野球の試合は今始まったところです。,The baseball game has just started.
授業が始まる前に、先生に質問しました。,"Before the class started, I asked the teacher a question."
済んでしまった事を後悔しても始まらない。,You can't start regretting what you've already done.
勉強を始めましょう。,Let's start studying.
十時に会議を始めます。,We will begin the meeting at ten o'clock.
何から始めましょうか。,Where shall we start?
貿易の仕事を始めようと思っています。,I'm going to start working on my trade.
本を読み始めると、時間を忘れてしまう。,"When I start reading a book, I lose track of time."
体重を量りました。,I weighed myself.
寒気がするから、熱を測ってみた。,"I feel cold, so I took my temperature."
小包の重さを量っていただけませんか。,Could you please weigh the parcel?
長さを測る。,Measure the length.
平和的な解決を図るべきだ。,We should try to settle this matter peacefully.
このかばんを部屋に運んでください。,Please carry this bag to my room.
引っ越しの荷物を運ぶのを友達に手伝ってもらった。,I asked my friend to help me carry my belongings to the new house.
交通事故でけがをした人が救急車で病院へ運ばれた。,A person injured in a traffic accident was taken to the hospital by ambulance.
この大きい箱は一人で運べそうもない。,I don't think I can carry this big box by myself.
姉と買い物に行って、重い荷物を運ばされた。,I went shopping with my sister and she made me carry a heavy load.
今日、彼女は新しいスニーカーを履いています。,"Today, she is wearing a new pair of sneakers."
この靴を履いてみてもいいですか。,Can I try on these shoes?
気分が悪くて、吐いてしまいました。,I felt sick and threw up.
息を吸って、ゆっくり吐いてください。,Please breathe in and breathe out slowly.
床をほうきで掃いた。,I swept the floor with a broom.
ジョンは日本語が話せます。,John can speak Japanese.
すみませんが、もう少しゆっくり話していただけませんか。,"I'm sorry, but could you please speak a little more slowly?"
山田さんとは話したことがありません。,I've never talked to Mr. Yamada before.
ごめんなさい。今仕事で手が離せません。,I'm sorry. I'm busy with work.
この公園で犬を放してはいけません。,You can't let your dog loose in this park.
毎月、月末に家賃を払います。,I pay my rent at the end of every month.
カードで払ってもいいですか。,Can I pay by credit card?
この店の代金は私に払わせてください。,Please let me pay for this store.
そんな高いお金、とても私には払えない。,I can't afford to pay such a high price.
運転する時、歩行者に注意を払うように。,Pay attention to pedestrians when you drive.
たぶん明日は晴れるでしょう。,It will probably be sunny tomorrow.
午後は晴れたり曇ったりでした,It was sunny and cloudy this afternoon.
霧が晴れそうです。,The fog is going to clear.
彼は殺人の容疑が晴れた。,He was cleared of murder.
けがをした足首が腫れている。,The injured ankle is swollen.
封筒に切手をはった。,I put a stamp on the envelope.
壁にポスターがはってある。,There are posters on the wall.
私たちは河原でテントを張った。,We pitched our tent on the riverbank.
ベランダにロープを張って、洗濯物を干した。,I hung a rope on the balcony to dry the laundry.
公園の池に氷が張っている。,The pond in the park was covered with ice.
時間がなかったから、駅まで走りました。,"We didn't have much time, so we ran to the station."
廊下を走るな。,Don't run in the corridor.
足が痛くて、走れない。,"My feet hurt, I can't run."
学生の時、よく先生に校庭を走らされた。,"When I was a student, my teacher used to make me run in the schoolyard."
駅からその競技場までバスが走っています。,There is a bus that runs from the station to that stadium.
田中さんは九時から五時まで働きます。,Mr. Tanaka works from nine o'clock until five o'clock.
鈴木さんは貿易会社で働いています。,Mr. Suzuki works at a trading company.
彼は働きながら大学を出た。,He graduated from college while working.
今日はどうも頭が働かない。,I can't seem to get my head around it today.
彼らは銀行強盗を働いて、逮捕された。,They were arrested for robbing a bank.
今どんなファッションがはやっていますか。,What kind of fashion is popular now?
黒い服が、はやっています。,Black clothes are very popular.
その歌は、二十年ぐらい前にとてもはやった。,That song was very popular about twenty years ago.
今年の冬はインフルエンザがはやるそうだ。,I heard that the flu is going to be popular this winter.
あのレストランは、とてもはやっています。,That restaurant is very popular.
