Sentences,Translation
これは私の 妹 の写真です。,This is a picture of my little sister.
ディズニーランドに行きたいです。,I want to go to Disneyland.
それは私のではありません。,That is not mine.
今日は仕事に行きました。,I went to work today.
これを読んでください。,Please read this.
このゲームは君の勝ちだ。,You are the winner in this game.
これが読みたかった本です。,This is the book I wanted to read.
足が痛くて、歩けない。,My feet hurt so I can’t walk.
妻とビーチに行きました。,I went to the beach with my wife.
お荷物は明日お届けします。,We will deliver your package tomorrow.
これも明日までの宿題だ。,This homework is also due tomorrow.
あの公園で会いましょう。,Let’s meet at the park.
赤ちゃんが鳥を見てる。,The baby is looking at the bird.
ずっと音楽が鳴っている。,The music is still playing.
これが私の家です。,This is my house.
ふつうに使われる交通機関は電車です。,The transportation normally used is the train.
これが、マカロンというお菓子です。,This is a confectionary called a macaron.
通な人が好む店だ。,This is a shop that connoisseurs are fond of.
お話ししたい事があります。,I have a matter that I would like to talk about.
ええ、私もそう思います。,"Yes, I think so too."
えー、うそでしょ。,"What? Surely, that’s a lie!"
みんなが違う事を言う。,Everyone says something different.
あの、すみませんが、バス停への道を教えてください。,"Er, excuse me. Please show me the way to the bus stop."
これでまあいいと思うよ。,I think this is just fine.
まー、 すごい!,Wow! That’s great!
土曜日にコンサートがある。,There is a concert this Saturday.
このバッグはあなたのですよね。,"This is your bag, isn’t it?"
その映画には興味がないです。,I am not interested in that movie.
大きくなったら、何になる。,What are you going to be when you grow up?
この電車はどこに行きますか。,Where does this train go?
その本はもう読みました。,I have already read that book.
何度も聞いたけれど、よくわかりません。,"I have asked many times, but I still don’t understand."
駅から学校まではどのくらいかかりますか。,How long does it take to get to the school from the station?
お昼ごはんを食べよう。,Let’s eat lunch.
それはいいアイディアではないと思う。,I don’t think that’s a good idea.
重い物は棚の上に置かないでください。,Please do not put heavy objects on the shelf.
そうですよね。,"Yes, that’s so right, isn’t it?"
これは何の料理ですか。,What dish is this?
私は日本語の教師です。,I am a Japanese teacher.
この作業は早く終わらせてしまうほうがいい。,It is best that we finish up this task quickly.
それをここに持ってきてもらえますか,Can you please bring that here?
牛乳やバターとかは後で買おう。,Let’s get things like milk and butter later. 
このお店に入りましょう。,Let’s go into this store.
その書類はこのオフィスには無いです。,The document is not in this office.
このプロジェクトがいい方向に行くといいね。,I hope this project goes in the right direction.
本当のことを言うと、その花瓶は私が壊したんだ。,"To tell you the truth, I broke the vase."
この法 律は１９世紀に作られたのだ。,This law was made in the 19th century.
このゴミは彼に片付けさせるつもりです。,I will make him clean up this mess.
どうぞ、これをお持ちください。,Please take this with you.
もう夏休みは終わりです。,The summer break is already over.
新消費税率は１０%である。,The new consumption tax rate is 10%.
景気のいい時は、よく物が売れる。,Goods sell well when the economy is good.
この映画はつまらないな。,This movie is so boring.
文句を言わずにいられない。,I cannot stand by without complaining.
値段が高かったので、買うのをやめた。,I did not buy it because it was expensive.
金曜日はレストランが混むんで、土曜日に行こう。,"Since the restaurant will be crowded on Friday, let’s go on Saturday."
世界には多くの人がいます。,There are a lot of people in the world.
急いだほうがいいよ。,We’d better hurry up.
その算数の問題はこうすると解けるよ。,The math problem can be solved like this.
このプロジェクトが終われば、休みが取れます。,"When this project is over, I can go on a vacation."
赤や黄色の花が咲いている。,Red and yellow flowers are in bloom.
もうすぐ春が来る。,Spring is coming soon.
シフトは５時までです。,My shift is till 5 o’clock.
よく見ると、小さな穴があるね。,"If you look closely, there is a small hole."
歌ったり、踊ったりするのが好きです。,I like doing things like singing and dancing.
今はまだお腹が空いていない。,I am not hungry now.
この前の試験で良い成績をとりました。,I got a good score on the recent exam.
いいレストランを知っています。,I know a nice restaurant.
住むのに一番便利な所はどこですか。,Where is the most convenient place to live?
自分の問題は自分で解決しなさい。,Solve your own problems yourself.
んー、よくわかりません。,"Hmm, I am not so sure."
あー、危ない。,"Oh, look out."
やはり、私も同じ気持ちです。,"After all, I feel the same way."
やっぱり、あなたが思った通りになりましたね。,"After all, it turned out exactly as you expected."
私も一 緒に行きたいです。,I want to go with you.
そのゲームをやると楽しいでしょうね。,It would be fun to play that game.
早く家の中に入りなさい。,Come inside the house quickly.
ドアの向こうにいるのは誰。,Who is behind the door?
テニスが出来るようになるためには練習が必要だ。,Practice is necessary to be able to play tennis.
そのお店には食器や家具などがあります。,"That store has tableware, furniture, and so on."
私は親として責任があります。,I am responsible as a parent.
この後、日本語のレッスンに行きます。,"After this, I will go to a Japanese lesson."
また会いましょう。,See you again.
ちょっと話しましょう。,Let’s have a little talk.
買い物に行ってくる。,I’m going shopping.
自分の荷物だけ持ってください。,Please hold only your own luggage.
おこずかいは五千円くらいほしい。,I want about five thousand yen for pocket money.
自分の弁当ぐらいは自分で作らないといけない。,You should at least prepare your own lunch.
私は店員ではない。,I am not a staff member.
えーと、今度の母の日のプレゼントは何にしようかな。,"Well, what present should I get for Mother's Day?"
こっちの方にきてください。,Please come this way.
歩いていくならスニーカーを履きましょう。,"If we’re going to walk there, let’s wear sneakers."
明日はどのバッグを持ってくの。,Which bag are you going to take there tomorrow?
けんかになった訳は何なの。,What was the reason for the fight?
先生へ手紙を書こう。,Write a letter to the teacher.
このお店はどうですか。,How about this store?
わたしは宿題もやったし、庭の掃除もした。,I did my homework and cleaned the garden.
その話は本当ですか。,Is the story true?
私はいつも右手でペンを持つ。,I always hold my pen in my right hand.
午前中にホテルを出る。,I will leave the hotel in the morning.
私は健康の為に野菜を食べます。,I eat vegetables for my health.
サーカスのアクロバットはすごい。,The circus acrobatics are amazing.
自分の未来について考える。,I think about my future.
そこの看板には何と書いてありますか。,What is written on the signboard there?
映画を観に行こう。,Let’s go see a movie.
あなたの気持ちは分かる。,I understand your feelings.
私は子供に柔道を教えております。,I am teaching judo to children.
日本の歴史について知りたいです。,I want to learn about Japanese history.
この町は子供が多い。それで児童館が作られました。,"This town has many children. Because of that, they opened a children’s center."
東の入り口からビルに入る。,Enter the building from the east entrance.
学校で宇宙基地の模型を作る。,We make a model of a space base at school.
新しいレシピでカレーを作ってみる。,I am going to try making curry with a new recipe.
車でラジオを聴く。,I listen to the radio in the car.
駅で行き先を聞く。,I will ask for directions at the station.
私は留学をしました。そして外交官になりました。,"I studied abroad, and then became a diplomat."
このストーリータイムはぬり絵をくれる。,You will be given a coloring sheet at this story time.
咳がでる場合はマスクをしてください。,"In case you have a cough, please wear a mask."
彼からおもしろい話を聞いた。,I heard an interesting story from him.
車を運転しながら携帯を見てはいけない。,You mustn’t use a cell phone while driving.
私はそんなケースを聞いたことがない。,I have never heard of such a case.
今日は新しいカードを使う。,I am using a new card today.
日本は島国です。,Japan is an island nation.
これは関東風のうどんです。,This is Kanto style udon.
おー、一 番だ!,"Wow, I came first!"
家の前に車をとめる。,Park your car in front of the house.
入り口はどこですか。,Where is the entrance?
五人が夕食の席に一緒に座りました。,Five people sat together at the dinner table.
今の会社を去ることにした。,I have decided to leave the company.
放課後に塾に通っています。,I go to a cram school after my regular school.
質問事項をまとめる。,Summarize the items being questioned.
太陽は西に沈む。,The sun sets in the west.
バスツアーで奈良に行きます。,We are going on a bus tour to Nara.
客室を整える。,Prepare the guest room.
手術後の経過はどうですか。,How is his progress after the surgery?
日記の代わりに詩を書く。,I write poems instead of a daily journal.
彼は掃除が下手だ。,He is poor at cleaning.
世界中の人々と友達になりたい。,I want to make friends with people from around the world.
また家の鍵を無くしてしまった。,I lost my house key again.
昔の友達を訪ねる。,I am visiting my old friends.
ゴルフのコースを回る。,Go around the golf course.
迷子になっても彼は平気だった。,"Even when he was lost, he looked unconcerned."
宛先の住所を教えてください。,Please provide your mailing address.
テーマパークのスタッフが忙しそうにしている。,The theme park’s staff seem to be busy.
いわば、これが私たちの集大成です。,"This is our crowning achievement, so to speak."
風呂の湯を満たす。,Fill the bathtub with warm water.
輸入品店を始めたい。,I want to start an imported goods store.
税金に関する相談は会計士に連絡する。,Contact your accountant concerning your taxes.
かえって物事を悪くした。,"In turn, it made things worse."
仮の家に住む。,I am living in temporary housing.
おばあさんが生け花をなさる。,The elderly lady is making a flower arrangement.
彼 女はうっかりお皿を壊した。,She accidentally broke the dishes.
夏休みはどこかに行きますか。,Are you going anywhere for summer vacation?
レストランでメニューを見る。,Look at the menu at the restaurant.
女性は成人式に着物を着ます。,Girls wear kimono for the coming of age ceremony.
市場は毎朝五時に開きます。,The market opens at five o’clock in the morning.
彼はこの大学の学生だ。,He is a student at this university.
私は大阪に住んでいます。,I live in 	Osaka.
好きなスポーツはテニスです。,My favorite sport is tennis.
昨日、彼を見ましたか。,Did you see him yesterday?
彼は毎晩ビールを飲む。,He drinks beer every night.
僕は英語が苦手だ。,I’m not good at English.
こちらが私の妻です。,This is my wife.
お金がなくて、海外旅行できない。,I don’t have money so I can’t travel abroad.
彼とレストランへ行った。,I went to a restaurant with my boyfriend.
来週京都へ行きます。,I will go to Kyoto next week.
彼が行くなら、私も行きます。,"If he is going, I will go too."
東京駅で彼女に会った。,I met her at Tokyo station.
雨が降っている。,It’s raining.
彼は独身です。,He is single.
日本で使われている通貨は円です。,The currency used in Japan is yen.
太郎という男の子を知っていますか。,Do you know a boy called Taro?
今年はいろいろな事があった。,All kinds of things happened this year.
あの人は、えー、ちょっと名前が思い出せません。 ,"That person, uh, I can't remember his name for a moment. "
はっきり言うと、あなたの言っていることは無意味です。 ,"Frankly speaking, you are talking nonsense."
どうしたんですか。, What’s the matter?
あの、ちょっとお聞きしたいんですが、バス乗り場はどこですか。,"Excuse me, could you tell me where the bus stop is?"
仕事をしなければなりません。,I have to do my work.
まー、なんて素晴らしいんでしょう。,Wow! That’s amazing!
彼が言ったのは本当だ。,What he said is true.
彼の報告書は問題がある。,His report has some problems.
いい天気ですね。,"It’s a nice day, isn’t it?"
彼は朝ごはんを食べない。,He doesn’t have breakfast.
彼は金持ちになるでしょう。,He will become rich.
コーヒーか紅茶はいかがですか。,Would you like some coffee or tea?
そのカバンを取ってくれませんか。,Can you pass me that bag?
このアパートはあまり良くないけれど安い。,"This apartment is cheap, though it’s not so nice."
ここからその店までは遠い。,The shop is a long way from here.
一緒に映画を見よう。,Let's watch a movie together.
私はそう思いません。,I don’t think so.
で、あの話はどうなりましたか。,So what happened about the story you mentioned?
誰か来たようだ。,It seems that someone has come.
いい天気だが、風が冷たい。,It’s a sunny day but the wind is chilly.
そんなに高い物は買えません。,I can’t buy such expensive stuff.
私もそう思います。,I think so too.
何を考えているんですか?,What are you thinking?
お酒を飲みすぎると、眠くなってしまう。,Drinking too much makes me sleepy.
私は寿司が好きです。,I like sushi.
ダイエット中なのに、つい、甘いものを食べてしまう。,"I’m on a diet, but I can’t stop eating sweets."
それは明子さんのカバンですか。,Is that Akiko’s bag?
ケーキとかチョコレートばかり食べるから、君は太るんだ。,"You gain weight, because you always eat cake and chocolate"
,
,
,
,
,
彼は五時ごろ戻ります。,He’ll be back around five o’clock.
お弁当を買いに行く。,I’m going to get a lunch box.
私はその方達に大変感謝しています。,I am very grateful to those people.
彼女から久しぶりに電話が来た。,I had a call from her for the first time in a long time.
警察官を見たとたん、彼は逃げ出した。,As soon as he saw the policeman he ran away.
世界経済は回復するのに数年を要します。,The global economy will need several years to recover.
その橋は幅が二十メートルある。,The bridge is twenty meters in width.
そのホテルの周辺にはたくさんの店やレストランがある。,The area around the hotel has many shops and restaurants.
十一月十日までにお返事をください。,Please respond by November 10.
その国への入国はビザの取得が必要です。,You need to acquire a visa to enter the country.
若い人には新しいことに挑戦してほしい。,I want young people to try new things.
子供達はもう独立していて、主人と二人で暮ら している。,"My children are already independent and I live with my husband, just the two of us."
私より妻のほうが収入が多い。,My wife’s income is more than mine.
やったぜ!,I made it!
この製品はまだ市場には出ていない。,This product is not on the market yet.
母はいつも家で着物を着ている。,My mother always wears a kimono at home.
メニューを見せてください。,Can I see the menu?
息子は夏休みを楽しみにしている。,My son is looking forward to the summer holidays.
 友達の時計を壊してしまった。,I broke my friend’s watch.
デザートは何になさいますか。,What would you like for dessert?
これは仮のタイトルです。,This is a provisional title.
タクシーで行ったらかえって時間がかかってしまった。,I went by taxi but on the contrary it took longer.
当社の製品に関するお問い合わせはメールにて受け付けております。,"For all questions related to our products, feel free to email us."
日本はブラジルからコーヒーを輸入している。,Japan imports coffee from Brazil.
応募者は次の条件を満たしていることが必要です。,The applicant must satisfy the following requirements.
彼はいわば日本のエジソンだ。,"He is a Japanese Edison, as it were."
スタッフをもっと募集しなければならない。, We need to recruit more staff.
住所をいただけますか。,Could you give us your address?
平気なふりをした。,I pretended to be fine.
この音楽学校には子供のためのコースもある。,This music school has a course for kids too.
このツアーでは、京都のお寺や神社を訪ねます。,"On this tour, you visit temples and shrines in Kyoto."
部屋に鍵を忘れてしまった。,I left my key in my room.
彼女は飛行機で世界中を旅行した。,She traveled all over the world by air.
彼は野球が下手だ。,He is not good at baseball.
彼は多くの詩を書いた。,He wrote a lot of poems.
試合開始から十分が経過しました。,Ten minutes have passed since the game started.
次の試合に向けてコンディションを整えておかなければ。,I have to prepare my physical condition for the next match.
スキーツアーに参加したいんですが。,I’d like to join the ski tour.
その町は東京の西にある。,The town is located in west Tokyo.
審議事項は以上です。,That’s all the items we have to discuss. 
彼は一週間に四日塾に通っている。,He goes to a cram school four days a week.
彼は六十歳でこの世を去った。,He passed away at the age of sixty.
私の学校には外国人の先生が五人いる。,There are five foreign teachers at my school.
ビルの入り口の前で待っていてください。,Please wait for me at the entrance of the building.
後ほど改めてお電話いたします。,I will call you back later.
日本には四十三の県がある。,There are forty-three prefectures in Japan.
デートを断られてしまった。,I got turned down for a date.
,
七時にテーブルを予約したいのですが。,I would like to reserve a table at 7:00 pm.
二人用のテーブルをお願いします。,I would like a table for two please.
予約しました。,Reservation made.
予約していません。,I have no reservation.
レストランは何時からオープンですか。,What time does the restaurant open?
レストランは何時までですか。,What are the hours of the restaurant?
ご予約ですか。,Do you have a reservation?
喫煙席と禁煙席、どちらになさいますか。,Do you prefer smoking or non-smoking seats?
喫煙席をお願いします。,Smoking seats please.
禁煙席をお願いします。,Non-smoking seats please.
このテーブルは予約済みです。,This table is reserved.
１５分お待ちいただくとテーブルが空きます。,Please wait 15 minutes and a table will be available.
お待ちになりますか。,Would you like to wait?
テーブルが空くまで待ちたいのですが。,I would like to wait until a table is available.
長く待ちますか。,Do you want to wait longer?
この席 、空いてますか。,Is this seat taken?
ここに座わってもいいですか。,May I sit here?
あそこに座わってもいいですか。,May I sit over there?
窓ぎわに座わってもいいですか。,May I sit by the window?
子供用の椅子がありますか。,Is there a chair for children?
椅子もう一個ありますか。,Do you have another chair?
すみませんが 、このびんを暖めてくれますか。,"Excuse me, can you please warm up this bottle?"
熱過ぎないようにお願いします。,"Not too hot, please."
ベビールームありますか。,Is there a baby room available?
トイレはどこですか。,Where is the restroom?
,
,
,
,
,
,
,
,
,
,
わたしは夏の間、ずっと北海道にいました。,I was in Hokkaido all summer.
両親が旅行をしている間、ぼくが毎日食事を作りました。,"While my parents were traveling, I cooked meals every day."
夏休みの間に引っ越ししたいです。,I would like to move during the summer vacation.
日本にいる間に1度富士山に登りたい。,I want to climb Mt. Fuji once while in Japan.
暇な間に本だなをかたづけてしまおう。,Let's put away the books in our spare time.
この問題については、長時間にわたる議論のあげく、結論は先送りされた。,"After a lengthy discussion on this issue, a conclusion was postponed."
先生の受賞のお祝いに何かさしあげましょうよ。,Let's give him something to celebrate his award.
わたしの旅行中、花に水をやるのを忘れないでね。,Don't forget to water the flowers during my trip.
愛あっての結婚生活だ。愛がなければ、いっしょに暮らす意味がない。,"Marriage is about love. Without love, there is no point in living together."
交渉は相手あってのことですから、自分の都合だけ主張してもうまくいかない。,"Negotiations are based on the other party, so if you insist only on your own convenience, it will not work."
食事の後で、少し散歩しませんか。,"After dinner, why don't we take a short walk?"
祭りの後、ごみがいっぱいだった。,"After the festival, there was a lot of garbage."
この薬はご飯を食べる前に飲みますか、食べた後で飲みますか。,Do you take this medicine before or after eating?
合格の知らせを聞いて、彼女はうれしさのあまり泣き出した。,"When she heard the news of her acceptance, she began to cry with happiness."
試験の問題は易しかったのに、考えすぎたあまり、間違えてしまった。,"The questions on the exam were easy, but I thought too much and made mistakes."
今年の夏はあまりの暑さに食欲もなくなってしまった。 ,This summer was so hot that I lost my appetite.
今のわたしの仕事はきつい。あまりの大変さに時々会社を辞めたくなる。,My current job is hard. Sometimes I feel like quitting the company because it is so hard.
商品の説明のし方いかんで、売れ行きに大きく差が出てきてしまう。,The way a product is explained can make a big difference in sales.
今度の事件をどう扱うかは校長の考え方いかんです。,It is up to the principal to decide how to handle the current incident.
国の援助のいかんによって、高齢者や身体障害者の暮らし方が変わると思う。,I believe that the way of life of the elderly and physically disabled will change depending on how the government helps them.
君の今学期の出席率いかんでは、進級できないかもしれないよ。,"Depending on your attendance rate this semester, you may not be able to advance."
本の売れ行きいかんでは、すぐに増刷ということもあるでしょう。,"Depending on how well the book sells, there may be an immediate need for additional printings."
出港は午後3時だが、天候のいかんによっては、出発が遅れることもある。,"Departure is at 3:00 p.m., but may be delayed depending on weather conditions."
調査の結果いかんにかかわらず、かならず連絡してください。,"Regardless of the outcome of the investigation, you must contact us."
この区では、場所のいかんにかかわらず路上喫煙は禁止です。,"In this ward, smoking on the street is prohibited regardless of location."
