Script,Translation
"Ⓐ : お久しぶりですね。相変わらずお元気そうですね。  <br>Ⓑ : ありがとう。あなたも変わらないね。どうしてるの？  <br>Ⓐ : まあ、いろいろあってね。どうしても海外に行きたくてけっきょく英語の勉強を始めたんだ。  <br>Ⓑ: ええ、それはすごいね。どこに行きたいの？  <br>Ⓐ : もちろんフランスだよ。もしかしたら来年には行けるかもしれない。  <br>Ⓑ : なるほど、フランスか。私も一度行ってみたいな。 <br>Ⓑ : せっかく英語を勉強してるんだから、イギリスとかアメリカとかも行ってみたら？  <br>Ⓐ : とにかくフランスが一番好きなんだよ。とりあえずフランスに行ってから考えるよ。  <br>Ⓑ : わざわざ英語を勉強する必要はないんじゃない？フランス語の方が役に立つんじゃない？  <br>Ⓐ : やはり英語は世界共通語だからね。やっぱり英語ができると便利だと思うよ。  <br>Ⓑ : 必ずそうとは限らないけどね。でも、あなたならきっとできるよ。  <br>Ⓐ : ありがとう。ぜひ一緒に行こうよ。  <br>Ⓑ : 確かにそれは楽しそうだね。でも、絶対に無理だよ。私は仕事が忙しすぎるんだ。","Ⓐ : Long time no see. You look well as always.  <br>Ⓑ : Thank you. You haven’t changed either. How are you doing?  <br>Ⓐ : Well, a lot of things happened. I really wanted to go abroad, so I finally started studying English.  <br>Ⓑ : Wow, that’s amazing. Where do you want to go?  <br>Ⓐ : Of course, France. Maybe I can go there next year.  <br>Ⓑ : I see, France. I also want to go there once.  <br>Ⓑ : Since you are studying English, why don’t you also go to places like England or America?  <br>Ⓐ : Anyway, France is my favorite. I’ll think about it after I go to France.  <br>Ⓑ : Do you really need to bother studying English? Wouldn’t French be more useful?  <br>Ⓐ : After all, English is the world language. I think it’s convenient to be able to speak English.  <br>Ⓑ : That’s not necessarily always the case. But, I’m sure you can do it.  <br>Ⓐ : Thank you. Let’s go together.  <br>Ⓑ : That sounds fun indeed. But, it’s absolutely impossible. I’m too busy with work."
"Ⓐ : 今日は涼しいね。散歩に行こうよ。  <br>Ⓑ : いいね。どこに行く？  <br>Ⓐ : 小高い山に行ってみたいな。景色がきれいだって聞いたんだ。  <br>Ⓑ : そうなの？じゃあ、行ってみようか。  <br>Ⓐ : でも、難しい道だから、用心深く歩かなきゃ。  <br>Ⓑ : 大丈夫。私は素早くて上手いから。  <br>Ⓐ : ふふ、自信があるんだね。私は心細いから、手をつないでね。  <br>Ⓑ : もちろん。優しいから、寂しい思いをさせないよ。  <br>Ⓐ : ありがとう。でも、寒くなったら、冷たくなるかもしれないよ。  <br>Ⓑ : そんなことないよ。厚いコートを持ってきたから。  <br>Ⓐ : ええ、それは思いがけない。せっかくだから、一緒に着ようよ。  <br>Ⓑ : えっ、それは緩すぎるよ。酷い冗談だよ。  <br>Ⓐ : そうかな。とにかく、楽しみにしてるよ。  <br>Ⓑ : 私もだよ。とりあえず、出かけようか。  <br>Ⓐ : うん、行こう。わざわざ来てくれてありがとう。  <br>Ⓑ : どういたしまして。相変わらず礼儀正しいね。  <br>Ⓐ : そう言われると嬉しいよ。詳しいことは言わないけど、尊い人だと思ってるんだ。  <br>Ⓑ : 本当？それは嬉しいな。やはり君は深い人だね。  <br>Ⓐ : でも、辛抱強くならなきゃ。どうしても山に行きたかったんだ。  <br>Ⓑ : やっぱりそうだったの？絶対に楽しませてあげるよ。  <br>Ⓐ : ありがとう。けっきょく君は下らないやつじゃなかったね。  <br>Ⓑ : 確かにそうだよ。ぜひ信じてほしいな。
","Ⓐ : It’s cool today. Let’s go for a walk.  <br>Ⓑ : Sure. Where do you want to go?  <br>Ⓐ : I want to go to a small mountain. I heard the view is beautiful.  <br>Ⓑ : Really? Then, let’s go and see.  <br>Ⓐ : But, it’s a difficult path, so we have to walk carefully.  <br>Ⓑ : Don’t worry. I’m fast and good at it.  <br>Ⓐ : Haha, you’re confident, huh? I’m feeling insecure, so hold my hand.  <br>Ⓑ : Of course. I’m kind, so I won’t make you feel lonely.  <br>Ⓐ : Thank you. But, if it gets cold, you might become cold too.  <br>Ⓑ : No way. I brought a thick coat.  <br>Ⓐ : Wow, that’s unexpected. Since we have it, let’s wear it together.  <br>Ⓑ : What, that’s too loose. That’s a cruel joke.  <br>Ⓐ : You think so? Anyway, I’m looking forward to it.  <br>Ⓑ : Me too. For now, let’s go out.  <br>Ⓐ : Yeah, let’s go. Thank you for coming all the way here.  <br>Ⓑ : You’re welcome. You’re polite as always.  <br>Ⓐ : I’m happy to hear that. I won’t say the details, but I think you’re a precious person.  <br>Ⓑ : Really? That makes me happy. After all, you’re a deep person.  <br>Ⓐ : But, I have to be patient. I really wanted to go to the mountain.  <br>Ⓑ : Is that so? I’ll definitely make you enjoy it.  <br>Ⓐ : Thank you. After all, you weren’t a worthless guy. <br>Ⓑ : That’s true. I hope you believe me."
"Ⓐ : こんにちは。今日はどうされましたか？  <br>Ⓑ : あの、お腹が痛くて、猛烈に吐き気がするんです。  <br>Ⓐ : それは気の毒ですね。いつからその症状が出ましたか？  <br>Ⓑ : 今朝からです。昨日は裕福な友人の盛大なパーティーに行って、色々なものを食べました。  <br>Ⓐ : なるほど。不潔な食べ物を食べた可能性がありますね。速やかに診察室に入ってください。  <br>Ⓑ : はい、ありがとうございます。簡易な検査をしてもらえますか？  <br>Ⓐ : もちろんです。入念に調べて、原因を見つけましょう。  <br>Ⓑ : よろしくお願いします。滑らかなお茶でも飲みたいです。  <br>Ⓐ : それは無理ですよ。無数の細菌がお茶に入っているかもしれませんから。  <br>Ⓑ : そうですか。一般的には、お茶は胃にいいと言われていますが。  <br>Ⓐ : そうですが、単一の飲み物だけでは効果がありません。密接な関係にある薬も必要です。  <br>Ⓑ : そうなんですね。単純な問題だと思っていましたが、重大なことなんですね。  <br>Ⓐ : そうとも限りませんが、強引に無視するのは危険ですよ。スムーズに治すためには、執拗に治療を受けなければなりません。  <br>Ⓑ : そうですね。可哀想なことに、仕事を休まなければならないかもしれませんね。  <br>Ⓐ : それは確かに残念ですが、健康が第一ですよ。主要な仕事を他の人に任せてください。 <br>Ⓑ: そうします。不当な迷惑をかけてすみません。  <br>Ⓐ : 大丈夫ですよ。怪訝な顔をしないでください。円満な回復を祈っています。","Ⓐ : Hello. What’s wrong with you today?  <br>Ⓑ : Well, I have a stomach ache and a fierce nausea.  <br>Ⓐ : That’s unfortunate. How long have you had these symptoms?  <br>Ⓑ : Since this morning. Yesterday, I went to a grand party of my wealthy friend and ate various things.  <br>Ⓐ : I see. You might have eaten unhygienic food. Please enter the examination room quickly.  <br>Ⓑ : Yes, thank you. Can you do a simple test for me?  <br>Ⓐ : Of course. I’ll check you thoroughly and find the cause.  <br>Ⓑ : Thank you very much. I want to drink some smooth tea.  <br>Ⓐ : That’s impossible. There might be countless bacteria in the tea.  <br>Ⓑ : Is that so? Generally, tea is said to be good for the stomach.  <br>Ⓐ : That’s true, but a single drink is not enough. You also need medicine that is closely related.  <br>Ⓑ : I see. I thought it was a simple problem, but it’s a serious thing.  <br>Ⓐ : Not necessarily, but it’s dangerous to ignore it forcefully. To cure it smoothly, you have to receive treatment persistently.  <br>Ⓑ : That’s right. Poor thing, I might have to take a break from work.  <br>Ⓐ : That’s certainly regrettable, but health comes first. Please leave the major work to someone else.  <br>Ⓑ : I will. I’m sorry for causing unfair trouble.  <br>Ⓐ : It’s okay. Don’t make a puzzled face. I hope you recover peacefully."
"Ⓐ : 今日は何をしようかな。著名な観光地に行ってみたいな。  <br>Ⓑ : それはいいね。でも、適度に休憩も取らないとね。  <br>Ⓐ : そうだね。端的に言って、疲れてるんだよ。  <br>Ⓑ : じゃあ、明確に計画を立てようよ。具体的に何が見たいの？  <br>Ⓐ : 熱心に歴史に興味があるから、量的に多くの古い建物や博物館があるところがいいな。  <br>Ⓑ : そうなの？じゃあ、特殊な場所を教えてあげるよ。重要な歴史的遺産があるんだ。  <br>Ⓐ : 本当？どこなの？  <br>Ⓑ : 真っ赤な門があるところだよ。惨めな戦争の記念碑もあるんだ。  <br>Ⓐ : それは不可解だね。どうして真っ赤なの？  <br>Ⓑ : 華やかな色彩が好きだったからだと思うよ。大丈夫、淫らな意味はないよ。 <br>Ⓐ : そうか。透明なガラスの建物もあるんだろうか？  <br>Ⓑ : あるよ。偉大な芸術家が作ったんだ。周到に設計されてるよ。  <br>Ⓐ : それは見たいな。残念ながら、時間があまりないんだけどね。  <br>Ⓑ : 大まかに見ればいいよ。盛んに写真を撮って、思い出にしようよ。  <br>Ⓐ : そうしよう。一様に楽しめるといいね。  <br>Ⓑ : そうだね。円滑に移動できるといいけどね。  <br>Ⓐ : 頑固な渋滞にはまらないといいね。  <br>Ⓑ : そうだね。遥かな距離を早く走れるといいね。","Ⓐ : What should we do today? I want to go to a famous tourist spot.  <br>Ⓑ : That’s nice. But, we have to take a moderate break too.  <br>Ⓐ : You’re right. To put it bluntly, I’m tired.  <br>Ⓑ : Then, let’s make a clear plan. What do you want to see specifically?  <br>Ⓐ : I’m interested in history passionately, so I want to go to a place where there are many old buildings and museums quantitatively.  <br>Ⓑ : Is that so? Then, I’ll tell you a special place. There is an important historical heritage there.  <br>Ⓐ : Really? Where is it?  <br>Ⓑ : It’s the place where there is a bright red gate. There is also a monument of a miserable war.  <br>Ⓐ : That’s incomprehensible. Why is it bright red?  <br>Ⓑ : I think they liked the gorgeous colors. Don’t worry, it doesn’t have a lewd meaning.  <br>Ⓐ : I see. Is there also a transparent glass building?  <br>Ⓑ : There is. It was made by a great artist. It’s designed carefully.  <br>Ⓐ : I want to see that. Unfortunately, I don’t have much time though.  <br>Ⓑ : You can see it roughly. Let’s take pictures actively and make memories.  <br>Ⓐ : Let’s do that. I hope we can enjoy it uniformly.  <br>Ⓑ : Me too. I hope we can move smoothly.  <br>Ⓐ : I hope we don’t get stuck in a stubborn traffic jam.  <br>Ⓑ : Me too. I wish we could run fast over a far distance."
"Ⓐ : 今日は仕事が苛酷だったよ。暢気に遊んでる暇なんてなかったよ。  <br>Ⓑ : それは大変だね。私は積極的に休憩を取って、当たり前のことを楽しんだよ。  <br>Ⓐ : そうなの？どんなことをしたの？  <br>Ⓑ : 厳格な上司に挨拶したり、旺盛な食欲を満たしたり、控えめな笑顔を見せたりしたよ。  <br>Ⓐ : それは安楽な生活だね。私は緊密なスケジュールに追われて、高度な技術を求められたよ。  <br>Ⓑ : それは大変だね。曖昧な指示もあったでしょ？  <br>Ⓐ : そうだよ。大幅に変更されることもあったよ。不可欠な仕事だから仕方ないけどね。  <br>Ⓑ : そうだね。でも、裏腹にも、悪質な評価を受けることもあるんでしょ？  <br>Ⓐ : そうなんだよ。忠実に働いてるのに、認められないんだよ。  <br>Ⓑ : それは残念だね。柔らかい言葉で慰めてあげたいけど、様々な問題があるから難しいね。  <br>Ⓐ : そうだね。でも、大好きな人がいるから、頑張れるんだよ。  <br>Ⓑ : 本当？誰なの？  <br>Ⓐ : 愚かな質問をしないでよ。巧妙に隠してるつもりだったんだけど、バレちゃったかな？  <br>Ⓑ : そうかもね。同様の気持ちを持ってる人がいるかもしれないよ。  <br>Ⓐ : 本当？誰なの？  <br>Ⓑ : 急激に興味を示さないでよ。奇麗な顔をしてるけど、直に言えないんだよ。","Ⓐ : Work was harsh today. I didn’t have time to play carefree.  <br>Ⓑ : That’s tough. I took breaks actively and enjoyed the usual things.  <br>Ⓐ : Is that so? What did you do?  <br>Ⓑ : I greeted the strict boss, satisfied the vigorous appetite, and showed a modest smile.  <br>Ⓐ : That’s a comfortable life. I was chased by a tight schedule and demanded high skills.  <br>Ⓑ : That’s tough. You also had vague instructions, right?  <br>Ⓐ : That’s right. They also changed drastically sometimes. It can’t be helped because it’s an essential work.  <br>Ⓑ : That’s true. But, contrary to that, you also receive malicious evaluations, right?  <br>Ⓐ : That’s right. I work faithfully, but I’m not recognized.  <br>Ⓑ : That’s unfortunate. I want to comfort you with soft words, but it’s difficult because there are various problems.  <br>Ⓐ : That’s true. But, I can do my best because I have someone I love.  <br>Ⓑ : Really? Who is it?  <br>Ⓐ : Don’t ask me a foolish question. I was trying to hide it cleverly, but did you find out?  <br>Ⓑ : Maybe. There might be someone who has the same feelings as you.  <br>Ⓐ : Really? Who is it?  <br>Ⓑ : Don’t show interest suddenly. You have a beautiful face, but I can’t say it directly."
