L5,L4,L3,L2,L1
日本人ですか。,昨日東京に来たと彼は言った。,私の好みにぴったり合う。,軍隊は川のところまで進出した。,彼はタフな野郎だった。
人がいる。,僕は言語を勉強するのが好きだ。,合わせていくらになりますか。,彼は軍事予算を増大させようとした。,家の子郎党。
わたしは人間です。,言葉にできない。,天気の具合が思わしくない。,軍備が整っている。,次の曲を新郎と新婦に捧げたいと思います。
一つえらんで。,手に何をもっていますか。,その家の内部はとても魅力的だった。,その命令に嫌々従う兵もいた。,彼女は銀行員と結婚した。
一にち。,彼が私のコピーを手伝ってくれた。,値段は全部同じなんですか？,兵器にあまりお金を使うべきではない。,やってはみるが結果は約束できない。
わたしは一人じゃない。,私のところに手紙が来ていますか。,誰も部長をごまかせません。,激しい戦いが兵士によってなされた。,このバス路線は２都市を結んでいる。
日なにしましたか。,自分でピアノを弾きながら歌う。,,,
ながい一日がすぎた。,この車を自由にお使い下さい。,,,
今日なにしようかな。,私は合格する自信がある。,,,
このビルはとても大きい。,医者にかかる必要がある。,,,
わたしは大学へいきたい。,数名の食中どく患者が出た。,,,
大切なはなしがあるんです。,あなたの大好きな役者はだれですか。,,,
年はおいくつですか。,仕事に行きたくない。,,,
今年はあめがおおかった。,事故というのは起こるものだ。,,,
かれは毎年かいがいへいく。,それは一番大事なことです。,,,
ベッドから出たくない。,彼なら信用できると思っていた。,,,
ノートを出して下さい。,思考は言葉によって表現される。,,,
出口はどこですか。,我々は言語で意思を伝える。,,,
この本は四ドルした。,昔の友達に会いに行った。,,,
これが本日のおすすめりょうりです。,会計の窓口はどこですか。,,,
本棚に本をならべる。,出来るだけ早急に会談の手配をして欲しい。,,,
日本中をたびする。,ご家族はいかがですか。,,,
へやの中央にたっていた。,僕は仕事より家庭の方が大事だ。,,,
ここにむかっている途中です。,あの部屋には家具が全然なかった。,,,
子供にでもそれはできる。,抽象的な思想を具体的に述べる。,,,
女の子のようなしぐさ。,彼の答えは的確だ。,,,
男の子らしいいたずら。,彼は知的な人です。,,,
テレビ見てるのですか。,彼はどっちの方向へ行きましたか。,,,
それについてのあなたの意見はなにですか。,運転の仕方を知っているの？,,,
ほかのを見せてください。,あの人たちが昨日あなたが会った方々ですか。,,,
ポーランドは大きな国だ。,この地域は雨が続くでしょう。,,,
外国へ行ったことがありますか。,昨日遊園地でばったり先生に会ったよ。,,,
アメリカ国民になった。,君はなかなか地理に明るいな。,,,
テーブルの上にコップがある。,私はプレゼントを買う目的でデパートへ行った。,,,
バッテリーが上がってしまった。,大学に入っていることが私の人生の目標ではない。,,,
テレビのボリュームを上げないでください。,どちらを選ぶのかを決めるのはあなたの役目だ。,,,
わかりましたか。,その工場は来年から製造をはじめる。,,,
おおざっぱに分ける。,駐車場が見つからなかったんだ。,,,
そんな気分じゃなかったんだ。,広場で野球をするのはどうでしょうか。,,,
この食べものは生だ。,私は現代の音楽はあまり好きではない事を認めます。,,,
わたしたちは生きるために食べる。,彼はクラスを代表して会場に出た。,,,
どこで生まれましたか。,私たちは大阪まで交替で運転した。,,,
ピクニックに行かない。,私立の学校はどういう感じですか。,,,
旅行することがすきですか。,この本棚の辞書はすべて私用です。,,,
われわれは飛行機でニューヨークへ行った。,私見によればあの人は立派な学者です。,,,
二時間ここにいます。,相互に独立対等の関係に置かれている。,,,
バニラアイスクリームを二つ下さい。,ハンバーガーを立って食べる。,,,
二人のガールフレンドがいる。,彼女と私とでは立場が違う。,,,
本の間にしおりをはさむ。,動物に食べ物を与えないでください。,,,
お時間わかりますか。,彼女は買い物が好きだ。,,,
昼間のうちにかえっていらっしゃい。,当市では諸物価が高い。,,,
一時ボストンにすんでいた。,油田を発見する。,,,
そのしごとにはどれだけの日時がかかったのか。,田舎は空気がきれいだ。,,,
時計がはたらいている。,田に稲の苗をを植える。,,,
気に入ってます。,体温が平熱まで上がった。,,,
元気ですよ。,体育を奨励する。,,,
かれは病気だったらしい。,体積を求める。,,,
わたしには子どもが十人いる。,絶えず彼の行動に注意していた。,,,
おかねは十分にあります。,私が戻って来るまでここを動くなよ。,,,
学校は四月十日からはじまります。,人口の移動。,,,
女みたいな高いおと。　,建設会社に入社する。,,,
そんな女性を見たことがなかった。,銭湯は近所の社交場だ。,,,
このしゃしんのなかの少女はだれですか。,土曜日には出社する必要がありません。,,,
このしごとは三時間かかった。,広く知識を求める。,,,
かれらはいま三人の子供がいる。,この辺はよく知っている。,,,
これを三つください。,彼にはそうするだけの知恵がなかった。,,,
前はよくピザを食べていました。,食卓に料理を並べる。,,,
以前お会いしたことがありますか。,芸術作品を理解する。,,,
あなたの名前は何ですか。,当分の間代理を置く。,,,
クラブに入りませんか。,彼らは皆同じ制服を着ている。,,,
コーヒーを入れましょう。,彼女は彼に少しだけ同情した。,,,
彼はその学校に入学をきょかされた。,私も同様の境遇です。,,,
小さいことにこだわるな。,期待で心臓がどきどきした。,,,
この小説はあれよりずっと面白い。,あの人になら安心して金を預けられるよ。,,,
ここにもとは小学校があった。,れは心配するほどのことではない。,,,
後について行く。,彼の名前を誤って発音してしまった。,,,
すぐ後ろにいるよ。,学校は募集要項を発表した。,,,
午後はどうだった？,しばらく出発を見合わせる。,,,
これは長すぎます。,そこは作戦上重要な地点である。,,,
校長が先生の後ろから入ってきた。,この工場ではカメラを作っている。,,,
この会社の社長はだれですか。,食卓での作法を守る。,,,
彼は車の下から出てきた。,その考えのどこが新鮮なのか。,,,
その人に会ってみてください。,設備がすっかり新しくなった。,,,
下がってよろしい。,新たな緊張を必要とする。,,,
このいっけんには大いに学ぶところがあった。,彼は世界的に有名だ。,,,
学校に行きたいんです。,所帯を持っている。,,,
彼は大学に行くひつようがある。,世紀の大事件。,,,
新しい月もでてきました。,・制度の運用にあたり例外規則を設ける。,,,
今月いっぱいここにいます。,速度の遅い車を追い越した。,,,
私たちは来月日本をはなれます。,湿度が低ければ暑さもしのぎやすい。,,,
何を見ているのか。,事件の詳しい説明を聞きたい。,,,
ほんとうに何も食べるものがないの？,明るい通りを通る。,,,
なんでこんなとこで寝てるの？,建物を照明で照らし出す。,,,
明日きゃくが二人来る。,遠泳は現在の君の体力では無理だ。,,,
この国に将来があるのでしょうか。,蒸気の圧力でボイラーが破裂した。,,,
以来ずっと友人です。,日没までに仕事を終えようと努力した。,,,
コーヒーを飲みながら話しましょう。,意志に反してそれをせざるを得なかった。,,,
人と会話をする。,彼は３時間後に意識を回復した。,,,
われわれはその問題について話し合った。,彼は両親の意思に背いて結婚した。,,,
山にトンネルをとおす。,費用を出しあって会を開いた。,,,
火山がふんかした。,その機械は広く用いられている。,,,
彼は登山になれている。,この表現は今では広く使用されている。,,,
そのピアノは高い。,日本人は米を主食とする。,,,
高校が同じです,その組織は開業医が主体となっている。,,,
最高のアイディアだよ。,その地主は以前かなり裕福な暮らしをしていた。,,,
やるなら今だよ。,駅とお寺の間にバスが通っている。,,,
今朝彼女に何がおきたのですか。,自転車で通学する。,,,
今回問題になってるのは何？,この通りは交通が激しい。,,,
ペンで書いて下さい。,この文は文法的に正しい。,,,
彼はいつも読書している。,文学を志して東京に出てきた。,,,
図書館にはたくさんの本があります。,大学に学位論文を提出する。,,,
この人は目が見えなくなって五年になる。,彼は本屋をやっている。,,,
この箱にはりんごが五つ入っている。,ビルの屋上から道路を見下ろした。,,,
彼は五日にいちどここへ来ます。,ホテルに部屋を取ってある。,,,
京都にはたくさんの名所がある。,職業を身につける。,,,
このちほうの名物は何ですか。,企業の会計制度を国際化する。,,,
有名なブランドですね。,国内の商業振興をはかる。,,,
やっと金曜日ですよ。,ご注文の本を持参しました。,,,
私は現金でしはらいます。,どれでもお好きなのをお持ちください。,,,
その靴の代金を払いましたか。,患者に生命維持装置が取り付けられた。,,,
二人の男はバーで飲んでいた。,彼女のテニスは道具ばかり立派だな。,,,
彼女は昨日背の高い男の人に会いました。,道路を建設する。,,,
男性の名前は何ですか。,どの道順がいちばん早いですか。,,,
私は今は外へ出たくない。,彼は頑固な独身主義者だ。,,,
海外に旅行する。,大阪のご出身ですか。,,,
午後なら外出できます。,この箱の中身は何ですか。,,,
私は彼に四ドルをしはらった。,この辺は交通が不便だ。,,,
ベッドが四つある部屋にくらす。,材料が不足してきた。,,,
四人でえらぶゲームです。,我々の不利な点は資金不足だ。,,,
私を先にしてください。,だれが水道の蛇口を開けっ放しにしておいたのか。,,,
彼は高校の先輩です。,いかにも利口そうだ。,,,
先生が入ってきた。,メッセージは口頭で伝えられた。,,,
私と一緒に川に行かない？,海外旅行へ出かける学生が多くなってきた。,,,
私の家の近くを小川がながれている。,目方の多少に関係なく無料で配達いたします。,,,
川岸のけいかんは美しくれきしてきです。,この語には多様な意味がある。,,,
東はどの方向なの？,野菜を添える。,,,
日本の東京からきました。,遠くを眺めていたら車が一台視野に入ってきた。,,,
家の東側に大きな木がある。,彼は山で道に迷って野宿した。,,,
私の言うことをよく聞きなさい。,眠くて思考力が低下してきた。,,,
女の子が歌うのが聞こえた。,返事をする前によく考えさせてください。,,,
今日の新聞はどこ。,この書類は後の参考のために取っておいた。,,,
あなたは日本語を話しますか？,昨日両都市間のバス運行が開始された。,,,
彼は英語を少し話します。,窓は開けておいてください。,,,
彼は音楽について語った。,そのホールは一般に開放されている。,,,
学校は九時からはじまります。,生花教室は若い女性に人気がある。,,,
九つのココナッツを食べました。,このクッキーの作りかたを教えてください。,,,
来てから九日よね？,家庭教師に子供の教育を託する。,,,
私たちはよく一緒に食事するんだ。,近所で昨夜火事があった。,,,
食堂はどこですか。,うちに一番近い駅は渋谷だ。,,,
それを食べたくありません。,それは近視眼的な政策だ。,,,
しごとは八時までにはおわるだろう。,このトラックは４トン以上は積めない。,,,
うちの子は八つです。,外気は摂氏10度以下に下がった。,,,
ろじょうには小さな八百屋が出ていた。,本校生徒以外は校外に出てください。,,,
シャワーの水が出ません。,数学の問題を解く。,,,
彼はとりわけ水泳が好きです。,これは極めて深遠な問いです。,,,
水道がでています。,その問題について賛否を問うべきだ。,,,
すばらしい天気だった。,私の言った事を正確に彼に伝えて欲しい。,,,
私の弟は天才です。,君の判断は正しい。,,,
天候がかいふくするのを待つ。,君の正直な気持ちが聞きたい。,,,
その木はとても高くなった。,この写真はとてもよく撮れてる。,,,
母はこの前の木曜日からずっと病気です。,少女たちは運動の後で真っ赤な顔をしていた。,,,
並木のある歩道。,容器を真空に保つ。,,,
私は六年間英語を勉強している。,彼は僕の言ったことの意味を取り違えた。,,,
六つのちいきに分かれている。,パーティーでいろんな珍味を味わった。,,,
六日の間そのようにした。,いいにおいが味覚をそそった。,,,
この時計は一万円だった。,それは私達の知識の限界を越えている。,,,
この料理にも合う万能ワイン。,この川が二つの県の境界になっている。,,,
彼のまんがは万人向きだ。,業界を再編成する。,,,
白いドレスはありますか。,ここではお茶の無料サービスがある。,,,
告白されたことある？,人間の欲望は無限だ。,,,
彼の真っ白な家はそのとおりで最もめだつ家だ。,彼に大金をかせげと言ったって無理な注文だ。,,,
私は七時に家を出た。,雨のため参会者はごく少数だった。,,,
パターンは七つの内の一つです。,このやり方の方が危険が少ない。,,,
彼女は七人も子供がいる。,この地方には造り酒屋が少しある。,,,
このテープレコーダーは４万円しました。,海岸で日光浴をする。,,,
円高になるとゆしゅつにブレーキがかかる。,海峡を渡る。,,,
円柱上に作られた。,海辺をそぞろ歩きする。,,,
私は電話で彼と話しました。,子育てで大切なのは子育てを楽しむ心だ。,,,
私は電車で家に帰った。,包丁で指先を切った。,,,
電気をつけて下さい。,お嬢様がご親切にも駅まで迎えに来てくださいました。,,,
父は中国へ行ってしまった。,我がチームは得点を重ねた。,,,
父親らしくない。,酒を飲むとまぶたが重くなる。,,,
祖父はいつもこのいすに座る。,慎重に計画を練った。,,,
その町はロンドンのすぐ北にある。,子供たちを集めて野球をしよう。,,,
私は夏に北海道に行きます。,全員が講堂に集合していた。,,,
中野駅の北口を出て面白いことを見つけよう。,この本の編集はなかなか気が利いている。,,,
私は車を買うことにした。,店員として勤める。,,,
あの町は列車の便が悪い。,この部には15名の職員がいる。,,,
駐車場が見つからなかったんだ。,あの学校の教員は優秀だ。,,,
私は母が大好きです。,食品公害を防がねばならない。,,,
彼女は私に母親のようにしてくれる。,►都心に公園を造る。,,,
私の祖母はオートバイに乗れる。,公共のために大いに尽くした。,,,
メロンが半分食べられた。,月平均５本は映画を見る。,,,
あの半島はいい風景が多い。,雨の日にはテレビの画像が乱れやすい。,,,
半径5 センチの円を描く。,壁画を発見する。,,,
チケットは百ユーロだ。,死体の身元がどうしてもわからなかった。,,,
この川は数百マイルもつづいている。,あいつは死んだも同然だ。,,,
せっかくだから百均に行こうか。,彼はバス事故で死亡した。,,,
かれは土に水をやった。,安定した天候がひと月続いた。,,,
彼は土地をすべて売った。,地方の方が大都会より物価が安い。,,,
この家は土台がしっかりしている。,行方不明者の安否が気遣われている。,,,
彼らは西の方へ向かった。,彼女とは遠い親類になる。,,,
彼は６月に東京をはなれて関西に来る。,政界と財界はきわめて親しい関係にある。,,,
駅はホテルの西側です。,彼はみんなに親しまれている。,,,
食べながら読んではいけません。,息子には健全な精神と強い体を持ってほしい。,,,
それを解読できる？,試験のため詰め込み勉強をしている。,,,
秒読みはやく1週間以内に始まります。,彼は党内での発言権を強めようとしている。,,,
飛行していが八千メートル以上であること。,どの部屋でも自由に使ってください。,,,
これはそれに比べて千倍の大きさがある。,コンピュータは何台使用できるかね。,,,
千円札くずれますか。,大使に就任する。,,,
私は彼に私たちの学校のことを話した。,朝一番にそれをやろう。,,,
校舎内では走ってはいけません。,朝食にはトーストと果物を食べます。,,,
きみは高校生ですか。,彼は今朝早く着いた。,,,
入口を入ってすぐ右に。,歴史は難しい問題がいっぱい出た。,,,
左右を見る。,物理の宿題を済ませた。,,,
最初に右手を出しなさい。,表題を付ける。,,,
南駅はどこですか？,今日は何か仕事があるかい。,,,
右下に新宿駅南口が見えます。,夫婦は病気の両親によく仕えた。,,,
彼の家は川の南側にある。,独特なファイリングの仕方。,,,
左を向いてください。,彼は上京して絵を習っている。,,,
窓が左手にあります。,京都駅へ行く道を教えてくれませんか。,,,
車は急に左折した。,帰京の途にある。,,,
友人は少ししかいない。,道に大きな足跡が残されていた。,,,
友達が欲しい。,スープにもう少し塩を足してください。,,,
バスで旧友にばったり会った。,食糧は十分足りる。,,,
夜は雨になるらしい。,この店は多くの商品を取り扱っている。,,,
大雨のため私たちは出かけられなかった。,いくつかの品物を特売に回す。,,,
雨具をお持ちになりましたか。,この石けんは品質がよい。,,,
ガソリンはひじょうに火がつきやすい。,彼女は制服を着ていた。,,,
部屋で火災が起きた。,暗くならないうちに目的地に着いた。,,,
昨日の花火見た？,着陸できる場所を探す。,,,
毎晩そのことについてぎろんした。,別居はどれくらい続いたのか?,,,
毎度ごひいきにありがとうございます。,彼女と別れてもう長いことになる。,,,
私は毎朝銀座で地下鉄に乗る。,サイズごとに別々の箱に入れる。,,,
ゆっくり休んでね。,彼は音楽を聞き分ける力がある。,,,
休日を楽しみなさい。,ピアノとバイオリンでは音色が違う。,,,
休暇はどうでしたか。,私のステレオはあなたのより音質が悪い。,,,
私は午後を寝て過ごした。,読んだら元の所に戻しておいてください。,,,
彼女は午前７時に起きる。,水は２元素に分解する。,,,
母は午前中病院に行きます。,たいていの子供は元来虫が好きである。,,,
,ただ今特別申し上げることはありません。,,,
,仕事を特急で仕上げる。,,,
,各国民にはそれぞれ独特の性格がある。,,,
,かぜの引きかけに無理をしないように。,,,
,風呂が沸いた。,,,
,関東地方は今回の台風の進路に当たっている。,,,
,夜だけ出てくる動物はたくさんいる。,,,
,このバーは深夜営業だ。,,,
,夜明けにはまだ間がある。,,,
,空港に着陸する。,,,
,あと二つ机が入るだけの空きはありますか。,,,
,部屋は家具もなくからっぽだった。,,,
,田舎に農場がある。,,,
,そこは避暑地として有名である。,,,
,この薬は頑固な頭痛に有効だ。,,,
,昨夜はずっと起きていた。,,,
,彼はその企画について問題を提起した。,,,
,転んだ子供を起こしてやった。,,,
,犬は毎日運動させる必要がある。,,,
,けが人を急いで病院に運んだ。,,,
,東京から京都までの運賃はいくらですか。,,,
,食卓に料理を並べる。,,,
,この資料はとても役に立つ。,,,
,この自動車はアルコールを燃料に使う。,,,
,喫茶店で流している音楽。,,,
,彼と一緒に歩くのは楽しかった。,,,
,自動車を買ったから日曜はドライブを楽しめる。,,,
,この沿線には景色のよい所が多い。,,,
,この大学の最大の特色は留学生の多いことである。,,,
,確か髪は明るめの茶色だった。,,,
,帰る途中で本屋に寄った。,,,
,教室の掃除が終わったら帰宅してよろしい。,,,
,日光は日帰りが出来ます。,,,
,犬を散歩に連れて行く。,,,
,この調子で歩けば30分で着くだろう。,,,
,経営者側はその要求に対して譲歩した。,,,
,君が早く報告しないから悪いんだ。,,,
,悪魔に取り付かれる。,,,
,病状は悪化の様相を見せている。,,,
,最新型自動車の広告を新聞や雑誌に出した。,,,
,この瓶は口が広い。,,,
,鳥が翼を広げた。,,,
,歩き疲れた時に一休みできる喫茶店です。,,,
,彼は銀座に店を三つ持っている。,,,
,今日は会社商店は皆休みだ。,,,
,土曜日には必ず町に出掛ける。,,,
,町長を務める。,,,
,そのため周囲の景色や町並みは大きく異なります。,,,
,ご住所はどちらですか。,,,
,この家は久しく人が住んでいない。,,,
,この居住施設は大学によって運営されている。,,,
,この品は明日から販売されます。,,,
,その農夫は野菜を売って歩いた。,,,
,新製品がよく売れる。,,,
,彼の成功を期待している。,,,
,何分くらいなら待てますか。,,,
,ホーム上に待合室を持つ。,,,
,その祭りの起源は非常に古い。,,,
,中等教育は依然としてイーリアスなどの古典が教えられた。,,,
,中古住宅を探している。,,,
,雨が降り始めた。,,,
,その集まりで彼は始終にこにこしていた。,,,
,この列車は新宿始発だ。,,,
,試験はすぐに終わる。,,,
,最終的にどうなるか分からない。,,,
,祭りは夜更けになってようやく終了した。,,,
,湯がわくまでの時間を計ってみよう。,,,
,県当局はこの地域の開発を計画している。,,,
,この駅の設計はよくない。,,,
,この病院は50人の患者を収容することが出来る。,,,
,彼女は少なくとも週一回美容院へ行く。,,,
,横浜デザイン学院へ入学金。,,,
,我が社は世界各地に製品を送ります。,,,
,近ごろは新鮮な野菜の輸送に飛行機が使われる。,,,
,彼の送別会が行われた。,,,
,公園は近所の家族連れで賑わっていた。,,,
,水族館へ行く道を教えてくれますか。,,,
,私の親族は皆この町に住んでいる。,,,
,彼は鏡に自分の姿を映して見た。,,,
,あの赤いコートを着ると彼女は映える。,,,
,その映画館ではいつもいい映画をやっている。,,,
,昨日銀座へ買い物に行った。,,,
,株の売買で大もうけした。,,,
,お客の購買意欲をそそるように商品の配置を工夫する。,,,
