L5,L4,L3,L2,L1
,病気で学校を休んだ。,,,
,彼女は夫の看病疲れで倒れてしまった。,,,
,伝染病がその地方で大流行している。,,,
,結果を発表するのはまだ早い。,,,
,早速本題に入ってよろしいですか。,,,
,金曜の早朝の飛行機にします。,,,
,それは何か半透明な物質で出来ていた。,,,
,品質を検査する。,,,
,現象の背後にある本質を捕らえねばならない。,,,
,私は母が台所を掃除するのを手伝った。,,,
,台風は南方海上で発達しつつある。,,,
,寝台を組み立てる。,,,
,週に１回水泳教室に通っている。,,,
,駅舎には待合室がある。,,,
,浴室付きの二人部屋をお願いしています。,,,
,免許証がなければ自動車運転は許可されない。,,,
,うまくいく可能性は十分ある。,,,
,君の行動は僕には不可解だ。,,,
,トンネルの建設を計画する。,,,
,この橋は二年前に建てられた。,,,
,いつでも課税権を行使できるというのが建前だ。,,,
,彼は20キロの道を自転車で行った。,,,
,階段を一段踏み外して転んだ。,,,
,運転手は車の中で寝ていた。,,,
,この物質は医学的には無害である。,,,
,彼は昨年医者を開業した。,,,
,彼は夏以来ずっと医療を受けている。,,,
,彼は足を止めて地図を見た。,,,
,痛みがやむまで起き上がれなかった。,,,
,犬の放し飼いは法律により禁止されている。,,,
,君はこの漢字が読めますか。,,,
,消えかけの大きな字が見えるだろ。,,,
,彼は数字に強い。,,,
,あなたがこの工場で働く女性の担当になります。,,,
,これは私が工夫した計画です。,,,
,政府は工業の振興計画を開始した。,,,
