Phrases,Translation
見ているだけだ。,I'm just looking.
じゃ、少しだけ。,"Okay, just a little bit."
願いは一つだけ。,I only have one wish.
眠たいだけだよ。,I just want to sleep.
すこしだけ痛いです。,It hurts just a little bit
結果だけが必要だ。,I just need a result
疲れただけだよ。,I'm just tired.
言ってみただけだよ。,I'm just saying.
それだけで結構です。,That's all I need.
好きなだけ取ってね。,Take as much as you want.
一回使っただけです。,I only used it once.
怪我だけはするなよ。,Just don't hurt yourself.
寝たかっただけだよ。,I just wanted to sleep.
１０分だけ付き合おう。,I'll give you ten minutes.
週末だけここにいます。,I'm only here for the weekend.
ご無沙汰。元気？,Long time no see. How are you?
ご無沙汰しました。,It's been a while.
ご無沙汰しています。,It's been a while.
２年間のご無沙汰でした。,It's been two years.
ご無沙汰をして、ごめんなさい。,I'm sorry it's been so long.
記録を破った。,I broke the record.
記録は誰も破れない。,No one can break the record.
現在までの状況を記録した。,I've documented the situation up to now.
水泳で記録を持っている。,I have a swimming record.
温度を毎日記録している。,I'm recording the temperature every day.
経済はマイナス成長を記録した。,The economy has recorded negative growth.
すべての買い物を記録する。,I keep track of all my purchases.
早く用意して。,"Come on, get ready."
用意はいいかい。,Are you ready?
用意はできた？,Are you ready?
万事用意しておけ。,Be ready for anything.
行く用意はいいか？,Are you ready to go?
ケーキは良いできた？,Is the cake ready?
出発の用意をした。,We're ready to go.
車は用意してあります。,The car is ready.
夕飯を用意しましょうか。,I'll fix you some dinner.
彼は７０歳でなお活躍している。,He's 70 years old and still active.
その考えは今日なお優勢である。,That idea still prevails today.
この車誰の？,Whose car is this?
相変わらずだね。,"Same old, same old."
相変わらずまだ寒い。,Still cold as ever.
相変わらず忙しいの？,You busy as ever?
相変わらず親切だ。,Kind as ever.
相変わらずやってるね。,You're still doing it.
相変わらず挑戦的ね。,Challenging as ever.
相変わらず美しい。,Beautiful as ever.
台本に目を通しておいてください。,Please read through the script.
お化粧は一切しなさい。,Don't wear any makeup.
肉類は一切食べないんだ。,I don't eat any meat.
この度初めて見たのです。,I've never seen this before.
エンジンが復活した。,The engines are back on.
流行を復活させる。,I'm bringing back the fashion.
翌日は家に戻ることになっていた。,We were supposed to go home the next day.
いつ船が出ることになっているの？,When is the ship supposed to leave?
そうなんですよね。,That's right.
これすごいことなんですよね。,"This is amazing, isn't it?"
台風は関東地方に上陸した。,The typhoon made landfall in the Kanto region
昨日ある島に上陸した。,It landed on one of the islands yesterday.
夢見てるみたいな気分だよ。,I feel like I'm dreaming.
飛行機で旅をしてみたいな。,I wish I could travel by plane.
これお茶みたいな味がする。,This tastes like tea.
多分遅れる。,Maybe we'll be late.
多分そうだよ。,Maybe we are.
たぶんおそすぎる。,Maybe we're too late.
たぶん本当だよ。,Maybe it's true.
たぶん正しい。,Maybe you're right.
たぶん大丈夫。,Maybe you're right.
言っただろ。,I told you.
冗談言うな。,Don't joke about it.
なにも言うな。,Don't say anything.
言わないで。,Don't say anything.
合言葉を言う。,I'll say the word.
一言言いたい。,I just want to say something.
上等じゃないか。,You're good.
笑わせるじゃないか。,You're making me laugh.
ずぶ濡れじゃないか。,You're soaking wet
さあ飲もうじゃないか。,"Come on, let's have a drink"
中休みしようじゃないか。,Let's take a break
今日って暇？,Are you free today?
幸福って何？,What is happiness?
猫って可愛い。,Cats are cute.
物理って得意？,Are you good at physics?
明日の夜とかどう？,How about tomorrow night?
何かペットとか飼ってたりするの？,Do you have any pets or anything?
１２時４５分とかどう？,How about 12:45?
めちゃめちゃ楽しかったよ。,That was so much fun.
めちゃめちゃ寒くなったね。,It's getting really cold.
彼だったらできるよ。,He could do it.
私だったら買うよ。,I'd buy one.
私だったら歩くよ。,I'd walk if I were you.
僕だったら断るな。,I'd say no.
俺だったら黙ってるな。,I'd keep my mouth shut.
すぐに学校に馴染んだ。,I fit right in at school.
初めは新居に馴染めなかった。,I didn't adjust to my new house at first.
砂糖を少し足してください。,"Add a little sugar, please."
6と4を足すと10になる。,Six and four add up to ten.
牛乳を少し加えなさい。,Add some milk.
スープに塩を加えよう。,Add some salt to the soup
必要な変更を加える。,Make any necessary changes
軽率に答えろな。,Don't answer rashly.
質問に答えなさい。,Answer the question.
英語で答えなさい。,Answer in English.
さあ早く答えないか。,"Come on, answer quickly."
間違って答えた。,I answered wrong.
駅に着いたよ。,I'm at the station.
やっと着いた。,Finally.
２時半に着いた。,I arrived at 2:30.
事故は避けられない。,An accident is inevitable.
その質問を避けた。,You avoided the question.
卵を焼いてくれ。,Would you like to fry some eggs?
パンを焼きますか。,Would you like to bake some bread?
陶器は火で焼かれた。,The pottery was burned in the fire.
冬の日は速く暮れる。,The winter sun sets fast.
予想通りの展開になりましたね。,That's what I expected.
彼は頭が良いがやはり嫌いだ。,"He's smart, but I still hate him."
空はますます暗くなった。,The sky is getting darker.
海はますます荒れてきた。,The sea is getting rougher.
ますます難しくなっている。,It's getting harder and harder.
むしるここにいたい。,"Mushy, I want to stay here."
バスよりむしる歩きたい。,I'd rather walk than take the bus.
むしるビールを注文したい。,I want to order a beer.
とうとう雨が降り出した。,At last it began to rain.
とうとう彼は目的を達成した。,At last he has achieved his goal.
やっと金曜日だ。,It's Friday at last
やっと順番が来た。,It's finally his turn.
ようやくすっかり終わった。,"Finally, he was all done."
汽車にようやく間に合った。,"Finally, he was on time for the train."
ようやく納得した。,I'm finally satisfied.
一応聞きますが何をするつもりですか?,"Just out of curiosity, what are you going to do?"
先方から一応返事はありました。,I got an answer from the other side.
なるべく安いほうがいいです。,I'd like to do it as cheaply as possible.
なるべくいろんなものを見に行こう。,Let's go see as many things as possible.
なるべくゆっくり話してもらえますか?,Can you talk as slowly as possible?
問題はこうです。,The problem is this.
いつもこうなの？,Is it always like this?
なぜこうなったのかしら。,Why is it always like this?
そう書くんじゃない。こう書け。,Don't write like that. Write it like this.
ついに金曜日だ。,It's Friday at last.
ついに現れた。,He finally showed up.
ついに降参した。,At last he surrendered.
ついに彼は屈服した。,At last he gave in.
夢がついに叶った。,At last his dream came true.
ついに彼女はやっと来た。,At last she came at last
ついに夏がやってきた。,At last summer is here
やっぱりお前が頼りだよ。,I knew I could count on you.
冬はやっぱり雪がないとね。,"In winter, we need snow."
和菓子にはやっぱり日本茶が合う。,Japanese sweets go well with Japanese tea.
やっぱり風呂上がりはビールに限るな。,Beer is the best drink after a bath.
殆ど泳げない。,I can barely swim.
ほとんど全部分かった。,I figured out almost everything.
確かに難問だね。,"You're right, it's a difficult question."
確かに彼は利口な少年だ。,"He's a clever boy, that's for sure."
確かに彼は信頼できます。,Surely he can be trusted.
彼の英語はまあまあだ。,His English is okay.
カレーはまあまあでした。,The curry was okay.
なかなか立派だ。,Quite impressive.
なかなか良かったよ。,It was pretty good.
車はなかなか動かない。,The car didn't start very well.
かなり寒い。,Quite cold.
かなり遠いから。,It's pretty far away.
かなり痛いのですか?,Does it hurt a lot?
これはかなり怖いね。,That's pretty scary.
ずいぶんと静かだな。,You're awfully quiet.
ずいぶん若く見えるよ。,You look a lot younger.
ずいぶんと珍しいですね。,That's very unusual.
たまに外食しようよ。,Let's eat out sometime.
たまには気楽にしていいよ。,You can take it easy once in a while.
たまには外出て運動しなよ。,You should go out and exercise once in a while.
彼はまるで専門家であるかのように話す。,He speaks as if he is an expert.
日本語をまるで日本人かのように話す。,He speaks Japanese as if he were Japanese.
何でも知っているかのように話す。,He talks as if he knows everything.
普通でいいですか?,Is that normal?
普通九時に寝る。,I usually go to bed at nine.
普通の食事よ。,It's a normal meal.
これは完全に普通だ。,This is perfectly normal.
それって普通のこと？,Does that sound normal to you?
普通らしいの女性です。,She's a normal woman.
彼を誉めずにはいられない。,I can't help but admire him.
そう思わずにはいられない。,I can't help but think that.
彼女を愛さずにはいられない。,I can't help but love her.
将来の事を考えずにはいられない。,I can't help but think about the future.
意見を述べずにはいられない。,Can't help but have an opinion
あまり見えない。,I can't see much.
あまり人に頼るな。,Don't rely on others too much
あまり食べすぎるな。,Don't eat too much.
最近あまり会わない。,I haven't seen you much lately.
あまり無理するなよ。,Don't push yourself too hard
あまり楽しくなかったな。,That wasn't much fun.
あなたが戻って来てくれて嬉しいです。,I'm glad you're back.
あなたが夢を見させてくれるのね。,You're the one who makes me dream.
腕を離してくれ。,Let go of my arm.
話しを聞かせてくれ。,Let me talk to you.
僕と踊ってくれませんか。,I want you to dance with me.
生きる意味を考えてくれる。,You make me think about the meaning of life.
説明してくれてありがとう。,Thank you for explaining.
踊ってもらえますか。,Will you dance with me?
予約してもらえませんか。,Will you make a reservation?
友達にたすけてもらいなさい。,Ask your friends to help you
毎朝起こしてもらえますか。,Can you wake me up every morning?
僕は妹に写真を取ってもらった。,I asked my sister to take my picture.
目の前で料理してもらうのは素敵だ。,It's nice to have someone cook in front of you.
子供の頃しょっちゅう勉強しると言われた。,"When I was a child, I was often told I needed to study."
紅茶とコーヒーどちらでもどうぞと言われた。,I was told I could have tea or coffee.
僕は医者に見てもらったほうがいいと言われた。,He said I should see a doctor.
結婚してくれと言われたとき私は言葉に窮した。,"When he asked me to marry him, I was at a loss for words."
彼は助けてくれと叫んだ。,He screamed for help.
彼にそうしてくれと頼んだ。,I begged him to do so.
彼は私に許してくれと言った。,He asked me to forgive him.
彼はお金を貸してくれと頼んだ。,He asked me to lend him some money
誰かが助けてくれ叫んでいる。,Someone is screaming for help
彼は給料を上げてくれと要求した。,He demanded a raise in his salary.
彼女は彼に家まで送ってくれと訴えた。,She pleaded with him to give her a ride home.
凍るように冷たい。,Freezing cold
焼けるように熱い。,Searing hot
うだるように暑い。,Sweltering hot
働き過ぎないように。,Don't work too hard
汽車に間に合うように急げ。,Hurry up so you can catch the train
またいつか風のように走るんだ。,You'll be running like the wind again someday
必ず弱火で煮立たないように煮ること。,Be sure to boil it over low heat so it doesn't boil over
ここは差し込むように痛みます。,It hurts like a plunger here
袖を捲ってください。,Please roll up your sleeves
今日は寒くてしょうがない。,It's so cold today
心配したってしょうがないよ。,I don't care if you're worried
冷たいものを飲みたくてしょうがない。,I can't help but want something cold to drink
対策に関する討議が行われた。,Discussions were held on countermeasures.
それは細菌感染に有効だ。,It's effective against bacterial infections.
その新型車が市場に出ている。,That new car is on the market.
何がそう言ったにせよそれはうそだよ。,"Whatever told you that, it's a lie."
捕まらないようにしろよ。,Try not to get caught.
彼は我々の求めに応じて歌って。,He sang at our request.
電車は駅に向かっていた。,The train was heading for the station.
彼の努力にも関わらず事故は起こった。,"Despite his best efforts, the accident happened."
彼女は事実に基づいて議論を展開する。,She bases her arguments on facts.
自分お主義に基づいて行動した。,She acted on her own principles.
塩と重曹を水に加えてください。,Add salt and baking soda to the water.
雨に加えて激しい風にもあった。,We had heavy winds as well as rain.
警戒するに越したっことはない。,It's always better to be safe than sorry.
何か別の方法があるに決まっている。,There's got to be another way.
そんな計画は失敗するに決まっている。,A plan like that is bound to fail.
お金持ちに関わらず彼女は幸せでない。,"Regardless of how rich she is, she's not happy."
彼らとは関わるな。,Don't get involved with them.
地球の資源は限られている。,Earth's resources are limited.
学生に限り入場可。,Only students are admitted.
急いでいる時に限ってバスが遅れる。,The bus is always late when I'm in a hurry.
夏はビールに限るね。,Beer is the best drink in summer.
ただしかっこいい男に限る。,But only if you're good-looking.
誕生日に限らずプレゼントをもらうのは嬉しいものだ。,"It's always nice to receive gifts, not just on your birthday."
服装や髪型はその人の内面の表れにほかならない。,Clothing and hairstyle are nothing but an expression of a person's inner self.
予想に反して楽に勝てましたね。,"Contrary to my expectations, you won easily."
海外旅行をするにあたりインターネットで気候を調べました。,I researched the climate on the Internet for my trip abroad.
行かなければならない。,I have to go.
将来に備えねばならない。,We have to prepare for the future.
冬が近づきつつある。,Winter is approaching
物価が上がりつつある。,Prices are rising.
人口は増加しつつある。,The population is growing.
自分としては満足している。,I am satisfied with my life.
旅行方法としてはどれが一番良いですか。,Which is the best way to travel?
夜を徹するか否か。,Whether to stay up all night or not.
全力を尽くすか否かだ。,Whether or not to give it your all.
私にはそれが真実か否かが分からない。,I can't tell if that's true or not.
以前より悪くなってる？,Is he worse off than before?
彼は以前ほど太ってない。,He's not as fat as he used to be.
彼は以前早起きだった。,He used to be an early riser.
彼は以前とは違う。,He's not like he used to be.
彼は以前よりは健康ではない。,He's not as healthy as he used to be.
彼は以前は酒を飲まなかった。,He used to not drink.
許可なしにしゃべらないで下さい。,Please don't speak without permission.
許可なしにしゃべらないで下さい。,Do not speak without permission.
成功は努力いかんによる。,Success depends on hard work.
雨にあってすっかりびしょ濡れになった。,It was raining and I was completely soaked.
このお店、近くにあって良かったね。,It's a good thing this store is close by.
急がなくてもいいよ。,You don't have to hurry.
彼は今日は学校へ行かなくてもいい。,He doesn't have to go to school today.
踊りましょうか。,Shall we dance?
歩きましょうか。,Shall we walk?
始めましょうか。,Shall we begin?
説明しましょうか。,Shall we explain?
休憩しましょうか。,Shall we take a break?
窓を開けましょうか。,Shall we open a window?
何か手伝いましょうか。,Do you need help?
どこで会いましょうか。,Where shall we meet?
昼食は何にしましょうか。,What do you want for lunch?
結構です。それにしましょう。,"No, thank you. Let's do that."
何か飲み物をいれましょうか。,Can I get you something to drink?
お取り寄せいたしましょうか。,Would you like me to order something for you?
取り寄せていただけますか。,Can you order it for me?
そうですか、じゃ、取り寄せてもらえますか。,"I see. Well, can you order it for me?"
前にもあったよ。,It's happened before.
話す前に考えなさい。,Think before you speak.
６時前には来ないで。,Don't come before 6:00.
歩きながら話しましょう。,Let's talk while we walk.
お茶を飲みながら話しましょう。,Let's talk over a cup of tea.
台所に入ってこないで。,Don't come into the kitchen.
話しかけてこないでよ！,Don't talk to me!
もう電話してこないで。,Don't call me again.
どうやって我慢するの？,How do you put up with that?
どうやって出会ったの？,How did you meet?
どうやってやるの？,How do you do it?
どうやって知り合ったの？,How did you get to know each other?
どうやって作ったのですか。,How did you make it?
学校へはどうやって行ってるの？,How do you go to school?
後で取りに来ます。,I'll come back for it later.
後で電話するね。,I'll call you later.
後でまた言ってね。,Tell me later.
後で追いつきますから。,I'll catch up with you later.
後で結果を教えてね。,I'll let you know how it goes.
後でそれしてもいい？,Can I do that later?
私は後で君たちに合流する。,I'll join you guys later.
週末はどんな予定？,What are your plans for the weekend?
どんな曲を弾くの？,What songs did you play?
どんな食事をしたの。,What did you eat?
どんな本を買ったの？,What books did you buy?
どんな靴が好きですか。,What kind of shoes do you like?
どんな症状がありますか。,What symptoms do you have?
木は燃えやすい。,Wood is flammable.
紙は燃えやすい。,Paper is flammable.
英語は学びやすい。,English is easy to learn.
ガラスは壊れやすい。,Glass is fragile.
卵は夏には腐りやすい。,Eggs rot easily in summer.
私は風邪を引きやすい。,I catch colds easily.
この車は運転しやすいな。,This car is easy to drive.
旅先では迷子になりやすい。,It's easy to get lost on the road.
彼女は不幸らしい。,She seems to be unhappy.
彼女は幸せらしい。,She seems to be happy.
彼は学生らしい。,I heard he was a student.
彼はいい奴らしい。,He's a good guy.
秘密が漏れたらしい。,He's got a secret.
彼は大変眠いらしい。,He's very sleepy.
私は彼を知るようになった。,I've come to know him.
彼は泳げるようになった。,He can swim.
私は英語を話せるようになりたい。,I want to learn to speak English.
彼はとうとうそれを理解するようになった。,He has finally come to understand it.
雨に濡れないようにしなさい。,Try not to get wet in the rain.
痛くないようにしてください。,Try not to get sore.
犬か猫か鶏を飼うようにしなさい。,Try to keep a dog or a cat or a chicken.
火が消えないようにしてください。,Try not to let the fire go out.
誰にも迷惑をかけないようにします。,Try not to bother anyone.
すごく疲れてるみたいだね。,You look really tired.
本当に緊張してるみたいだね。,You look really nervous.
かなり忙しかったみたいだね。,You've been pretty busy.
これ、お茶みたいな味がする。,This tastes like tea.
夢見てるみたいな気分だよ。,I feel like I'm dreaming.
これ、サーモンみたいな味がする。,This tastes like salmon.
胃の調子が悪いみたいなんだよ。,I think my stomach is upset.
犬は病気みたい。,The dog looks sick.
夢みたいだ。,It's like a dream.
実際感じたままを話してよい。,You can tell it like you feel it.
天気はずっと悪いままだった。,The weather stayed bad for a long time.
動物は本能のままに振る舞う。,Animals behave according to their instincts.
待ってた方がいい?,Should we wait for them?
急いだほうがいいよ。,We'd better hurry.
家にいる方がいいな。,I'd rather stay home.
でも慣れた方がいい。,But you'd better get used to it.
すぐに出た方が良い。,We'd better leave now.
早く寝た方がいいよ。,You should get some sleep.
言わない方がいいよ。,You don't want to tell me.
風邪を治した方がいい。,You should get over your cold.
消した方がいいのかな？,Do you think I should turn it off?
少し休んだ方がいいよ。,You should get some rest.
医者に相談した方がいいよ。,You'd better consult a doctor.
彼女の意見に従うほうがいい。,You should follow her advice.
彼女に謝ったほうがいいですよ。,You'd better apologize to her.
全てうまくいくはずだよ。,Everything should be fine.
これで痛みは和らぐはずだ。,This should help with the pain.
まだ始めないで。,Don't start yet.
最初から始めよう。,Let's start from the beginning.
いつから付き合い始めたの？,When did you start dating?
列車は雪のために遅れた。,The train was delayed because of the snow.
台風のために休校になった。,The school was closed because of the typhoon.
食物は生きるために必要だ。,Food is necessary for survival.
彼女は彼にそれをさせた。,She made him do it.
母は私に風呂場の掃除をさせた。,My mother made me clean the bathroom.
無理やり彼女に宿題をさせた。,She forced me to do my homework.
次の試合を私にさせて下さい。,Please let me have the next game.
彼にそれをさせられなかった。,I couldn't let him do it.
子供を好きかってにさせておくな。,Don't let a child do as he pleases.
私にそれをもう一度させてください。,Let me do it again.
どうか埋め合わせをさせてください。,Please let me make it up to you.
驚いたふりをしないで。,Don't pretend to be surprised.
彼は医者のふりをした。,He pretended to be a doctor.
彼は寝たふりをした。,He pretended to be asleep.
聞こえないふりをした。,He pretended not to hear.
彼女は学生のふりをした。,She pretended to be a student.
解っていないふりをするのは止めなさい。,Stop pretending you don't know what you're doing.
１０日ぶりに雨が降った。,It rained for the first time in ten days.
彼の話ぶりに腹が立った。,I was angry at the way he talked.
彼の進歩ぶりに満足しています。,I am pleased with his progress.
彼の上達ぶりに満足しています。,I'm pleased with the way he's progressing.
もちろん、一緒に行くよ。,Of course I'll go with you.
もちろん彼は絶対に正しい。,Of course he's absolutely right.
もちろん、帰ってくるさ。,Of course I'll come back.
もちろん、戻ってくるよ。,Of course I'll come back.
もちろん、そうするわ。,Of course I will.
もちろん、いいですよ。,Of course I will.
もちろん彼を訪ねます。,Of course I'll visit him.
もちろん、冗談だよ。,"Of course, I'm kidding."
