Words,Meaning,Sentences,Translation
来る,to come,雨天の後には晴天が来る。,After rain comes fair weather.
見る,"to see, look, watch, view, observe, look over",映画でも見ていこうか。,Let's stop off and see a movie.
居る,"to be, to exist",彼は昨年北海道にいましたか。,Was he in Hokkaido last year?
くれる,"to give, let some have",彼女は私たちに食べるものをくれた。,She gave us something to eat.
要る,"to be needed, to be wanted",この家は家賃がいらない。,This house is free of rent.
それ,that,誰がそれを知ろうか。,Who'd know that?
時,"time,, hour, moment, a point in time, occasion, case",私の家に来れる時は、まず電話をして下さい。,"When you can come to my house, please call me first."
される,"to be dine (to someone), to be doing",奨学金が交付された。,I got a grant for my tuition.
から,"from, because, since",ここから歩いて２時間もの距離だ。,It is no less than two hours' walk from here.
僕,"I, me",僕の声は届いていますか。,Can you hear I'm calling?
板,"board, plank, sheet of meta, plate, pane, slab, cutting board, chef, stage",私はその板をインチで計った。,I measured the board in inches.
前,"ago, before, in front of",駅に着く前に列車は発車していた。,The train started before we got to the station.
ではない,"is not, am not, are not",能力がすべてではない。,Ability alone is not enough.
よう,"appearing, looking, way to, method of, form, style, like",こういう機器では買いたくなるような値段です。,"It's an attractive price, for this sort of device."
中,"in, inside, middle, center, among, with in, during, while",なぜ森の中で道に迷ったのか。,Why did you get lost in the woods?
言う,"to say, to utter, to declare, to name, to call",私に一回だけ言わせてくれ。,Let me say it once for all.
先生,"teacher, master, doctor",彼は駅で英語の先生にばったり会った。,He met his English teacher at the station by accident.
見える,"to be seen, to be in sight, to be visible",あちらに富士山が見えます。,We can see Mt. Fuji over there.
私,"I, me",正確に言うと私は大学講師です。,"Specifically, I'm a university lecturer."
べき,"should, must, ought to, to be done",君は彼に本当のことを言うべきだった。,You should have told him the truth.
積もり,"intention, plan",私は外国へ行くつもりだったが。,I intended to have gone abroad.
年,"year, counter for years",私がここへ来てから二年になる。,It is two years since I came here.
という,"called, named, said, to say, to be said, to be called",それは何という動物だ。,What an animal it is!
有る,"to be, to exist (in animate), to have, to be located, to be quipped with, to happen, to come about",私たちの学校には１０の学級がある。,Our school has ten classes.
男,"man, male, fellow, guy",農場で一人の男が働いている。,There is a man working on the farm.
この,this,このスカーフはすべすべする。,This scarf feels soft.
行けない,"wrong, not good of no use, must not do",あなたはこの部屋で眠ったらいけません。,You are not to sleep in this room.
思う,"to think, to consider",彼は彼女をとても魅力的だと思います。,He thought her very charming.
には,"for (in regard to), in (in regard to), in order to",この国には外国人の観光客が大勢いる。,Foreign tourists in this country are numerous.
んです,"the expectation is that, the reason is that, the fact is that, it is that",あの、本当は、ちょっと具合が悪いんです。,"Well... actually, I'm sick."
させる,"to make (someone) do, to allow (someone) to",医者は少女に抗生物質を服用させた。,The doctor dosed the girl with antibiotics.
方,"direction, way, side, area, type, method, means",どっちの方に行くとよいかな。,Which way shall we go now?
悪い,"bad, poor, undesirable",彼女はいつも体の具合が悪いと不平を言っている。,She is always complaining of her poor health.
にも,"also, too, as well, even, be also, to/in.. also (inclusive)",この規則はいくとおりにも解釈できる。,This rule reads several ways.
ので,"because of, since, the reason is, that being the case, given that, so",私は非常に早く起きたのでその列車に間に合った。,"Because I got up so early, I caught the train."
鳴る,"to sound, to ring, to resound, to echo, to roar, to rumble",突然ベルが鳴った。,The bell rang suddenly.
学生,student (esp. a university student),ここの本は学生が誰でも利用できます。,These books are accessible to all students.
立つ,"to stand, to rise, to stand up",あの建物の前に立っている人は誰ですか。,Who is the man standing in front of the building?
よりも,"in comparison to, rather than, than (inclusive comparison)",彼女は彼よりも優れた指導者だ。,She is a more proficient leader than he is.
や,"such things as, and",賃金や給料は定期的に受け取る給与のことです。,Wages and salary are pay received at regular times.
考え,"thinking, thought, view, opinion, concept, idea, notion, intention, consideration",彼の考えは私の考えと一致しない。,His ideas do not fit in with mine.
自分,"myself, yourself, oneself, himself, herself, I, me",自分のすらっとした姿を得意に思っています。,She is vain about her slender figure.
って,"you said, he said, she said, they said, says that,as for the term, as for",楽しい時って、あっと言う間に時間過ぎちゃうんだよね。,"When you're enjoying yourself, the time seems to fly by."
である,"be is, (formal, literary)",それらの街の交通法は同じである。,Those cities have uniform traffic laws.
酔う,"to get drunk, to become intoxicated, to feel sick, to become nauseated, to be elated",彼は多かれ少なかれ酔っていた。,He was more or less drunk.
あの,that,あのお店ではおいしいリンゴが販売中です。,There are some nice apples on sale in that shop.
他,"other (place, thing, person), the rest",彼は他の事に気を取られている。,He is preoccupied with something else.
無い,"nonexistent, not being (there)",私は忙しいし、それには興味もない。,"I am busy, and I'm not interested in that, either."
決して,"never, by no means, not in the least, in no way",あなたのご親切を私はけっして忘れません。,I shall never forget your kindness.
積極的,"positive, assertive, active, proactive, aggressiv",何事にも積極的な態度を取るようにしなさい。,Try to have a positive attitude about everything.
凍結,"freezing (e.g. water), freezing (prices, wages, assets, etc.)",冬は道路を凍結するのでよく滑って転びます。,It is easy to slip and fall during icy winters.
道,"road, path, street, lane, passage, route, way, distance, journey, course",暗い道では足元に気をつけなさい。,Watch your step in dark alleys.
あれ,that,質ではこれはあれよりはるかに勝っている。,This one is of much higher quality than that one.
でも,"but, however, even if, even though",楽しく遊んできなさい。でも道に迷わないように。,"Have fun, but don't get lost."
いただける,"to be able to receive, to be able to take, to be able to accept",部屋を見せていただけますか。,Could I see the room please?
尾,"tail (animal, kite, comet, etc.), tail end",魚は尾を動かして泳ぐ。,A fish swims by moving its tail.
人間,"human being, person, man, mankind, humankind",すべての人間は法律的には対等である。,All human beings are legally equal.
物,"thing, object, article, stuff, substance",地震ほど怖い物はない。,Nothing is so terrible as an earthquake.
まで,"until, up to, till, to, as far as",市内までいくバス乗り場は、どこですか。,Where's the bus for the city?
やめる,"to stop (an activity), to cease, to discontinue",今日は雨降りなので、買い物はやめよう。,"It being rainy today, let's cancel our shopping."
だけ,"only, just, merely, simply, no more than",店にあるのは、これ一つだけです。,It is the only one there is in the shop.
しか,"only, nothing but",彼はせいぜい１０ドルしか持っていない。,He has not more than 10 dollars.
うち,"inside, within, while, during, among, amongst",若いうちに海外へ行かれることをお勧めします。,I advise you to go abroad while young.
ながら,"while, during, as",私は食事をしながら本を読みました。,I read a book while eating.
知らせ,"news, word, tidings, notice, notification, information",彼はその知らせにすっかり失望した。,He was very much disappointed at the news.
知る,"to be aware of, to know, to be conscious of, to cognize, to notice, to feel",彼はその結果を知って満足した。,He was satisfied to know the result.
顔,"face, visage, look, expression",なんとすてきな顔をしているのだろう。,What a nice face she has!
です,"be, is",日本では、月給です。,"In Japan, we are paid by the month."
では,"then, well, so, well the",では明日その事について彼に尋ねてみます。,"I will ask him about it tomorrow, then."
市,"city, market",当市には大気汚染はありません。,Our city is free from air pollution.
わかる,"to understand, to comprehend, to grasp, to see, to get, to follow",おっしゃる意味がわかりませんが。,What you said does not make sense.
上手,"skillful, skilled, proficient, good (at), adept, clever",夫は私より上手に料理する。,My husband is better able to cook than I.
彼女,"she, her, girlfriend",彼は彼女をとても魅力的だと思います。,He thought her very charming.
とは,indicates word or phrase being defined,社会と個人とは不可分である。,Society and the individual are inseparable.
強い,"strong, potent, competent, domineering, tough, intense, firm, fierce",きみの腕や足は十分に強くなった。,Your arms and legs have grown strong enough.
渡す,"to ferry across (e.g. a river), to carry across, to traverse, to lay across, to build across, to hand over, to hand in, to pass, to give, to transfer",それじゃあこのメモを渡してください。緊急です。,"Then, please give him this note. This is urgent."
ホテル,hotel,その町で最高のホテルはどこですか。,Which is the best hotel in the town?
返る,"to return, to come back, to go back, to become extremely, to become completely",今度日本に返って来られるのはずっと先のことでしょう。,I guess it will be a long time before I can return to Japan.
蛇,snake,私は蛇など全然怖くない。,I'm not in the least afraid of snakes.
クラス,class,そのクラスは５０人の学生から成っている。,The class consists of fifty students.
として,"as (i.e. in the role of), for (i.e. from the viewpoint of)",彼女は音楽家として初めて世に出た。,She made her first appearance as a musician.
担う,"to carry on one's shoulder, to shoulder, to bear, to take upon",この梱包材が断熱機能を担っている。,This packaging material provides heat insulation.
しかし,"however, but",しかしその答えはすべて間違っていた。,But the answers were all wrong.
出る,"to leave, to exit, to go out, to come out, to get out, to depart, to appear, to come out, to be published, to be issued, to be expressed",あなたの乗る電車は１０番線から出ます。,Your train leaves from Platform 10.
女,"female, woman",彼の娘は美しい女になった。,His daughter grew to be a beautiful woman.
入る,"to get in, to go in, to come in, to flow into, to set, to set in",私が部屋に入ると彼らは拍手した。,"As I entered the room, they applauded."
でしょうか,"don't you think?, indicates question",東京は今何時でしょうか。,What's the local time in Tokyo now?
考える,"to think (about, of), to think over, to ponder, to consider, to bear in mind",その問題は解決したものと考えた。,I considered the problem as settled.
山,mountain,私は若い頃よく山に行っていたものだ。,I would go to the mountains when young.
違う,"to differ (from), to vary, to not be in the usual condition, not match the correct answer",制服は学校によって違う。,Uniforms differ from school to school.
そして,"and, and then, thus, and now, and finally",そして何時間もいっしょに話したからです。,And we had spent hours talking together.
また,again,ミニスカートがまた流行している。,Mini-skirts are back in fashion again.
夜,"evening, night",夜になって、家へ帰った。,"When night came on, we returned home."
夏,summer,日本では夏は非常に暑い。,"In Japan, it is very hot in summer."
娘,"daughter, young girl",その娘はわっと泣き出した。,The girl burst into tears.
声,voice,彼女の声は震えていた。,There was a tremble in her voice.
舌,tongue,熱いスープで彼女の舌がやけどした。,Hot soup burned her tongue.
間違い,"mistake, error, blunder, mishap, improper conduct",彼の結論は完全な間違いであることが明らかになった。,His solution turned out to be a complete mistake.
そんな,"such, like that, that sort of",そんな些細な事は問題外だ。,Such a trivial thing is out of the question.
など,"et cetera, etc., and the like, and so forth",私はよい野菜や米、果物などを栽培したいのです。,"I want to grow good vegetables, rice, fruit and so on."
今,"now, the present time, just now",東京は今何時でしょうか。,What's the local time in Tokyo now?
妹,younger sister,私の妹は昨日神戸に行った。,My sister went to Kobe yesterday.
生まれる,to be born,彼は大阪で生まれた。,He was born in Osaka.
目,"eye, eyeball, eyesight, sight, vision, look, gaze",彼女の目の色は青です。,The color of her eyes is blue.
暮れる,"to get dark, to grow dark",冬の日は速く暮れる。,The night falls fast in winter.
出す,"to take out, to get out, to put out, to reveal, to show, to submit, to turn in, to send",外に出してやってくれませんか。,Could you let him out?
あなた,you,あなたはその規則を守らなければならない。,You must keep to the rules.
聞く,"to hear, to listen, to ask, to enquire",試合の結果について聞きましたか。,Have you heard about the result of the game?
円,"yen, Japanese monetary unit, circle",私は昨日２０万円の利益を得た。,"I profited 200,000 yen yesterday."
手,"hand, arm, forepaw, means, way, type, sort, ability to cope",彼は彼女の手をつかまえた。,He caught her hand.
そう,"so, really, seeming, appearing that, seeming that, looking like",喜んでそういたしましょう。,I'll do it with pleasure.
ちょうど,"exactly, precisely, just, right, as if, as though, quite",次の新幹線は９時ちょうどに出ます。,The next Shinkansen train leaves at just nine o'clock.
すれば,"if so, in that case, in that situation",さらに研究すればその理論が正しいことがわかるだろう。,Further study will prove that the theory is right.
出会う,"to meet (by chance), to come across, to run across, to encounter",たまたま私は彼女と東京で出会った。,It happened that I met her in Tokyo.
家,"house, residence, dwelling, family",私の家の庭には昔菜園があった。,There used to be a vegetable garden in our yard.
認める,"to recognize, to recognise, to observe, to notice, to assess, to approve, to admit, to watch steadily, to appreciate, to acknowledge",誰もがその少年を本物の天才と認めている。,Everyone recognizes the boy as a real genius.
いい,"good, excellent, fine, nice, pleasant, agreeable",いい考えが心に浮かんだ。,A good idea entered my mind.
これ,this,これ以上まけられませんか。,Is this the last price?
なに,what,病院の後ろにあるあの建物はなんですか。,What's that building at the back of the hospital?
雨降り,"rainfall, rainy weather, rainy, wet",今日は雨降りなので、買い物はやめよう。,"It being rainy today, let's cancel our shopping."
運転免許,"driver's license, driver's licence",君は運転免許を取るには、まだ若すぎる。,You're still too young to get a driver's license.
目下,"at present, now",その家は目下建築中である。,The house is now under construction.
日本経済,Japanese economy,今年の日本経済の成長率は０.７％を超えるだろう。,The growth rate of the Japanese economy will top 0.7% this year.
チェックアウト,check-out,チェックアウトしたいのですが。,I'd like to check out.
皿,"plate, dish, platter, disc, serving, helping, course",彼女は皿を洗い、それから乾かした。,She washed the dishes and she dried them.
中心,"center, centre, middle, heart, core, focus, pivot, emphasis, balance, -centered, -focused",その町は成長して経済の中心となった。,The town developed into the center of the economy.
ごめん,"your pardon, sorry, no thanks",ごめん。道が混んじゃって。,Sorry. Traffic was heavy.
米,(husked grains of) rice,私はよい野菜や米、果物などを栽培したいのです。,"I want to grow good vegetables, rice, fruit and so on."
嬉しい,"happy, glad, pleased, delighted, overjoyed, joyful, delightful",君に会うのはいつだってうれしいことです。,To see you is always a great pleasure.
無言,"silence (not speaking), muteness",彼女の悲しみは無言でこぼす涙になって表れた。,Her sorrow found expression in silent tears.
異常,"strangeness, abnormality, disorder",彼女の異常なふるまいから何を推測しますか。,What do you infer from her strange behavior?
責任,"duty, responsibility (incl. supervision of staff)",誰にその事故の責任があるのか。,Who is to blame for the accident?
苦労,"trouble, hardship, difficulty, labour, labor, toil, pains, anxiety, worry, concern, cares",だれでも苦労の無い生活を望んでいる。,Every one wants to live free from care.
一歩,"(a) step, level, stage, small degree, small amount",一歩でも動いてごらん、崖から落ちてしまうよ。,"A single step, and you will fall over the cliff."
品,"article, item, thing, goods, stock",この品の税金分はむこうでお支払い下さい。,Please pay the tax on the items over there.
殴る,"to strike, to hit, to beat, to punch",彼は荒々しいサッカーの試合の間、鉄の棒で殴られた。,He was beaten with an iron rod during a violent soccer match.
勤める,"to work (for), to be employed (at), to serve (in), to serve (as), to act (as)",彼女は商事会社に勤めている。,She is employed in a trading company.
女中,"maid, female servant, hostess (in a ryokan), waitress (in a traditional restaurant)",その劇で彼女は女中と女店員との二役を努めた。,In the play she doubled the parts of a maid and shop girl.
悟る,"to perceive, to sense, to discern, to understand, to comprehend, to realize",そのときになって初めて私は自分の誤りを悟った。,It was not until then that I realized my mistake.
役者,"actor, actress",この役者のことはいままで聞いたことがない。,I've never heard of this actor.
データ,"data, datum",天気の予報は過去のデータに基づいて行われる。,"The weather is forecast, using the past data as a basis."
素人,"amateur, layman, ordinary person, novice",彼はしろうとの庭師だが、彼の育てる花は美しい。,"He is an amateur gardener, but his flowers are beautiful."
蝶,butterfly,少女たちはさながら蝶のように軽やかに踊っていた。,The girls were dancing lightly like so many butterflies.
革命,revolution,革命は新たな時代をもたらした。,The revolution brought in a new era.
洞窟,"cavern, cave, cave system, grotto",私たちはそのまま洞窟の口にボートで突っ込んで行きました。,We plunged into the cave opening on our boat and continued on.
ニコニコ,"with a friendly grin, smilingly",写真に写っている人は皆にこにこしている。,Everybody in the picture is smiling.
緑色,"green, emerald green, green color of new foliage, verdure",緑色である事がその種のりんごの特徴なのです。,A green color is a characteristic of that type of apple.
チェック,"check, plaid, checkered, checking, monitoring, looking over",少女は自転車の後部をチェックしている。,The girl is checking out the rear of the bicycle.
湿る,"to become damp, to become moist, to become wet, to lack energy, to be in a slump",太陽と湿った気候が熱帯雨林を作った。,The sun and a damp climate made the tropical rainforest.
仲良く,"on good terms with, on cordial terms with, getting along well with, to get along with",私たちは隣近所とは仲良くしている。,We get on well with our neighbors.
ゴール,"goal, basket (basketball), finishing line, winning post",彼はボールをゴールに蹴り入れた。,He kicked the ball into the goal.
救急車,ambulance,病人は救急車で病院へ急いで運ばれた。,The sick person was rushed to the hospital in an ambulance.
パトカー,patrol car,私たちはパトカーが全速力で走っているのを見た。,We saw a patrol car running at full speed.
勘弁,"pardon, forgiveness, forbearance",ちょっと勘弁して下さい。,"Give me a break, will you?"
血液,blood,適度な運動は血液の循環を活発にする。,Moderate exercise stimulates the circulation of blood.
赤ちゃん,"baby, infant",私は赤ちゃんが目を覚まさないようにつま先で歩いた。,I walked on tiptoes so as not to wake the baby.
そそぐ,"to pour (into), to sprinkle on (from above), to water (e.g. plants), to pour onto, to spray, to flow into (e.g. of a river), to run into, to drain into",彼女は洗面器に水を注いだ。,She poured water into the basin.
そそぐ,"to pour (into), to sprinkle on (from above), to water (e.g. plants), to pour onto, to spray, to flow into (e.g. of a river), to run into, to drain into",小川が湖に注いでいる。,A stream flows into the lake.
越し,"across, over, beyond, through, crossing, throughout (a period of time), for",彼は眼鏡越しに私をにらみつけた。,He looked sharply at me over his spectacles.
打撃,"blow, shock, strike, damage, batting",円高はその会社にとって致命的な打撃だった。,The strong yen was a fatal blow to the company.
承諾,"consent, approval, acceptance, agreement, compliance",私はその計画を承諾することができません。,I cannot approve the project.
脅迫,"threat, menace, coercion, terrorism",彼女は彼の発言を脅迫と解釈した。,She interpreted his remarks as a threat.
転じる,"to turn, to shift, to alter, to distract",災いを転じて福としなさい。,Turn your misfortune to account.
溝,"ditch, drain, gutter, trench, groove, tread, gap (between people, countries, etc.), gulf",彼はその浅い溝を飛び越えた。,He leaped over the shallow ditch.
ランチ,lunch,日時を決めて一緒にランチを食べよう！,Let's set a time and day and have lunch together!
便り,"news, tidings, information, correspondence, letter",便りがないのは良い知らせ。,No news is good news.
花壇,flower bed,花壇のチューリップが咲いている。,The tulips are in bloom in the flower bed.
地形,"terrain, geographical features, topography",地形測量。,A topographical survey.
仕事場,"place where one works, construction site, working area",彼は仕事場でテーブルを作っているところだ。,He's making a table in his workshop.
出産,"childbirth, (giving) birth, delivery, parturition, confinement, production (of goods)",彼女は健康な赤ん坊を出産した。,She gave birth to a healthy baby.
おめでとう,congratulations!,誕生日おめでとうございます。,Happy birthday!
痛手,"serious wound, hard blow",彼の死は我が社にとって大きな痛手であった。,His death was a great loss to our firm.
長女,"eldest daughter, first-born daughter",彼は二番目のレストランの経営を、長女にまかせた。,He put his eldest daughter in charge of his second restaurant.
身震い,"shivering (with cold), trembling (with fear), shuddering",彼女は恐ろしくて身震いした。,She trembled with fear.
交差点,"crossing, intersection",あの交差点で何が起こったのか。,What happened at that crossing?
コーラ,cola (carbonated soft drink),ポテトのＬを１つ、コーラのＭを２つ。,One large fries and two medium cokes.
ぎこちない,"awkward, clumsy, stiff, crude, unrefined, constrained",彼は動作がぎこちない。,He is awkward in his movements.
ぎこちない,"awkward, clumsy, stiff, crude, unrefined, constrained",彼は作法がぎこちない。,He is awkward in his manners.
キット,kit,配線を間違えないように注意してキットを組み立てた。,I built the kit taking care not to make mistakes in the wiring.
差し支える,"to interfere, to hinder, to become impeded",大丈夫よ！私は飲んでも運転に差し支えない。,I'm fine! I can drink and not be affected by driving.
