Words,Meaning,Sentences,Translation
現れ,"embodiment, manifestation, materialization, materialisation, expression, indication",それは彼女の性格の表れだ。,It is an index of her character.
見直し,"review, reconsideration, revision",見直をしようじゃないか。,"Let's review it, shall we?"
社会党,Socialist Party,社会党が大統領候補として立つ準備を彼にさせた。,The Socialist Party groomed him as a presidential candidate.
決算,"settlement of accounts, closing accounts, financial results",その会社は毎年３月に決算をする。,The company closes its books at the end of March.
冷戦,cold war,冷戦の緊張が高まった。,Cold-war tension has mounted.
現行,"present, current, in operation",現行の法律は人種の多様性を考慮していない。,Existing legislation does not take diversity of races into account.
鑑賞,"appreciation (of art, music, poetry, etc.)",彼は文学を正しく鑑賞できるようになった。,He learned to appreciate literature.
必然的,"inevitable, necessary",それは必然的に延期しなければならない。,"It must, of necessity, be postponed."
気合,"(fighting) spirit, motivation, effort",チームは試合に向けて気合いが入っている。,The team is up for the game.
プリント,"print, copy, handout, flyer",先生は生徒たちにプリントを配布した。,The teacher distributed the handouts to the students.
肝臓,liver,私は肝臓の病歴がある。,I have a history of liver trouble.
配給,"distribution (e.g. films, rice), rationing (e.g. food, gasoline), food ration",彼らはパンと牛乳の追加配給を交渉で決めた。,They bargained additional rations of bread and milk.
一等,"first-class, first-rank, the most, the best",彼はそのコンテストで一等になった。,He got the first prize in the contest.
強固,"firm, strong, solid, stable",彼は強固な性格の人物だ。,He is a man of firm character.
動物園,"zoo, zoological gardens",私はその有名な動物園をたずねるつもりだ。,I am going to visit the famous zoo.
着用,"wearing (e.g. uniform, seat belt), having on",従業員は制服を着用しなければならない。,Employees are required to wear uniforms.
とする,"to try to ..., to be about to do",彼は深く感動して、感謝の言葉を述べようとした。,"Deeply moved, he tried to express his thanks."
進む,"to advance, to go forward, to precede, to go ahead",船は目的地に向かって進んだ。,The ship proceeded to her destination.
外,"outside, exterior",外からの圧力がますます激しくなってきている。,External pressure grows ever more intense.
だから,"so, therefore",彼女は行くように頼まれた、だから出かけた。,"She was asked to go, and she left accordingly."
だろう,"seems, I think, I guess, I wonder, I hope",私たちが宇宙旅行を楽しめる日がくるだろう。,The day will come when space travel becomes possible.
戻る,"to turn back (e.g. half-way), to return, to go back",待ってろよ、すぐ戻るから。,Wait for me. I'll be back in no time.
診る,to examine (medically,急患で診ていただきたいのですが。,I need medical help.
君,"you, buddy, pal",君の自慢話はもう聞き飽きた。,I'm tired of hearing your boastful tales.
ふたり,"two persons, two people, pair, couple",二人が幸せでありますように。,May you both be happy!
のに,"although, despite, even though, and yet, whereas, while, if only, I wish, in order to",この本を読むのに２時間かかります。,It takes two hours to read this book.
弟,"younger brother, little brother",弟は記憶力がいいです。,My brother has a good memory.
弾く,to play (a stringed or keyboard instrument),彼らはギターを弾くことができる。,They can play the guitar.
方,"direction, way, method",彼女のテントの張り方を実演しながら教えた。,She gave an illustration of how to pitch a tent.
方,"person, person in charge of",担当の方はどなたですか。,Who is the person in charge?
だろうか,"don't you think?, indicates question",一体その報告は本当だろうか。,Can the report be true?
鳴く,"to sing (bird), to make sound (animal), to call, to cry, to chirp",その動物はキーキー鳴いた。,The animal made a squeaking sound.
ほど,"degree, extent, bounds, limit, upper limit",彼はその質問に答えられるほど賢かった。,He is so clever that he could answer the question.
だと,if it's the case,嵐の日に山に登るのは危険だと思う。,I think it's dangerous to climb a mountain on a stormy day.
所,"place, spot, scene, site",彼らはその建物の見える所へやってきた。,They came in sight of the building.
ところ,"point, aspect, side, facet",この電子辞書は携帯しやすいところが味噌です。,The good thing about this electronic dictionary is that it's easy to carry.
話,"talk, speech, chat, conversation, (made-up) story, tale, yarn",さえぎらないで私の話を最後まで聞いてください。,"Don't interrupt me but hear me out, please."
もう,"now, soon, shortly, before long, presently",９時ですからもう失礼します。,It is nine. I'm afraid I must be leaving now.
もう,"already, yet, by now, (not) anymore",私はもうそれをやってしまった。,I have done it already.
より,"than, from, out of, since, at, on, except, but, other than",彼は私よりピアノがうまい。,He can play the piano better than I.
持つ,"to hold, to take, to possess, to have, to own, to maintain, to keep, to carry",あなたの鞄をお持ちしましょうか。,Shall I carry your bag?
回,counter for occurrences,私は３回京都を訪れたことがあります。,I have visited Kyoto three times.
伝わる,"to be handed down, to be introduced, to be transmitted, to be circulated, to go along, to walk along",私の意図は十分あなたに伝わった。,My intentions reached you clearly enough.
私用,"personal use, private use, private business, personal business",上司は会社の電話で私用の電話をかけたといって私をひどく叱った。,My boss called me down for making private calls on the office phone.
内部,"interior, inside, internal",この図解は地球の深い内部を示している。,The illustration shows the deep interior.
まだ,"still, yet, not yet",この事に加えて、ほかにもまだ理由がある。,"In addition to this, there are other reasons."
なら,"if, in case, if it is the case that",きみは必要なら、この辞書は持ってていいよ。,You can keep this dictionary if necessary.
ならば ,"if, in case, if it is the case that",もしも、音楽が愛の糧であるならば、奏で続けよ。,"If music be the food of love, play on."
自分で,"by myself, in person, by oneself",学生には自分で発見させるようにした方がいい。,You had better leave the students to find out for themselves.
言葉,"words, phrase, term, expression, remark, speech",お言葉を心に銘記いたします。,I will bear your words in mind.
時,"hour, o'clock, (specified) time, when, during",列車は五時ちょうどに発車した。,The train left at five o'clock to the minute.
何か,"something, somehow, for some reason",何か目印がありますか。,Are there any landmarks?
俺,"I, me",俺にはお前の心の音が聞こえる。,I can hear the sound in your mind.
何時,what time,到着時刻は何時ですか。,What is the arrival time?
空,"sky, the air, the heavens, weather",空は花火で光り輝いていた。,The sky was ablaze with fireworks.
年,"year, years, age",その年の鉄鋼生産は記録に残る最高水準だった。,Steel production of the year was the highest on record.
大切,"important, necessary, indispensable",私は私たちが冷静にしていることが大切だと思う。,I think it important that we should keep calm.
助け,"assistance, help, aid, support",彼は助けに来たとゆうより邪魔しに来た。,"He didn't come to help, but to hinder us."
下,"below, down, under, bottom, beneath",彼はそれを上着の下から出した。,He took it from beneath his coat.
嫌,"disagreeable, detestable, unpleasant",この卵は嫌な匂いがする。,This egg has a bad smell.
湖,lake,その湖の水はとても冷たい。,The water of the lake is very cold.
しまった,"darn it!, darn!, oops!, oh dear!, oh no!",しまった、ガットが切れた。,"Oh, no. I broke a string in my racket."
席,"seat, location (of a gathering, etc.), place, position, post",この席はどのあたりでしょう？,Where's this seat?
けど,"but, however, although",全然部屋に似合わないけど、貰ったから良し！,"It doesn't go with the room at all, but I got it for free so it's all good!"
けれど,"but, however, although",その音はいらいらさせるけれど人体には無害です。,The sound was annoying but harmless to the human body.
けれども,"but, however, although",私は疲れていたけれども、働き続けた。,"Tired as I was, I went on working."
ここ,here,ここから歩いて２時間もの距離だ。,It is no less than two hours' walk from here.
湧く,"to well (up), to gush forth (of water), to spring out, to surge, to appear, to feel emotions from",いざとなれば勇気が湧いてくる。,Your courage will come out in a crisis.
体,"body, torso, trunk, build, physique",ボクサーは試合を前にして体を鍛えていた。,The fighter toughened up for the bout.
感じる,"o feel, to sense, to experience",今朝は外気が冷たく感じる、もう冬が近づいている。,The air feels cold this morning; winter is approaching.
ましょうか,"shall I?, shall we?",後で電話をかけましょうか。,Shall I call you up later?
口,"mouth, opening, entrance, exit",その言葉はふと彼の口から漏れた。,That word dropped from his mouth.
開く,"to open, to undo, to unseal, to unpack, to hold (meeting, etc.)",彼はできるだけ早く会が開かれることを提案した。,He suggested that a meeting be held as soon as possible.
部屋,"room, chamber, apartment, flat, pad",彼は自分の部屋で音楽を聴いた。,He listened to music in his room.
折れる,"to break, to be broken, to snap, to fracture, to be folded, to give ib, to yield",医者は彼の折れた足をついだ。,The doctor set his broken leg.
橋,bridge,費用は別として、その橋を築くには長い時間がかかるだろう。,"Apart from the cost, it will take long to build the bridge."
そう,"in that way, thus, such",冗談のつもりでそう言ったんだ。,I said so by way of a joke.
うち,"house, home (one's own)",うちは明日来客があります。,We will have some guests tomorrow.
先,"previous, prior, former, first, earlier, some time ago, preceding, ahead, the other side, tip, end",荷物は先に送っておきなさい。,Send your baggage in advance.
解く,"to untie, to unfasten, to unwrap, to undo, to unbind, to unpack, to unsew, to solve, to dispel, to dissolve, to release, to relieve, to comb out",その問題を解くのに私は５分かかった。,The solution of the problem took me five minutes.
行く,"to go, to move, to proceed, to take place",私は外国へ行くつもりだったが。,I intended to have gone abroad.
ただ,"ordinary, common, usual, free of charge, only, merely, but, however",入場料はただだった。,Admission was free.
人気,"popularity, public favor, condition (e.g. market), tone, character, nature",その歌手は若者たちの間で人気があります。,The singer is popular among young people.
火,"ire, flame, blaze",寒かったので、我々は火を燃やした。,"It being cold, we made a fire."
件,"matter, case, item, affair, subject",その件については常に私に知らせるようにしてください。,Please keep me informed of the matter.
よく,"nicely, properly, well, skillfully, skilfully, frequently, often",本当によく似合う。,It really suits you.
椅子,"chair, stool, post, office, position",私達は壊れた椅子を直した。,We mended some broken chairs.
それに,"besides, in addition, also, moreover",それに私も加えておいて。,Count me in.
死ぬ,"to die, to pass away, to lose spirit, to lose vigor, to cease, to stop",彼は自分の一生に満足して死んだ。,He died content with his life.
上,"above, up, over, elder, top, summit, surface, before, prevoius",きれいな鳥が木の上を飛んでいる。,Some pretty birds are flying above the trees.
笑う,"to laugh, to smile",先生は生徒たちを笑わせた。,The teacher amused the pupils.
大,"the large part of, big, large, great",彼女は大科学者になるという夢を実現した。,She realized her ambition to become a great scientist.
ひとつ,one,私たちは君に一つ忠告したい。,Let us give you a piece of advice.
誤り,"error, mistake, slip, bug",この報告書には誤りがない。,This report is free from errors.
とか,"among other things, such things as, or something like that",しかめ面は怒りとか不快感を表現するものである。,A frown may express anger or displeasure.
まま,"as it is, as one likes, because, as",私はひと晩窓を開けたままにしておいた。,I left the window open all through the night.
みんな,"all, everyone, everybody",賛成の人は皆手を挙げた。,All those in favor held up their hands.
頭,head,彼は頭をまっすぐにしていた。,He held his head straight.
ばかり,"only, merely, nothing but, no more than",彼女は親切なばかりではなく正直な人です。,"She is not only kind, but also honest."
すみません,"excuse me, pardon me, I'm sorry, thank you",すみません、このチケットは変更できません。,"I'm sorry, we can't make flight changes on this ticket."
マイル,mile,村までせいぜい２マイルだ。,It is not more than two miles to the village.
友,"friend, companion, comrade, pal",友に変わり彼はその責任を引き受けるつもりだ。,He will take on the responsibility for his friends.
同じ,"same, identical, equal, uniform, equivalent, similar",彼らはほぼ同じ年齢です。,They are about the same age.
なんて,"such as, (things) like",なんて大きなスーパーだ。,What a big supermarket!
増す,"to increase, to grow",好天気が私達の旅の楽しみを増した。,Fine weather added to the joy of our trip.
能力,"ability, faculty",彼が成功したのは能力と勤勉さのおかげだ。,He owed his success to both ability and industry.
日,day,土日月の午前１０時半から午後４時まで開館。,"Open from 10:30am to 4pm on Sat, Sun, and Mon."
かもしれない,"may, might, perhaps, may be, possibly",それは今にも起こるかもしれない。,It may occur at any moment.
歩く,to walk,ここから歩いて２時間もの距離だ。,It is no less than two hours' walk from here.
気,"spirit, mind, heart, nature, disposition, mood, feelings",彼は年はとっているが気は若い。,"Though he is old, he has a youthful spirit."
捕る,"to take, to catch, to capture",彼らは捕り立ての魚を朝市で売ってくれる。,They sell us freshly caught fish in the early morning market.
敵,"opponent, rival, adversary, danger, threat",彼は敵を料理した。,He easily licked his opponent.
姿,"figure, form, shape, appearance, guise, image",ほっそりとした姿に対する若い女性の願望は強い。,Young girls' desire for slim figures is strong.
待つ,to wait,電話を切って少々お待ち下さい。,"Hang up and wait a moment, please."
だって,"after all, because, but, even",子供にだってそんな事は分かる。,Even children can understand it.
こんな,such,こんなすばらしい映画を見たことがありますか。,Did you ever see such a film?
答える,"to answer, to reply",彼はその質問に対して親切に答えた。,He responded kindly to the question.
少し,"small quantity, little, few, something",日本語が少し話せるからね。,You know some Japanese.
乗り遅れる,"to miss (a train, bus, etc.), to fail to keep up with",我々は列車に乗り遅れないよう早く出発した。,We started early so as not to miss the train.
ちょっと,"a little, a bit, slightly",ちょっといっぱいやりながら話そう。,Let's have a talk over a couple of drinks.
冊,counter for books,机の上に数冊の本がある。,There are some books on the desk.
どのように,"how, in what way",内訳はどのようにしましょう？,How would you like these items?
多い,"many, numerous, a lot",新潟は雪が多い。,They have much snow in Niigata.
動く,"to move, to stir, to shift, to operate",その氷河はゆっくりではあるが動いている。,The glacier moves but by inches.
書く,"to write, to compose, to pen",もし彼の住所を知っていたら手紙をかくだろう。,"If I had known his address, I would have written."
心,"mind, heart, spirit",お言葉を心に銘記いたします。,I will bear your words in mind.
買う,"to buy, to purchase",母は弟に黄色い傘を買ってやった。,Mother bought my brother a yellow umbrella.
